date_time,city,state,shape,duration,summary
3/23/16 20:40,Largo,FL,Light,5 minutes,3 lights in sky in triangle formation which eventually separated very quickly.
3/22/16 22:53,Poinciana,FL,Triangle,2 hours,I was watching the full moon through my window when I see a strange lightIt is moving fastI called my husband and sonand they were a
3/22/16 08:43,New Port Richey,FL,Oval,2 minutes,White oval object moving from East to West
3/19/16 01:00,DeLand,FL,Cone,2 hours,((HOAX??)) We observed a craft covered in orange lights hovering in the lake. There were 2 smaller saucer shaped craft hovering.
3/18/16 21:00,Eau Gallie,FL,Fireball,45 seconds,Red/white fireball in Melbourne Florida.
3/18/16 21:00,Barefoot Bay,FL,Fireball,2-3 minutes,It looked like a fireball slowly moving from South to North.
3/18/16 20:00,Port St. Lucie,FL,Fireball,5 minutes,4 fireballs hovering close above.
3/17/16 19:28,Zephyrhills,FL,Fireball,25 seconds,Watched a fireball enter the atmosphere then change into what was perceived as a star. Then 5 or so seconds later another showed up. Af
3/16/16 21:00,Ormond Beach,FL,Fireball,10 seconds,We saw a sparking fireball in the night sky.
3/15/16 19:28,Fort Lauderdale,FL,Fireball,3 minutes,Fireball at dusk in south Florida.
3/15/16 02:30,DeLand,FL,Cross,5-7 minutes,I was on the backside of Blue Lake looking at the stars with my friend. I noticed an intense orange circular glow up in the Northern sk
3/15/16 00:05,South Pasadena,FL,Formation,90 seconds,Odd lights in sky over South Pasadena Florida.
3/14/16 20:55,Brooksville,FL,Other,5 minutes,Slow moving circular segment with bright lights traveling low in the sky.
3/14/16 13:01,Orlando,FL,Cigar,10 seconds,Looking East over Hiawassee Road I saw a bright light in the sky. The light was cigar shaped. It was reddish orange on the top half
3/12/16 23:55,Ft. Pierce,FL,Circle,10 seconds,Reddish/orange circular hazy glowing light moving north along the west edge of Indian River.
3/12/16 23:30,Deltona,FL,Triangle,driving down Saxon blvd,((HOAX??)) It was large triangular and it hovered for about 20 seconds and then flew away silently.
3/12/16 19:45,West Palm Beach,FL,Disk,30 seconds,Two crafts with orange pulsating glow coming from under belly travelling from East to West at slow speed vanished progressively.
3/11/16 21:00,Venice,FL,Disk,10 minutes,Could not hear any sounds coming from objects it was dark tried binoculars couldn't bring into focus.
3/11/16 20:30,Jacksonville Beach,FL,Unknown,Few minutes,2 untrained observers saw 1 object that was a bright light that quickly changed colors repeatedly. I aas too far away to say anything m
3/10/16 21:03,Ponte Vedra,FL,Circle,4 seconds,Object moving ~7° L of ursala major at ~5°-7° slant fron sky to earth. 4 sec or less. Magnitude of 4 or brighter than a/c.
3/10/16 19:05,Port Saint Lucie,FL,Cylinder,,I did not see a thing and either did my older son I did feel very fast blast of heat from my feet. ((NUFORC Note: Moth? PD))
3/10/16 04:10,Pensacola,FL,Unknown,30-45 seconds,Bright round pinpointed flashing white light traveling from the north to the south at a high altitude.
3/9/16 19:00,Jacksonville Beach,FL,Cylinder,30 seconds,Orange lantern-like glowing fast fireball that made no sound.
3/8/16 04:00,Brooksville,FL,Unknown,10 minutes,The light changed from bright to dull and changed speed from stopped to go.
3/7/16 21:00,Ocklawaha,FL,Disk,2 minutes,((HOAX??))Silver color saucer shape w/ red and white lights blinking flying through the pm skyand diamond shape ships flying hovering
3/6/16 18:50,Merritt Island,FL,Light,20 minutes,Lights moving North east to south west
3/5/16 21:45,Middleburg,FL,Light,2 minutes,White ball of light.
3/5/16 17:45,Pasco County,FL,Oval,:45,Blue-green sphere seen at 8:00 position from the sun during sunset on 3/5/2016 . ((NUFORC Note: Lens flare in photo of Sun. PD))
3/4/16 19:40,Seminole,FL,Light,2 minutes,Two unidentified rather large red lights heading East and then slowly dim fading away.
3/4/16 19:00,Merritt Island,FL,Sphere,1.5 minutes,Nine orange glowing orbs following same general path from east to west.
3/4/16 09:00,Ocklawaha,FL,Flash,nite,White diamond shape seems to move different places also white flashes changing directions.
3/3/16 20:30,Everglades,FL,Circle,5 minutes,Two round bright objects hovered over the Everglades for about 5 minutes then shot up into the clouds.
3/2/16 16:38,Delray Beach,FL,Cigar,30 minutes,Second sighting of a Bright Rectangular shaped object over the Atlantic Ocean in Delray Beach Fl within 2 weeks.
3/2/16 01:00,Boynton Beach,FL,Sphere,,Red and white lights sphere figure stayed in the same spot for four hours in my backyard.
3/1/16 22:30,Ocala,FL,Triangle,5 minutes,Triangular wedge-shaped UFO with green lights hovering at cloud level above the Ocala National Forest.
3/1/16 21:00,Ocala,FL,Oval,My home,For a couple of months now I see in the woods next to where I live around 8:00 PM every night the woods start to have real bright light
3/1/16 21:00,Shalimar,FL,Other,2 minutes,2 bright star like objects not moving but rather floating then just disappear.
2/29/16 23:30,Sebastian,FL,Triangle,20-40 minutes,6 low flying craft with loud engines and 2 white lights on wings and 2 red flashing lights near center
2/29/16 19:00,Sarasota,FL,Circle,4 minutes,"Two bright orange orbs were moving west to east one behind the other. They seemed to have a ""gassy"" look and sparks were falling."
2/27/16 20:00,Plam Bay,FL,Sphere,5 minutes,Orange glowing lights over Palm Bay.
2/27/16 20:00,Holiday,FL,Fireball,45-60 seconds,My stepfather saw them first as he was driving home he called my mother and I out once he drove up and toward the south west from our
2/27/16 15:30,Delray Beach,FL,Cigar,45 minutes,Bright rectangular shaped object over the Atlantic Ocean in Delray Beach FL.
2/26/16 09:45,Niceville,FL,Fireball,1 minute,4 large fireballs veritical line slow moving and spaced perfectly.
2/25/16 00:00,Jacksonville,FL,Circle,2 sequential nights,((HOAX??)) I stepped outside during night hours and look up to the sky because I'm a skeptic. Started seeing these odd white lights.
2/22/16 23:50,Ft. Myers,FL,Light,30 seconds,Very quick moving yellow/orange light moving away from me below clouds went over horizon and did not see again
2/22/16 13:00,Odessa,FL,Circle,1 minute,On February 22 2016 at approx. 13:00 hrs. this obj. in the photo flew by in a NE dir.. ((NUFORC Note: Lens flare from Sun. PD))
2/21/16 03:00,Miami,FL,,Unknown,My husband had some very disturbing nightmares and wakes up shaken and with a horrible migraine and our bed is soaked in sweat under hi
2/20/16 19:40,Lakeland,FL,Circle,2 minutes,Eight gold colored orbs of light.
2/17/16 19:45,Cape Coral,FL,Triangle,6 minutes,Florida is a Hot Spot for Black Budget aircraft and Space Capable vehicles
2/17/16 19:30,Miami (Suburbs),FL,Triangle,10 minutes,Triangle formation three lights proceeding one red light.
2/14/16 20:20,Orlando,FL,Light,2 minutes,Saw 9 reddish/orange lights flying in very slow formation for approximately 2 before disappearing behind clouds.
2/14/16 18:30,Naples,FL,Cylinder,5 minutes,Bright-orange glowing object moving at a fast pace across the sky and suddenly vanishing.
2/14/16 07:30,Pinellas,FL,Fireball,6 seconds,I was driving my car and caught site of what i thought was a craft or meteorite falling to earth i was awaiting the explosion but never
2/12/16 23:00,Fort Lauderdale,FL,Changing,30 minutes,Light beings bring ships onto sand @ Ft. Lauderdale Beach
2/11/16 19:40,Tampa,FL,Oval,15-30 minutes,Large bright white/blue orb or saucer hovering in the sky. ((NUFORC Note: Sighting of Sirius?? PD))
2/10/16 06:15,Cutler Bay,FL,Fireball,3 minutes,This morning at approximately 6:15 I was standing on my front porch facing due south. It was still dark when I looked up at 90 degrees
2/9/16 05:00,Perrine,FL,Rectangle,2 minutes,Elongated fiery objects flying vertically in a decending motion.
2/8/16 13:00,West Palm Beach,FL,Other,2-3 minutes,Was approximately 13:00 give or take a few min. I was standing outside.The sky was very clear except for some downward looking wisps ab
2/7/16 15:30,Miami,FL,Disk,4 seconds,White/transparent disc like shaped object flying at low altitude over Tamiami Trail West. Duration: 3-4 secs
2/7/16 11:50,Palm Beach Gardens,FL,Other,45 seconds,Three sphere-shaped UFO's were seen high up in the sky in broad daylight. One of them was ahead of the other two which were doing cro
2/4/16 20:30,Bradenton,FL,Oval,15 seconds,Lightning style beam from ground to mid sky then an oval shape appeared with glowing pulsating white lights.
2/2/16 20:15,North Port,FL,Circle,30 minutes,Approximately 50 red circles of lights travelling in a northerly direction. Some clusters; variations in speed and position.
2/1/16 19:30,Port Orange,FL,Fireball,5-10 minutes,5 orange lights over Daytona FL.
1/31/16 03:17,Port Charlotte,FL,Unknown,15 seconds,Sitting on porch and saw bright flash across sky through trees. No direct visual of an object. Thought it may have been lightning.
1/30/16 20:00,Middleburg,FL,Sphere,6 minutess,Seven orange lights fly over SW Jacksonville
1/29/16 18:45,Umatilla,FL,Formation,8 seconds,4 silent fiery lights heading towards Ocala National Forest NNW from Umatilla Jan 29th 2016 at 1845
1/25/16 19:00,Boynton Beach,FL,Rectangle,7 minutes,We were (my husband was driving and I was the passenger) traveling north on Congress Ave. Boynton Beach
1/17/16 15:00,Ponte Vedra,FL,Formation,5 minutes,10 oblong metallic objects creating formations high in air
1/16/16 17:54,Deerfield Beach,FL,Circle,3 minutes,2 dark circles moving parallel in the sky and disappearing abruptly after few minutes
1/14/16 07:20,Bradenton,FL,Other,2-3 minutes,Unexplained Sighting Over BRADENTON FL *January 14th 2016 7:20 a.m *
1/13/16 06:30,Winter Park,FL,Rectangle,5 minutes,Wide object (football field plus) with bright white lights and two flashing
1/6/16 05:45,Sarasota,FL,Triangle,15 minutes plus,Triangle bright light hovering low altitude.
1/4/16 19:30,Sarasota,FL,Oval,5 minutes,Three large red lights hovered over neighborhood in Sarasota FL
1/3/16 22:40,Delray Beach,FL,,,It looked like a plane flying very low I followed it so it pulled back up and the orange lights turned off. I thought my mind was playi
1/2/16 05:30,Hollywood,FL,Circle,>1 hour,It was completely stationary and shaped like a ring. We looked at it through binoculars. It had four lights side by side.
1/1/16 12:10,Amelia Island,FL,Circle,30 seconds,An Orange Circle Object Flying in the Sky at Amelia Island.
1/1/16 00:12,Malabar,FL,Oval,25 minutes,Eight orange orbs flew over my house minutes apart in the same pattern with three witness.
1/1/16 00:05,Titusville,FL,Sphere,15 minutes,1 Jan 2016 12:05AM Observed three red-orange spherical objects traveling in a line from SW to TE over the northern end of Brevard Coun
1/1/16 00:02,Satellite Beach,FL,Sphere,10 minutes,Around the midnight my wife and I went out to our porch watch the fireworks. Several single objects with orange haze traveling steady.
12/31/15 23:45,Port Saint Lucie,FL,Sphere,8 minutes,"Very odd. At about 11:45 pm on New Years Eve I what appeared to be 2 orange ""orbs"" moving from the SE to NW direction."
12/31/15 22:00,Titusville,FL,Light,5 minutes,Saw 2 orange orbs rise from wooded land west of Titusville head east and then follow I-95 north for several minutes.
12/31/15 01:00,Miami,FL,Sphere,30 minutes or more,Large number of red-orange spheres over Miami.
12/29/15 21:00,Brandon,FL,Oval,30 minutes,Hovering blimp-like structure someone else must have seen it.
12/29/15 20:07,Palmetto,FL,Fireball,1 minute,Sitting outside super clear dark night when we saw a fireball floating in the sky heading south to north no sound no tail...
12/29/15 04:40,Jacksonville,FL,Sphere,2 minutes,I noticed the moon had a ring around it and then saw a multi colored object in the sky.
12/26/15 20:00,Sarasota,FL,Fireball,3 minutes,Orange light.
12/26/15 18:45,Cape Coral,FL,Other,30-40 seconds,It looked exactly like a falling star but when it entered what i thought was the atmosphere it probably leveled out a couple miles.
12/25/15 21:00,Cape Coral,FL,Light,15 minutes,We had spend an couple hours enjoying a very small fire in a rock fire pit in our back yard. The fire was out down to embers.
12/25/15 00:05,Palm Beach Gardens,FL,Triangle,5 seconds,I came out my house right after midnight Christmas Eve to take some stuff from my car and happened to see this object with rectangular.
12/24/15 21:15,Port St. Lucie,FL,Sphere,10 seconds,Rudolph's red nose ? big red ORB on christmas eve.
12/24/15 17:00,Gainesville,FL,Triangle,30,3 lights that formed a triangle fairly high in the sky they gave off a orange reddish glow.
12/23/15 20:50,Palm Bay,FL,Changing,,Fiery red ball that seemed to change shape and moved in weird ways up and down and left to right.
12/21/15 20:45,Kissimmee,FL,Circle,10 minute,Bright red light was small then started to get bigger flashed several times. ((NUFORC Note: Rocket launch from C. Canaveral. PD))
12/21/15 20:23,Jacksonville,FL,Rectangle,2.25 minutes,Football field-sized aircraft with bight green lights hovered for 25 minutes. Video shows lights flashing like sending a code.
12/21/15 18:30,Dunedin,FL,Triangle,persistent,First noted craft hovering then rotating white lights at a nearby location.
12/19/15 23:00,Orlando,FL,Formation,15 minutes,The object was of a very bright orange color too bright to figure out the exact shape but they appeared to have a cylindrical body in
12/19/15 22:00,Ponte Vedra Beach,FL,Sphere,15 minutes,Orange balls of light blinking drifiting in formations. ((anonymous report))
12/19/15 17:45,St. Petersburg,FL,Unknown,20+ minutes,Two metallic objects with bright orange tails like comets streaked across the sky
12/19/15 16:00,Sanford,FL,Circle,1-2 seconds,Perfect circle of yellow dots of light in the sky at approx 4pm that appeared then disappeared.
12/19/15 10:48,Ponte Vedra,FL,Triangle,80 minutes,Two triangle shaped crafts with reddish orange lights appeared but shortly disappeared then reappeared but not as triangles but separat
12/15/15 21:06,Port Charlotte,FL,Oval,5 minutes,At 21.06 hours I observed a orange and white Oval craft Bright and Obvious to the North of Port charlotte/East englewood. The craft was
12/15/15 03:00,Loxahatchee,FL,Light,1 hour,Flashing light traveling up and down side to side. ((NUFORC Note: Sighting of Venus or Jupiter?? PD))
12/13/15 21:00,Trenton,FL,Unknown,Still on going,Flashing lights no sound no movement.
12/12/15 21:30,Tampa,FL,Light,45 minutes,Large light formation South Tampa near MacDill AFB.
12/12/15 19:00,Niceville,FL,Sphere,30 seconds,Orange round objects moving thru the sky in a perfect straight line one after the other with roughly one minute between them. there was
12/11/15 09:30,Orlando,FL,Disk,10 seconds,Disk object with silver dome sighted over Orlando interstate
12/10/15 23:00,Jacksonville,FL,Unknown,15 minutes,Pulsating white light on flying object that hovers in same area for a long time. ((NUFORC Note: Possible sighting of Sirius? PD))
12/10/15 18:10,St. Augustine,FL,Light,10 seconds,Bright large yellow white ball appeared mid sky at sunset and fell toward horizon in St. Augustine Florida.
12/10/15 17:05,Panama City,FL,Light,10 seconds,Looking west a bright white light appeared from space stayed in same location for a few seconds then took off with the speed of a shoo
12/8/15 20:51,Tampa,FL,Fireball,5 minutes,Fireballs flying in formation outside Tampa.
12/8/15 18:40,Dunedin,FL,Chevron,5:00,It is no marvel that satan will masquerade as an angel of light.
12/8/15 15:00,Matanzas Inlet,FL,Other,2 minutes,Unusual crescent shaped object photographed Matanzas Inlet FL. ((NUFORC Note: Kite for sky-surfing. PD))
12/5/15 05:00,Deltona,FL,Light,8 minutes,2 very bright lights a few miles away from each other. Both lights were slowly descending vertically until we could not see them.
12/1/15 22:00,New Port Richey,FL,Fireball,90 seconds,Orange fireballs travelling in a pair.
11/29/15 01:22,Lake Buena Vista,FL,Circle,Unknown,2 disks over Disney white bands of light across each.
11/28/15 22:50,Orlando,FL,Circle,20 seconds,Object moved across sky from north to south. It was bright orange in color. The shape resembled that of a tire in the sense that the
11/28/15 11:30,Clearwater,FL,Other,1 minute,I saw 3 people looking in the sky as I rode my bike and i glanced... i had to stop and took a look...a small jet looking ufo was flying
11/26/15 22:15,Apollo Beach,FL,Light,15 seconds,Craft moving from north to south.
11/25/15 23:00,Ft. Myers Beach,FL,Fireball,2 minutes,We noticed a large orange light gliding slowly in the sky then a helicopter or other object flew toward it almost to fend it off. The
11/24/15 23:20,Tallahassee,FL,Diamond,Unknown,Diamond-shaped configuration of lights flying southeast at high speed
11/24/15 19:45,Riverview,FL,Formation,45 minutes,Viewed over 50 yellow and orange balls of light. Moving against the wind and didn't flicker. Number is unknown I had to leave after wat
11/23/15 04:10,Jupiter,FL,Unknown,30 minutes,Extremely bright vibrant light hovering S of Jupiter FL. Was not moving. Estimsted 300' off ground. ((NUFORC Note: Venus? PD))
11/22/15 22:30,Tallahassee,FL,Other,3 minutes,Red orb pulsated moving across sky silently slow motion blink/dim/reappeared in line and continued on.
11/22/15 11:30,Davenport,FL,Circle,2 seconds,I was laying in bed and out my window a green circular light started shooting down it lasted about 2 seconds and it was fast. I though
11/20/15 19:35,Middleburg,FL,,,10 orange orbs fly over Middleburg FL.
11/18/15 20:00,Naples,FL,Changing,5 minutes,Two orange red objects hovering behind our house.
11/17/15 20:00,Miami,FL,Circle,3 minutes,Yes I saw the same thing as first video on website http://www.huffingtonpost.com/2015/01/26/orange-yellow-ufos-over-florida_n_6544420
11/16/15 21:15,Clearwater,FL,Other,5 seconds,Multi-colored fiery ball that created a tail like a meteor; lasted 5 seconds and disappeared. ((NUFORC Note: Meteor? PD))
11/16/15 18:00,Panama City,FL,Diamond,,Diamond shaped light time warps across sky.
11/13/15 06:00,Madison,FL,Light,5 minutes,Strange light in the sky just before dawn. ((NUFORC Note: Rocket launch from Cape Canaveral. PD))
11/10/15 20:30,Port St. Lucie,FL,Triangle,5 minutes,Lights on a triangular object moving slow then fast.
11/10/15 15:20,Osprey,FL,Light,20 minutes,Orange lights over Siesta Key 11-10-15
11/9/15 21:50,Williston,FL,Light,3 seconds,A ball of light came out of the clouds... Was still and then shot off and disappeared into the clouds.
11/9/15 21:45,Tampa,FL,Light,20 seconds,Green light moving North above low clouds . Moving very fast.
11/9/15 21:40,Jacksonville Beach,FL,Rectangle,15-30 seconds,On Monday November 9th at about 9:40 pm my boyfriend and I were sitting on my back porch smoking out evening cigarette. Almost 2 minu
11/9/15 21:40,Jacksonville,FL,Rectangle,10-20 seconds,On the night of November 9th I saw a singular U.F.O come across the sky. The U.F.O was moving at rate faster than any plane or aircraf
11/9/15 21:30,Clearwater,FL,Light,2-3 seconds,Bright green light in northern sky making a rapid descent at a soft angle like a roller coaster would make.
11/9/15 21:00,Palm Coast,FL,Other,2 seconds,Large flame blue streak. Tapering at the tail. Spotted 9:00 pm traveling south-west.
11/9/15 21:00,Tampa,FL,Light,1 minute,Huge green light. No sound. Helicopters trying to find it?
11/9/15 20:00,Jacksonville,FL,,30 seconds,Heard the same event as another report
11/9/15 03:00,Lantana,FL,Light,2.5 hours,I saw quite a few moving lights in the sky and had technical problems.
11/7/15 04:00,Ocala,FL,Light,3 seconds,A blue ball fell from the sky. ((NUFORC Note: Possible meteor?? PD))
11/7/15 00:20,Homeland,FL,Flash,0.5 second,I was driving east on hwy 640 approaching hwy 17 which was approximately 1 mile out. I drive this route often and at night I tend to l
11/6/15 20:30,Jacksonville,FL,Sphere,2 seconds,Green golf ball sized ball that was moving VERY fast and then disappeared a second later.
11/6/15 05:25,Miami,FL,Light,10 minutes,Large star-shaped object moving north across the Miami sky.
11/5/15 19:45,Miami Shores,FL,Other,2-3 seconds,Early evening arrow-like streak throwing off sparks.
11/5/15 02:45,Safety Harbor,FL,Flash,2-3 seconds,Saw a bright blueish/green flash that lit up the sky for a few seconds but no noise at all.
11/5/15 00:00,Sebring,FL,Flash,2 hours,I walked outside to smoke a cigarette and I noticed a bright light in the sky distance apart the whole time it was moving around was a
11/4/15 04:00,Largo,FL,Light,>1 hour,Strange orange red green and white lights + meteor.
11/1/15 19:50,Port St. Lucie,FL,Triangle,15 seconds,Triangle with a dim light at each corner. Each side of the craft was about the length of your little finger at arms length. Traveled
11/1/15 00:40,Miramar,FL,Circle,5 minutes,7 orange ships over Miramar Florida.
10/31/15 21:41,Riverview,FL,Unknown,115,Tonight I saw one round red light traveling extremely fast south on Hwy. 301 in Riverview FL. The light vanished after 15 seconds.
10/31/15 06:15,Bonita Springs,FL,Unknown,5 minutes,Just prior to sunrise I was awakened by bright lights.
10/31/15 02:00,Zolfo Springs,FL,Formation,On going,"Pulsating Cluster of Lights. ((NUFORC Note: We suspect that the witness may have been observing a ""twinkling"" star. PD))"
10/29/15 02:00,Orlando,FL,Egg,1 hour,Large stand still lights orange red white near other stars like the dipper moved position 2 times rhythm of lights changed from solid t
10/25/15 05:00,Panama City,FL,Sphere,1 hour,UFO-PC-FL ((NUFORC Note: We suspect the three objects are the three planets currently visible in the eastern sky. PD))
10/23/15,Panama City,FL,Sphere,2 hours,Oct.23-2015-PC-FL-UFO.
10/22/15 00:00,Sarasota,FL,Light,2 seconds,Very large glowing green sphere rapidly decending and losing sight behind building.
10/20/15 21:00,Winter Park,FL,Chevron,10 seconds,V-shape object blended so well with night sky.
10/18/15 22:50,Ft. Lauderdale,FL,Flash,10 seconds,I saw a green flash then a pink flash lasting approximately 1 second each followed by a trumpet sound occurring twice.
10/17/15 21:15,St. Petersburg,FL,Triangle,10 seconds,Very fast flying rectangle with pulsating bright blue lights flew over Tampa Bay then dove straight into water.
10/17/15 21:15,Tampa,FL,Triangle,10 seconds,Triangular shape. Dull red lights. I think 3 or more in rear and at least one forward as like a front of vehicle no flashing lights.
10/16/15 21:30,Okeechobee,FL,Oval,5 seconds,"I was sitting outsidewith other family members around a firepit facing the rim of Lake Okeechobee.

I looked up into the sky overh"
10/16/15 21:00,Ochlocknee Bay,FL,Fireball,5 minutes,Red/yellow circle fireballs in the northern sky moving slowly east then faded out as they moved north.
10/15/15 09:45,Navarre,FL,Oval,25 seconds,Dark oval object moved very fast high in the sky making short erratic zig zag movements like no other aircraft I heve ever seen.
10/15/15 05:20,Cape Coral,FL,Circle,2 minutes,Two glowing white orbs chasing each other - traveling from North to South - Cape Coral Fl
10/14/15 20:38,Okeechobee,FL,Circle,20 seconds,I saw a bright yellow light in the western sky flash 8-9 times as it traveled south and then it disappeared
10/13/15 22:00,Destin,FL,Changing,1 hour,Orange-Red/White flashing light over Panama City Beach seen from Destin Balcony. The lights of the 3 objects continued to change.
10/13/15 19:10,Gulf Breeze,FL,Sphere,2 minutes,Orange sphere.
10/13/15 16:00,Port St. Lucie,FL,Unknown,2 minutes,Was outside and saw 3 blinking yellow lights in the sky. It sat there for about 1 min. as I looked at it. Looked away for ~10 sec..
10/13/15 02:38,Miami,FL,Fireball,~4 seconds,Brightest Blue Beam flash across the sky like a flair going East. Started literally above my head and lasted about 4-5 seconds.
10/12/15 23:45,Palatka,FL,Sphere,7 minutes,Orb of light follows witness's car disappearing and reappearing.
10/11/15 22:45,Brandon,FL,Chevron,15 seconds,I saw what I thought was a flock of white birds flying in a Chevron. I don't know exactly how many there were but I would guess 7 or 9
10/11/15 05:22,Coral Springs,FL,Unknown,3,Doing my jogging routine about 5am  and while running I watch the sky to contemplate many starts when suddenly appear this object with
10/11/15 00:30,Ocala,FL,Chevron,5 seconds,V-shaped object dim lights almost cloaked like stars but moving quickly.
10/10/15 02:00,Port St. John,FL,Triangle,HOURS,Triangular-shaped ship communicates with other ships in the clouds via lights that look like lightning from the ground but isn't.
10/9/15 22:00,Port St. John,FL,Flash,HOURS,Lights that look like lightning but isn't - flash in a uniform pattern in 3 different places in the sky as if they're communicating!!!!
10/9/15 14:00,Wesley Chapel,FL,Disk,3 minutes,Black disk flying north quickly moving up and down.
10/6/15 20:15,Ft. Myers,FL,Flash,1 hour,Pulsating light in western Florida sky.
10/5/15 11:30,Sebastian,FL,Oval,5 minutes,Late at night we went out to take a video of the clouds lighting up from lightning. All of a sudden appeared was off to the right in th
10/4/15 22:50,Orlando,FL,Chevron,15 seconds,A high flying large v or u shaped object with no lights moving relatively fast.
10/4/15 21:50,Orlando,FL,Chevron,20 seconds,boomerang/light colored/no lights.
10/4/15 14:10,St. Petersburg,FL,Egg,1 minute,Large silver egg shape object over st Petersburg
10/3/15 23:00,Hollywood,FL,,5 minutes,Weird.
10/3/15 22:30,Fort Lauderdale,FL,Chevron,2 separate 15 min apart.,2 sightings of small discs flying in v-formation 15-20 minutes apart.
10/3/15 21:15,Cape Coral,FL,Light,10 minutes,FOUR ORANGE LIGHTS IN PERFECT ALIGNMENT
