date_time,city,state,shape,duration,summary
11/5/12 19:15,Arcadia,FL,Light,15 minutes,Flying in a Cessna 182 North of LaBelle VOR encounter strange light not on radar.
11/5/12 01:24,Weston,FL,Fireball,20 minutes,Amazing light show with no answers!
11/4/12 19:30,Clearwater,FL,Light,2 seconds,Brilliant flash of light possibly very small meteorite
11/4/12 19:00,Sanford,FL,Disk,2 minutes,Look up in sky was disc object loud humming sound had yellow lights circulating around it was moving away from us at slow rate of speed
11/3/12 23:00,Loxahatchee,FL,Other,3-4 seconds,UFO looking like it's on fire leaves with a sonic boom.
11/3/12 19:45,Longwood,FL,Sphere,3 minutes,UFO spotted hovering over Winn Dixie parking lot in longwood FL hovering very low.
11/3/12 02:00,Silver Springs,FL,,Hours,Sighting of intelligent life forms seem friendly to me
11/2/12 19:00,Coral Springs,FL,Light,Several minutes,It moved way too fast to be a plane or helicopter and it was silent.
11/2/12 08:00,Hollywest,FL,Fireball,3 minutes,I picked up my Mom to go out to dinner and happened to look up into the sky. I saw what looked like a circle of fire followed by four
11/2/12 07:00,Miami,FL,Unknown,,((HOAX?? Time and date are flawed.)) There were bright lights couldn't real tell the shapes of them but it was pretty cool.
11/2/12 07:00,Miami,FL,Unknown,,((HOAX??)) There were bright lights couldn't real tell the shapes of them but it was pretty cool and amazing to see this.
10/27/12 15:00,Bradenton,FL,Fireball,5-7 seconds,3-6 a.m. was a red-orange-sunlike round sphere go by then up then into field. I was scared to go in field?
10/25/12 19:45,Cape San Blas,FL,Fireball,seconds,Three orange glowing globes floating over the Gulf at Cape San Blas FL.
10/24/12 19:45,Cape San Blas,FL,Fireball,seconds,Eight orange glowing globes floating over the Gulf of Mexico at Cape San Blas FL.
10/24/12 00:00,Melbourne Beach,FL,Flash,15 minutes,I saw three flashing lights in the sky over Melbourne Beach. They moved erratically and kept flashing the whole time that I saw them.
10/23/12 01:30,Seminole,FL,Oval,>1 hour,Mid Pinellas County-moving lights in horizontal fashion right to left left to right: brilliant green blue purple pink red.
10/22/12 14:30,Jacksonville Beach,FL,Changing,7 minutes,Object appeared and morphed into a craft. See photos.
10/21/12 19:23,Palm Bay,FL,Circle,10-15 minutes,No common aircraft sounds were heard.
10/21/12 07:55,Edgewater,FL,Teardrop,few seconds,I saw a neon green white hot and glowing comet or teardrop shaped object falling out of the sky.
10/21/12 03:40,Sarasota,FL,Cylinder,10 seconds,This object was extremely clear and easy to see silent and the dim lights were fascinating to watch.
10/19/12 23:00,Hollywood,FL,Circle,4 seconds,Huge round craft sparkling fluorecent in yellow & orange emitting electrical flames out of the bottom
10/19/12 21:00,Lakewood Ranch,FL,Light,10 minutes,Several bright lights in formation and then they dissappeared one by one
10/19/12 19:00,North Port,FL,Other,5 minutes,Silver object without wings or noise
10/18/12 23:40,Tampa,FL,Diamond,3 minutes,The pinkish orange lights dimmed out as the diamond shaped object moved overhead toward the east.
10/17/12 23:05,Dunedin,FL,,,We saw 2 separate tight circles of exploding lights which eventually stopped and locked into a cluster formation..
10/17/12 07:00,Navarre,FL,Disk,3-5 seconds,Huge bright saucer
10/16/12 20:30,Orlando,FL,Sphere,30-40 seconds,Orange glowing sphere seen by 4 adults in East Orlando.
10/16/12 03:00,Englewood,FL,Light,15 minutes,Slowly flashing white light in space or possibly low earth orbit.
10/14/12 22:00,Lake Wales,FL,Changing,hours,Discovered what I thought was a UFO was actually the star Sierius. It refracts colors thru our atmosphere while low in the sky then bec
10/14/12 22:00,Lake Wales,FL,Changing,35 minutes,Red whie and blue flashing lights
10/13/12 21:00,Hudson,FL,Circle,5,3 bright orange circles lights moving across sky
10/12/12 20:30,Wellington,FL,Fireball,10 minutes,2 circular balls of red light floating over neighborhood in wellington fl
10/12/12 19:00,Lake Worth,FL,Cylinder,60 seconds,Self illuminating rod-chevron shape near West Palm Beach
10/12/12 19:00,Lake Worth,FL,Chevron,60 seconds,Chevron Shape Bright Object in the Northern Sky
10/12/12 00:00,Titusville,FL,Fireball,30 second intervals,WE SAW 3 SEPARATE SIGHTINGS WITHIN 15 MINS TIME EACH TIME 3 ORANGE FLAME BALLS FLEW IN UNISON THROUGH THE NEIGHBORS TREES AT A FAST PAC
10/9/12 23:00,Lake Worth,FL,Light,3 minutes,2 white dots .
10/7/12 21:00,Ormond Beach,FL,Fireball,30 seconds,Fire ball over ormond beach fl
10/6/12 20:20,Hollywood,FL,Fireball,2 minutes,On October 6 2012 I observed a torchlike like drifting over Hollywood FL for about 2 minutes which then rose into the cloud cover
10/1/12 06:30,Sarasota,FL,Formation,10 seconds,Dim lights
9/30/12 00:00,Delray Beach,FL,Circle,5 minutes,Circular round lights the color of a flame moving in the sky above Delray Beach FL mid-night 12/29/12
9/29/12 04:00,Sarasota,FL,Other,30 minutes,My friend woke me up and showed me a flickering multicolor object in the sky below Orion's belt. ((NUFORC Note: Sirius?? PD))
9/29/12 03:36,Homestead,FL,Unknown,unknown,Curiosity images reveal UFO
9/29/12 01:11,Spring Hill,FL,Other,ongoing,Wide white streak.
9/28/12 21:30,Ft. Lauderdale,FL,Chevron,45 seconds,A giant wing shaped object little slower than the typical passenger jets that fly over regularly. No lights or sound at all.
9/28/12 21:30,Flagler Beach,FL,Triangle,5 minutes,A very large vertical triangle shape of orange lights slowly moving by until they faded out. Flagler Beach FL
9/28/12 20:00,Polk City,FL,Unknown,1 hour 10 minutes,At least 4 objects in the Western sky of FL for several nights in a row they stay for about 1 1/2 hours and slowly move further WEST.
9/28/12 09:30,St. Cloud,FL,Fireball,2 minutes,Two orange spheres.
9/27/12 23:05,Key West,FL,Fireball,30 seconds,Big orange/yellow fireball traveling N to S over Atlantic many lights 3 persons saw-2 took Cellpicsthe zoomed in 1 had shadow face
9/27/12 23:00,Pace,FL,Other,1-2 minutes,What I saw looked like a helicopter which also sounded like a helicopter.
9/26/12 20:00,Cape Coral,FL,Rectangle,,Red and blue craft.
9/26/12 20:00,Miami (Coral Way area),FL,Triangle,coral way area,3 orbs They kept the formation but started to rotate and expand
9/24/12 23:30,Naples,FL,Rectangle,2 minutes,Bright color-alternating craft appearing and and disappearing over the ocean
9/23/12 21:00,Miami,FL,Formation,10 seconds,V shape formation. Slow motion and altitude.
9/23/12 20:30,Tampa,FL,Fireball,about 10 seconds,09/23/2012 in florida 8:30pm driving in my car spotted a red ball of fire floating in the skylooked like it was coming toward the grou
9/23/12 00:00,Indialantic,FL,Circle,5 minutes,Red lights in sky over Brevard
9/21/12 20:30,West Palm Beach,FL,Triangle,3-5 minutes,3 red lights in a triangle patter and slowly disappearing seen by one firefighter and 4 civilians
9/17/12 03:00,Davie,FL,Circle,10 minutes,Bright flashing lights
9/16/12 20:20,Coral Springs,FL,Other,10 minutes,ME and MY FRIEND just saw 3 orange lights that were stopped then went on slowly n made strange manovers
9/15/12 22:00,St. Petersburg,FL,Fireball,,My mom took the dog out and came in running. It was 10 o'clock at night. We had a family over so there might of been 7 witnesses. It ha
9/15/12 21:30,Venice,FL,,15 minutes,8 slow moving orange spheres over Gulf of Mexico after orange column of light over Gulf
9/15/12 20:35,Davie,FL,Changing,1 minute,Golden light/ fireball splits into 4 objects then changes formation while changing directions and changing rate of descent
9/15/12 20:30,Coral Springs,FL,Triangle,15 seconds,I was crossing a corner on a street at night and I looked to the right and I see a unidentifiable flying object about cloud high. I saw
9/15/12 20:30,Oakland Park,FL,Fireball,2 minutes,6 Fire Balls falling in close formation then breaking apart and hovering
9/15/12 04:00,Ft. Myers,FL,Changing,20 minutes,9/15/12 4:00 Two round pulsating lights changing colors and shape seen over Ft Myers Florida in south eastern sky. ((Planets?? PD))
9/12/12 20:00,Winter Haven,FL,Formation,45 seconds,10 perfectly spaced bright golden orange orbs as big as the sun changed from an E-W to a N-S position in the blink of an eye.
9/11/12 20:55,Sarasota,FL,Oval,10-20 seconds,Bright Orange light in night sky
9/11/12 05:50,Miami Beach,FL,Unknown,15 seconds,Very fast object that stops then comes back
9/8/12 00:00,Miami,FL,Fireball,5 minutes,I was walking with my mom she had ask me to go for a walk with her i said ok i walk out the house with her turn the corner and we kept
9/8/12 22:45,Jupiter,FL,Fireball,10-15 minutes,Over a dozen orange lights close to each other no noise south to the north dissapearing to the east
9/8/12 11:30,Wesley Chapel,FL,Light,5,Me and my friend were walking my dog and I was standing on a generator. We were looking up at the sky when a random Bright White light
9/8/12 05:00,Coconut Creek,FL,Triangle,1 minute,JUST SAW THREE BIG WHITE LIGHTS MOVING IN A TRIANGLE FORMATION AT 5:00 AM. IT WAS TOO DARK TO SEE AN OBJECT JUST THE LIGHTS. THE SKY WA
9/7/12 05:30,Delray Beach,FL,Sphere,1 hr +,Globe shaped object flashing lights at random another blue light behind Stationary
9/3/12 21:30,St. Augustine,FL,Fireball,2 minutes,Me and my 2 sons were walking down Menendez st near the lions bridge my son told me to look up in the sky and we witnessed a yellow lig
9/3/12 09:30,Dade City,FL,Other,still there!,The craft should still be there due to the damage that is visible!
9/2/12 22:00,Fort Myers,FL,Oval,20 minutes,It was a light over the lake close to my apartment complex and just stop go away and came back and started bouncing. My son saw anot
9/2/12 21:12,Cape Coral,FL,Fireball,35 seconds,Orange object very bright then disappears
8/31/12 21:40,Longwood,FL,Fireball,2 minutes,Four orange glowing globes floating quickly and silently in a fairly straight line then vanish one by one.
8/28/12 01:56,Miami,FL,Fireball,5 seconds,Reddish orange ball appears in the night sky at tremendous speed.
8/26/12 00:00,Stellenboch Montains (South Africa),FL,Oval,2 hours,I was given knowledge
8/25/12 23:00,Delray Beach,FL,Circle,5 minutes,Round ufo over Delray Beach Florida
8/23/12 11:30,Longwood,FL,Light,20 minutes,2 different flashing lights above longwood fl seen by 3 people .
8/18/12 23:00,Jacksonville Beach,FL,Fireball,1 minute,Orange ball of light moving south to north over the ocean at extreme speed then disappeared.
8/15/12 20:15,Orlando,FL,Light,1 minute,Driving home from a friends house on 528 in Orlando right next to the Lockheed Martin Facility hidden in between Orlando's busiest tou
8/13/12 21:30,Plant City,FL,Circle,5 minutes,Orange Gliding Objects in the Night Sky
8/13/12 19:39,Santa Rosa Beach,FL,Other,10 minutes,During family portraits in Seaside Fl - I observed an unnatural shaped in the sky that ran from East to West for as far as I could see
8/12/12 21:00,Jacksonville,FL,,,Rectangular silver/gray spacecraft hovering close to land with no sound. ((NUFORC Note: Date of event not indicated by source. PD))
8/11/12 21:00,Orlando (Near Seaworld/Disney World),FL,Triangle,Unknown possibly about 5,I saw 3 very red lights hovering in a triangle shape near Sea World Orlando Florida and they dissappeared about 5 minutes later.
8/9/12 20:48,Apopka,FL,Fireball,5 minutes,7 Fireballs in Apopka sky
8/9/12 00:10,South Daytona,FL,Light,1second,Bright light moving fast and disapeared
8/8/12 10:45,Pace,FL,Circle,Front yard,Circular object with bright blinking red lights
8/7/12 21:43,Orlando,FL,Chevron,3 minutes,August 7 2012 sighting of orange lights in the sky in western Orange County FL (near Walt Disney World)
8/7/12 21:43,Orlando,FL,Chevron,3 minutes,Orange lights over west Orange County (Orlando area) FL
8/7/12 21:07,Sebring,FL,Fireball,45-90 seconds,Line of fireballs in sky over Sebring Florida (central florida) 9 PM EST 8/7/12
8/7/12 20:20,Boca Raton,FL,Teardrop,3 minutes,Orange and grey pine cone shaped orb sighted while driving east in Boca Raton Fl. between 8:15 and 8:30 PM.
8/6/12 21:00,Miami,FL,Oval,1 hour,5 individuals see Huge 300 ft Craft about 50 feet away for one hour. Could throw rock and hit it.
8/5/12 17:10,Pensacola,FL,Light,5 minutes,High altitude very slow moving white light travels in half-circle then merges with another stationary white light that disappears.
8/5/12 11:00,Boca Raton,FL,Unknown,1 hour,The past week I've noticed a stationary white light with red flashing lights to the west. Every night the same light. ((Star??))
8/4/12 15:00,Jacksonville,FL,Chevron,10 minutes,We were going to our friends house when we noticed the UFO and stopped to look at it just hovering. It was in broad daylight and all wo
8/3/12 07:00,Port St. Lucie,FL,Cigar,2 minutes,Long silver object leaving an exhaust or debris trail. ((NUFORC Note: Possible high-alt. aircraft?? PD))
8/2/12 06:01,Big Pine Key,FL,Other,10-15 seconds,"Around 06:00 my wife saw a ""fireball"" in the sky traveling North bound (WB from our bedroom) what it appeared. She thought it"
8/1/12 00:00,Vero Beach,FL,Triangle,5-7 minutes,Triangle shaped object in sky.
7/30/12 04:22,Sunny Isles Beach,FL,Triangle,It ws still there when I,3 upside down triangles hanging from a vertical white bar. One was just behind a high rise building over the ocean. ((Planets??))
7/28/12 04:30,Dade City,FL,Sphere,2 hours,2 stars moving in the sky & more. ((NUFORC Note: We suspect a sighting of planets in the eastern morning sky. PD))
7/28/12 04:15,Mims,FL,Sphere,20 minutes,"Multiple different ""what look like stars"" blinking then moving very slow in different directions"
7/27/12 21:00,Naples,FL,Fireball,2 minutes,Good-sized orange fireball coming from Gulf of Mexico in Northeast direction over Naples
7/25/12 21:00,Indialantic,FL,Oval,4 seconds,I was on the beach and i saw the most unbelievable oval shaped explosion of orange light which slowly turned green aNd dissapeared
7/23/12 12:45,Pensacola,FL,Oval,5 seconds,Orange metallic colored ovals falling from the sky not fireworks falling straight down no way!
7/22/12 00:00,Brandon,FL,Fireball,5 minutes,Fireballs over Brandon Florida
7/19/12 22:00,DeLand,FL,Circle,3 minutes,Two Orange lights in the sky
7/18/12 21:20,Port Orange,FL,Triangle,5 minutes,Orange/white glowing lights in night sky triangle formation moving from west to east July 18 2012 - 9 PM
7/18/12 05:55,Jacksonville,FL,Fireball,5 seconds,Fluorescent green streak in jacksonville sky
7/17/12 21:36,Dade City,FL,Sphere,5 minutes,6 round orange ball of light glide across the night sky in Dade city
7/16/12 07:30,Clearwater,FL,Disk,2 minutes,Saucer seen on Causeway
7/15/12 22:00,Tampa (near),FL,Fireball,Few minutes,Three bright orange/red fiery balls that looked road flares floating S along I-75; tree top level and stacked vertically.
7/14/12 21:45,St. Petersburg Beach,FL,Fireball,10 minutes,20-30 ORANGE/RED FIREBALLS TRAVEL NORTH OVER ST PETE BEACH AND VANISH OVER GULF
7/14/12 21:45,St. Petersburg Beach,FL,Fireball,5-10 minutes,20-40 ORANGE/RED FIREBALLS TRAVELING NORTH OVER ST PETE BEACH-DISAPPEARING OVER GULF
7/13/12 22:00,Crawfordville,FL,Other,2 minutes,Hot air ballon shaped object
7/13/12 11:21,Orlando,FL,Circle,125 seconds,5 balls of light
7/12/12 22:50,Siesta Key,FL,Diamond,10 minutes,While in the pool at our condo I noticed a red light in the sky far out over the Gulf. Over several minutes it moved closer traveling
7/12/12 22:40,St. Augustine,FL,Fireball,3 minutes,Red fireball? flys across St. Augustine sky!
7/10/12 23:30,Plantation,FL,Light,1 minute,Bright red/orange light hovering high in the South Florida western sky then suddenly disappeared
7/10/12 22:45,Fort Walton Beach,FL,Diamond,2-3 seconds,Bright white Diamond shaped craft with bright vapor trail seen in Fort Walton Beach FL 7/10/12
7/9/12 22:40,Wesley Chapel,FL,Formation,Approximately two minutes,Two UFOs moving in formation
7/9/12 21:00,Hollywood,FL,Fireball,3 minutes,Just standing out back looking into the sky and saw what seemed to be a ball of fire moving slowly through the sky. It was moving at a
7/8/12 03:30,Miami,FL,Cylinder,5 minutes,Large 300 ft long cylinder craft was hovering and had two large multicolored stripes on each triangular end.
7/5/12 00:55,Tallahassee,FL,Sphere,5 seconds,I saw two green orbs floating next to each other metal prongs jut out from these orbs and these orbs spin and jut into the sky.
7/4/12 23:45,Daytona Beach Shores,FL,Light,1 minute,3 reddish colored objects traveling under 100kts zoomed out of sight without any sound
7/4/12 23:30,Kissimmee,FL,Unknown,3 minutes,Bright Orange light seen in Orlando sky.
7/4/12 23:30,New Port Richey,FL,Unknown,15 minutes (appx),5 orange lights moving strangely
7/4/12 23:00,Pt. St. Lucie,FL,Unknown,20 minutes (approx.),one bright orange ball traveling east into the sky then black shadowey object descending.
7/4/12 22:30,Sarasota,FL,Fireball,2 minutes,It was July 4th 2012 (last night) my husband our 2 girls and I were coming home from watching the fireworks. We were going south on US
7/4/12 22:30,Deerfield Beach,FL,Light,2-3 minutes,4th of July Curiosity in Deerfield Beach Fla
7/4/12 22:00,Daytona Beach,FL,Circle,30 minutes,7-4-12 daytona beachfl.
7/4/12 21:55,Steinhatchee,FL,Circle,3-4 minutes,Red orbs flying then disappearing
7/4/12 21:50,Steinhatchee,FL,Circle,3-4 minutes,Two red circles appearing out of nowhere then disappearing.
7/4/12 21:40,Winter Haven,FL,Circle,5 minutes,There were three orange orb like circles that appeared one at a time and formed a triangle
7/4/12 21:38,Sunrise,FL,Light,20 seconds,Possible UFO sighting in Sunrise Florida during 4th of July celebration.
7/4/12 21:30,Deltona,FL,Fireball,30 minutes,Red fireballs over Deltona FL
7/4/12 21:30,Coral Springs,FL,Chevron,10 minutes,Wife and I were at a big public fireworks display in Coral Springs FL. and as we were watching she noticed something she thought was a
7/4/12 21:30,Port St. Lucie,FL,Fireball,20 seconds,Reddish Orange Fireball coming from East turns N. over E. Coast FL heads toward North Star.
7/4/12 21:15,Spring Hill,FL,Diamond,4 minutes,One orange/ red diamond shape over skies north west over spring hill florida 4 th of july 2012 9:13 pm
7/4/12 21:15,Lantana/Lake Worth,FL,Cylinder,15 minutes,On the evening of July 4th 2012 at around 9:15 p.m. 7 Rod or Cylinder shaped objects appear to 3 witnesses !
7/4/12 20:40,Indian Harbour Beach,FL,Light,2 minutes,Red light seen during fireworks traveling from south to north then disappears.
7/4/12 02:45,Gainsville,FL,Circle,1 minute,12 Orange balls of light moving fast and silent in night sky.
6/30/12 23:00,Navarre,FL,Light,15 minutes,No smoke trails or sound. Traveling incredibly fast.
6/30/12 21:30,Jax Beach,FL,Light,3 minutes,Orange globe seen over ocean off of JAX Beach
6/30/12 17:20,Palm Harbor,FL,Fireball,2 minutes,((HOAX??)) Fireball in sky.
6/29/12 20:35,Milton,FL,Sphere,5 minutes,Bright Yellow Orange Sphere travelling under the moon from right to left..
6/26/12 01:00,Dunedin,FL,Cylinder,10 minutes,UFO Sighting on 6/26/2012 at 1:00am Intense Deep Bright Orange Intensifying Object Just Above Tree line on the West Coast of Fl.
6/26/12 01:00,Dunedin,FL,Cylinder,10 minutes,Very Bright Chubby Orange Glowing Cylender Object that intensified in color and sort of moved back & forth.
6/25/12 22:00,Atlantic Ocean,FL,Circle,45 minutes,Glowing Orange UFO at Sea.
6/22/12 21:52,Melbourne,FL,Sphere,Approx 1 minute,Orange hovering orbs over melbournefl near dairy rd and florida ave
6/22/12 21:00,Anna Maria Island,FL,Circle,3 minutes,Yellow/orange bright light observed from Anna Maria Island for about 3 minutes
6/22/12 20:45,Miami,FL,Formation,1 min,Lights in the sky wink out in the vicinity of Turkey Point
6/20/12 23:30,Winter Haven Eagle Lake,FL,Flash,2 minutes,Large blue light / electromagnetic pulse in Winter Haven/Eagle Lake FL Area 6/20/12 at 11:30 pm
6/20/12 17:20,Palm Harbor,FL,Fireball,1 minute,((HOAX??)) It was a fireball shape. It was very quiet but had a faint burning sound. It was very meticulous looking.
6/17/12 21:00,Ocala (driving up I-75 location not exactly known),FL,Light,30 seconds,Bright red light moving in a straight path across the sky and suddenly vaporizing into thin air.
6/16/12 21:50,Siesta Key,FL,Fireball,10,Orange fire balls flying in the night sky on siesta key
6/16/12 21:28,Weeki Wachee,FL,Fireball,2 minutes,Pulsating ball of light WNW sky of Weeki Wachee (Spring Hill)Florida
6/16/12 01:26,Sarasota,FL,Unknown,1-2 mins,UFO as bright as star with green tail of fire over Siesta key
6/15/12 22:50,Gainesville,FL,Sphere,00:10,Series of amber orbs transiting NE to SW singly in pairs and in threes about 15 total.
6/14/12 23:00,Hudson,FL,Sphere,3 minutes,Small orb constant light sparking dripping drone-like 20 feet off ground.
6/14/12 22:30,Bradenton (northeast area of),FL,Circle,2 minutes,Low flying orange fire like ball
6/13/12 10:00,Palm Coast,FL,Circle,6-8 minutes,Multicolored lighted circle moving extremely fast appears to be checking out RC jet at three different times during flight.
6/12/12 00:45,Port Charlotte,FL,Oval,00:15 minutes,Saw 3 egg shaped objs stat.white blinking lightsand a blue light.Objs spaced far apart over the 1 a.m.sky. No sound. .
6/12/12 00:25,Tallahassee,FL,Triangle,3 seconds,3 light triangle shaped object moving fast and silent in a straight-line across my field of sight witnessed by one other.
6/9/12 22:00,Orlando,FL,Light,5 minutes,My cousin an I and my 3 year old daughter went into my backyard to relax near my pool. While talking i noticed a perfect line of at le
6/8/12 22:30,Daytona Beach,FL,Circle,10 minutes,Orange ball of light over Daytona Beach by the Boardwalk
6/7/12 21:05,St. George Island,FL,Fireball,2 minutes,Orange Fireball that fizzled out.
6/6/12 21:00,Miami,FL,,10 seconds,A ball of Fire going across the sky
6/1/12 21:21,Fort Lauderdale,FL,Circle,60 seconds,Strange flying objects in the sky
5/30/12 20:45,Venice,FL,Cylinder,less than one minute,3 shiny cylindrical objects 5 secs apart flying N&gt;S over the Gulf of Mexico near Venice Fl.
5/29/12 22:09,Pensacola,FL,Triangle,2 minutes,large dark trinagular object with many primatic lights on it.
5/26/12 22:30,Belle Glade,FL,Light,20mins,the objects moved and changed colors rapidly
5/26/12 21:30,Deep Creek (Punta Gorda),FL,Triangle,about 7-10 min.,I went out to walk the dog. I saw the lights ran inside to get my friend called him out to look at the lights. We stood there and sa
5/26/12 05:45,New Port Richey,FL,Light,15 seconds,Ball of white light turns to green streak across the sky vertically heading downward.
5/25/12 00:00,Miami,FL,Circle,6 minutes,Bright orange lights over Miami Florida
5/23/12 00:05,Pensacola,FL,Oval,3 minutes,Dark oval shaped object had shooting star object launch from it overhead before continuing onward.
5/21/12 23:00,Old Town,FL,Triangle,5,Triangle formation in Old Town Florida.
5/20/12,Gulf Breeze,FL,Changing,15 MINS,I saw not a plane or a Helicopter. I saw this thing it was real.No sound but the sound of birds going to roost for the night.
5/19/12 04:55,Orlando,FL,Light,5 minutes,Tried to watch shuttle launch ended up seeing aliens.
5/15/12 23:00,Tampa,FL,Circle,3 mins,2 Orange Lights
5/15/12 09:50,Siesta Key,FL,Fireball,5 minutes,fireball flying low over canal waters went then flew higher slowly into space
5/10/12 16:00,Orlando,FL,Circle,8 minutes,Three small white orbs flying erratically extremely high in a perfectly blue sky during broad daylight.
5/10/12 10:51,Miami,FL,Fireball,60 seconds,Just a small flickering ball of orange-red traveling slowly through the sky.
5/8/12 21:15,Sarasota,FL,Light,20 minutes,Star like objects moving in a uncontrollable path. One stopped and then kept moving.
5/7/12 00:30,Lakeland,FL,Sphere,10 minutes,Orange Chinese lantern type orb in sky
5/6/12 21:00,Apopka,FL,Fireball,30 minutes,8-10 Orange Orbs observed by 8 witnesses and later 2 black helicopters arrive
5/5/12 22:00,Orlando,FL,Oval,5 to 10 minutes,Numerous bright orange/red silent glowing pulsating oval objects traveling SE to NW for 5 to 10 min
5/4/12 20:30,Sanford,FL,Circle,1 minute,Low flying round object with white circulating lights.
4/29/12 23:45,Melbourne,FL,Light,4 minutes,Silent pulsating orange light from south to north
4/29/12 21:30,Orlando,FL,Circle,3-4 minutes,Reddish orange glowing orbs flying in formation in Orlando at about 9:30 PM April 29 2012
4/29/12 02:00,Jacksonville,FL,Disk,2:00,Disc shaped saucer seen inside a glowing orange ball of light in Jacksonville florida.
4/28/12 13:37,Sarasota,FL,Cigar,2 minutes,White cigar shaped ufo not flying then dissappeared
4/27/12 19:30,Ocala,FL,Rectangle,3-5 min.,Stationary rectangular object seen in north-central Florida.
4/26/12 21:35,Geneva,FL,Triangle,20 seconds,A triangular shaped UFO lined with red lights that went on and off at 3 second intervals.
4/26/12 21:00,Miami,FL,Chevron,15 seconds,Boomerang or V shaped UFO.
4/26/12 00:00,Big Pine Key,FL,Chevron,10 secs,Star like lights flying silently in a perfect boomerang formation high rate of speed disappeared suddenly
4/25/12 22:35,Citrus Springs,FL,Light,30 minutes,Saw 1 object pulsating red and blue color very bright in the west sky over crystal river power plant area. It was a good distance above
4/25/12 12:00,Okeechobee,FL,Light,1 minute,Bright objects in sky.
4/24/12 22:00,Beverly Hills,FL,Other,30 MINUTES,Star like object with colors flickering/stationary. Beverly Hills Florida 4/24/12 and it is filmed. ((NUFORC Note: Sirius?? PD))
4/23/12 21:54,Marco Island,FL,Cylinder,1 minute or less,The object went from relatively still to disappeared from sight in 2 seconds.
