date_time,city,state,shape,duration,summary
5/15/06,Winter Haven,FL,,one hour,I just sent a piggyback report within the last half hour. This is the report I mentioned only my timeline was off.
5/14/06 20:45,Miami,FL,Light,3 minutes,White light moving slowly to the northeast changed to northwest then northeast again changed to red then went to dim white again
5/14/06 00:30,Delray Beach,FL,Light,1-3 mins,Bright Lite moving in different directions
5/11/06 19:45,Buckhead Ridge,FL,Disk,8 minutes,We witnssed something enter the earths atmosphere desend and decelerate from a high rate of speed.
5/10/06 04:47,Fort Myers,FL,Sphere,one minute,large red shere in Fort Myers Florida
5/7/06 07:40,Largo,FL,Circle,25 seconds,round flying object Largo FL.
5/6/06 22:10,Vero Beach,FL,Circle,00:30,GROUPING OF AMBER COLORED ROUND LIGHTS ALL IN A HORIZONTAL POSITION SAME LEVEL
5/6/06 21:30,Lake Wales,FL,Formation,5 min,The formation of six lights appeard in Lake Wales and vanished in about five minutes.
5/6/06 18:00,Fort Myers,FL,Sphere,15 min,Metalic object of sphereical shape exactly like the object I reported on 4/3/06 in the east 18:30 estimated 60 to 100000 feet 60deg
5/6/06 01:00,Orlando,FL,Formation,10mins,Corkscrew object seen in the OrlandoFl skies
5/5/06 20:00,Wauchula,FL,Unknown,1 hour,Significant sightings over Hardee County FL continue to be unexpained.
5/4/06 20:30,Port Charlotte,FL,Light,2 min.,Dim light increasing in brightness Headed Northward in FLorida...
5/4/06 06:00,Deerfield Beach,FL,Fireball,10 seconds,saw explosion or similar in night sky
5/3/06 21:00,Hollywood,FL,Triangle,2hours,We saw a triangular shaped object that was very far in space. It appeared to have blinking lights in an oval shape to one end.
5/3/06 18:35,Fort Myers,FL,Sphere,15 min,High altitude silver object visable 15 min hoovering slow sw trajectery early eve.
5/2/06 22:00,Panama City Beach,FL,Light,30mins,large orange reddish light in the night sky moving across sky instantly
5/2/06 21:00,Panama City Beach,FL,Unknown,2 minutes,A sequence of golden lights
4/27/06 05:30,Naples,FL,Formation,15 seconds,Fuzzy lights over Naples FL
4/23/06 11:00,Destin,FL,Unknown,1 minute,Large mirror-like object in the sky suddenly disappears during the daytime
4/17/06 19:30,Satellite Beach,FL,Light,6 minutes,4 flashing strobe-like objects move rapidly across the nite skyline and disappear into a light forming a many colored fast moving ob
4/15/06 21:00,Pensacola,FL,Circle,2 Seconds,Circle of light travels through cloud leaving a wake in under to seconds to out of view.
4/13/06 09:30,Orlando,FL,Light,15 seconds,UFO over orlando Florida spotted from my aircraft.
4/12/06 21:00,Pensacola,FL,Triangle,30 minutes,Witnessed 2 sets of lights in the sky first around 9pm above my fiance's work while on my way to pick him up. One was triangle shaped a
4/11/06 06:50,Orlando,FL,Oval,Approximately 7 seconds,Silent illuminated quickly moving oval craft in early morning sky on an approximate south to north flight path
4/10/06 19:41,Sunrise,FL,Unknown,Few seconds?,Unknown object spotted while reviewing photo of clouds/shower line taken earlier in day.
4/6/06 00:00,Hialeah,FL,Diamond,walking,a big like like a diamond coming donw fast from the sky
4/5/06 20:00,Palatka,FL,Disk,2:00,A light came out and droped another light...then moved away....Fast!
4/5/06 01:00,Gainesville,FL,Rectangle,5 minutes,Very large aircraft moving at 30 knots at about 2500 feet rectangular in shape.
4/2/06 04:00,Miami,FL,Formation,2 hours,Strange lights over Miami FL
4/1/06 21:45,Miami,FL,Triangle,30 seconds,Another object this time red and triangle shaped.
4/1/06 21:25,Miami,FL,Circle,35 seconds,Red round object traveling east to west
3/30/06 20:30,Palmetto,FL,Flash,1 hour,Unidentified floating flashing and blinking light in Palmetto Florida rural property.
3/30/06 09:26,Tallahassee,FL,Fireball,aprox 5 minutes,Glowing Greenish Firball on Power Lines in Daytime
3/26/06 18:30,Gainesville,FL,Changing,3 minutes,Acrobatics and in broad daylight over city.
3/26/06 01:00,Orlando,FL,Unknown,1 minute,white object over orlando fl
3/19/06 20:30,Tamarac,FL,Light,30 seconds,A little red light flew across the sky.
3/19/06 08:30,Longwood,FL,Triangle,1 minute,T here were 2 UFOS they were both triangular shape. It had lights going back and forth. It had no wings or front lights.It was extremel
3/18/06 18:00,Lakewood RanchBradenton,FL,Cylinder,35 minutes,cylinder object with five bright lights vertical and horizontal
3/18/06 08:30,Hallandale,FL,Circle,,a spinning oval that disappeared toward northeast and to outerspace
3/16/06 23:50,Kendall,FL,Oval,10 seconds,Kendall FL - West - East White Oval - 5-10 Seconds
3/13/06 02:00,South Bay (Belle Glade),FL,Triangle,15 sec,Green triangle over Belle Glade
3/13/06 02:00,Belle Glade,FL,Triangle,20sec,Belle Glade Florida—March 13 2006 Driving north from Key Largo Florida around the time of three A.M. we (my boyfriend Fred Brosn
3/12/06 23:15,Jacksonville,FL,Disk,,Circular disc with two lights viewed over st. johns river jacksonville
3/11/06 22:00,Fort Lauderdale,FL,Light,10 MIN,RED FLASHING LIGHTS WITH A ZIP OF LIGHT GONE WITH GAS CLOUDS OF RED AND GREEN IN FT LAUDERDALE
3/10/06 01:00,Lake Worth,FL,Triangle,2 minutes,Triangle at night no lights or sound; fast.
3/8/06 11:15,Panama City,FL,Sphere,NA,Sphere-shaped orb objects photographed near F22s in Panama City FL
3/6/06 05:45,Winterhaven,FL,Disk,3 min,cresent reflection of light off of a cloaked saucer shaped object over winterhaven fl. at about 5:45 am
3/4/06 20:30,Goodland,FL,Light,1hour,Strange light that changes colors in our South sky every night for the last 10 days.
3/2/06 02:30,Winter Springs,FL,Light,2-3 seconds,Strange appearing/disappearing white light
2/26/06 19:30,Tampa,FL,Unknown,25 - 30 mins,Large diamond or saucer-shaped obect just north of Tampa FL with red flashing lights top and bottom and white lights at ends.
2/19/06 02:00,Tampa,FL,Unknown,1hr,At 2 am in Tampa Fl I saw 2 different UFO's
2/17/06 21:00,Miami,FL,Disk,2 minutes,this ligth was no plane or shooting star.
2/16/06 14:00,Estero,FL,Egg,20 seconds,military jets trying to intercept egg shaped matalic object
2/8/06 21:00,Tampa,FL,Light,2 minutes,Flickering light in Tampa FL
2/8/06 19:22,Panama City,FL,Unknown,3 min,Multiple objects of varying kinds being chase by fighters from tyndall AFB
2/6/06 22:00,Delray Beach,FL,Disk,10 seconds,5 round objects were going south along the beach of Delray over the water they came out of the clouds moving very fast from north to so
2/6/06 18:30,Orlando,FL,Sphere,2 Minutes,Possible Blimp or UFO
1/31/06 04:50,Jacksonville,FL,Sphere,2-3 SECONDS,GLOWING GREEN SPHERE STREAKING ACROSS THE SKY
1/30/06 18:10,Sarasota,FL,Fireball,5 minutes,Fireball in the evening sky
1/28/06 23:00,Indian River,FL,Cylinder,2 min,it looked like it may have haad black squares on itbut it was very bright orange/white color and big
1/27/06 21:00,Ocala,FL,Diamond,,On january 272006 me and my mom and dad were taking our dog for a walk.As we were walking twords the house again we decided to get ou
1/27/06 01:00,Orlando,FL,Unknown,9 seconds,Radiating lights changing from color to another filling the sky
1/21/06,Tampa,FL,Unknown,15-20 minutes,Comet like object seen over South Tampa emitting red spheroids.
1/18/06 09:49,Palm Beach Gardens,FL,Light,1 hour,White lights slowly moving. Distinctly different from stars meteors and comets due to appearance and movement. To ensure that it was
1/15/06 21:00,Clermont,FL,Changing,1 hour,Christmas lights spot lights through the clouds cruising crafts hovering crafts with lights showering down.
1/14/06 20:30,Clermont,FL,Circle,30 minutes,The objects were not traveling at a normal aircraft speed or motion I have never seen circular lights on a plan.
1/11/06 23:00,Gainesville,FL,Oval,my house,saw 2 ufos@my house on jan 11 2006 took pixes from my digital 7.0 megapixs cameralyl
1/8/06 21:00,Orlando,FL,Unknown,20 minutes,"Possible ""Triangle"" shaped craft w/3 flashing white lights seen North of Orlando."
1/8/06 21:00,Pembroke Pines,FL,Triangle,40 minutes,triangular object with flashing red blue and white lights.
1/8/06,Panama City Beach,FL,Sphere,2-3 hours,We were Hurricane evacuees...it was at this point that we knew it was something extraordinary..
1/4/06 19:30,Gulf Breeze,FL,Fireball,10 minutes,Navarre / Gulf Breeze birght orange fireballs horizontally aligned
1/4/06 05:40,Orange Park,FL,Oval,seconds,Look like a bright star flying very fast with no trail behind it.
1/3/06 06:00,Lantana,FL,Unknown,2 minutes,Red pulsating light seen in Lantana Florida
1/2/06 14:30,Venice,FL,Circle,approximately 5 minutes,Small black object seen over Venice Fl
12/28/05 18:34,Orlando,FL,Light,25-30 seconds,"Noticed ""star"" moving across sky...it stopped...continued moving and changed color...streaked away in a second."
12/27/05 23:00,Lehigh Acres,FL,Triangle,15 sec,Question over what i saw.
12/24/05 21:00,Plantation,FL,Fireball,1min 30seconds,Bright Orange / Red Light with no strobe lights
12/17/05 21:30,Jacksonville,FL,Triangle,3 min,Dark triangle shape with v-shaped lights over the St Johns River.
12/16/05 02:45,Jacksonville,FL,Light,2 minutes,small object thought of as a star started moving changed direction then faded away
12/15/05 20:25,Orlando,FL,,30 sec,3 objects moving at what apppeared to be high speed. They were observed to cris-cross. Moving at high speed. I am close to both Orla
12/15/05 17:00,Geneva,FL,Formation,45minutes,3 Bright lites hovering 5000 ft.above the water with no sound at 5pm on the 15th.of this month.AWESOM!!
12/14/05 00:00,Sebring,FL,Light,Under a minute,Light hangs mid-air then dashes across entire horizon before dissapearing
12/13/05 20:00,Crawfordville,FL,Cigar,2 seconds,a long object full of light that disappeared behind the trees
12/13/05 08:00,Bonifay,FL,Disk,30 mins,We have live uncut footage of it from a security camera digital that was recently installed however the angle on one of the camera's w
12/12/05 09:00,Navarre Beach,FL,Unknown,20 minutes and possibly l,Perfectly circular cloud with a circular rainbow on the edge of the round cloud.
12/12/05,Boca Raton,FL,Triangle,4 minutes,It wasn't that late at night the air craft was extremly big and had some unique colors coming from it.
12/8/05 19:30,Crawfordville,FL,Light,5 seconds,I was driving home I saw the object first about 7 miles from my house and it quickly disappeared the about a mile from my house i saw i
12/3/05 19:00,North Port,FL,Circle,4 hours,one object like large overly bright star circular emitting flashes of color moving slowly to SW from Latitude N 27.0917 Long W 82
12/1/05 21:00,Tallahassee,FL,Cigar,10 minutes,Large & close up viewing by 3 people of a cigar shaped object with 2 bright red glowing orbs at each end.
12/1/05 07:10,Miami,FL,Flash,,dark shine moving at very high speed over miami
11/29/05 18:35,Orlando,FL,Light,5/10min,2 lights high NE in orlando not moveing just fadeing in and out
11/29/05 06:45,Orlando,FL,Light,1 to 2 mins,Two bright lights in orlando strange behavior.
11/26/05 19:30,Sarasota,FL,Oval,one hour,the object seen was oval in shape with two winglike projections and a blue light emanating from the tail as seen with a pair of binocul
11/25/05 21:30,Lehigh Acres,FL,Oval,2-3 sec,dull roundish blur crosses night sky
11/25/05 20:25,Tampa,FL,Triangle,45 seconds,translucent isosoles triangle with red flashing light at each triangle point moving in an arc through the sky
11/25/05 04:15,Palm Beach Gardens,FL,Other,ongoing,bright orange light in western horizon further examination=orange lights in shape of stealth aircraft bellyrotating
11/24/05 22:30,St. Petersburg,FL,Sphere,+1 hour,starlike objects with very distinct flashing colored lights.
11/24/05 00:15,Port St. Lucie,FL,Light,1 Hr 15 Min,Large white light W/red & green--Thought might be aircraft in trouble due to eratic movement(leftrightupdown)--then small red green
11/23/05 03:00,Dade City,FL,Disk,2-3 seconds,I often don't sleep well so go outside at night to look at the stars. I noticed that there were some clouds to the southeast but non
11/21/05 20:00,Boca Raton,FL,Light,2+ hours,white lights in sky over ocean which could not be airplanes helicopters or stars
11/18/05 21:45,Bonita Springs,FL,Unknown,35 minutes,I observed two lights flying in and out of a cloud formation. The flight pattern was unlike a normal aircraft flight pattern. I retired
11/15/05 11:12,Merritt Island,FL,Light,1 minute,There was a full moon out and i decided it would be a good picture so I started filming the moon with my cell phone. What I notice late
11/15/05 08:00,St. Augustine,FL,Triangle,5min,I have to report this because it has been bothering me for several month's.I was a foreman at Norsk Hydro Aluminum plant during this s
11/15/05 00:00,Lakeland,FL,Triangle,several hours/days,I believe we are being visited a lot more than people think.
11/11/05 21:00,Jacksonville,FL,Triangle,1.5 seconds,solid triangular formation of white lights probably birds
11/11/05 17:20,Okeechobee,FL,Cylinder,3 minutes,Bright white wingless object traveling silently at a high altitude
11/9/05 20:30,New Port Richey,FL,Other,45 seconds,Y shaped aircraft flew down my street made no sound and had no lights on
11/7/05 20:00,Navarre,FL,Triangle,5-8mins,THE LIGHTS WAS RED GREEN BLUEAND STAYED IN ONE SPOT. (U.F.O.)
11/7/05 19:00,Navarre,FL,Rectangle,5-8mins,THE LIGHTS WERE NOT MOVINGTHEY WERE GREENBLUEREDWHITE LIGHTS IN THE SKY5-8MINS.
11/7/05 18:40,Navarre,FL,Formation,10 mins,"Formation of five bright amber lights held a hover in ""W"" formation over NW FL Mon 7 Nov 1840L"
11/7/05 18:40,Fort Walton Beach,FL,Light,10 mins,"Five bright amber lights form a ""W"" formation and hover 5 mins over NW FL sky 1840L Mon 7 Nov '05."
11/7/05 18:35,Navarre,FL,Light,10 Minutes,Multiple AD USAF witnesses report formation of bright lights hovering over rural Santa Rosa County FL
11/7/05 18:30,Navarre,FL,Diamond,5 min,Five ship amber diamond formation (fifth above diamond at 10-11 o'clock postiotion) to 45 deg. hor. slant
11/7/05 18:25,Navarre,FL,Formation,about 5 min,5 bright lights in formation over florida
11/7/05 18:15,Navarre,FL,Formation,10-15 Min,The time was about 6:15 - 6:25 pm on 7 Nov 2005 after stoping at a Tom Thumb on Hwy 87/399 (East Bay Blvd) at about 6:10 pm walking ou
11/7/05 18:00,Navarre,FL,Other,5 minutes,5 light formation over Navarre sounds similar to other sighting
11/7/05 15:00,Pensacola,FL,Sphere,a minute or so,Saw Red/Orange circular glowing objects.
11/5/05 21:30,Jensen Beach,FL,Unknown,15-20 Seconds,We were watching a light we thought was a planet but then the light shot off at great speed.
11/3/05 23:45,Rockledge,FL,Unknown,on-going,"moving yellow star-shaped light -- stationary then moving erratic -- still there.

then a white star near it we were not watching"
11/3/05 18:40,Naples,FL,Other,5-7 seconds,A HUGE boomerang shaped object  silent no lights traveling EXTREMELY fast over the Naples Florida skies
11/2/05 21:30,Mount Dora,FL,Disk,1 to 5 sec.,while driving to work the other night I looked up and out of my top left corner of my windshield and saw this very bright light that lo
11/1/05 00:50,Orlando,FL,Circle,four seconds,An object in the north sky moved downward and eastward emitting a red and blue trail at high speeds lasting four seconds.
10/31/05 11:29,Shalimar,FL,Flash,2-3 seconds,There were lights on the object There were aircraft in the vicinity or aircraft chasing the object .
10/28/05 18:15,Cocoa,FL,Oval,5-10 secs.,"""Here 1 min. gone the next"""""
10/26/05 14:00,Orlando,FL,Cigar,5 minutes,Cigar shaped bright aluminum craft appeared in the north west sky at an elevation of about 35 degrees.
10/26/05 01:00,North Miami Beach,FL,Other,30 seconds,We saw a manta ray shaped object looked like it was trying to camouflage in the sky.
10/25/05 22:00,Miami Beach,FL,Chevron,1 minute,Tuesday 10/25/05 during the Hurricane Wilma blackout I saw a large boomerang shape fly from North to South over Miami Beach.
10/24/05 22:50,Miami,FL,Triangle,5-10 mins.,Triangular Object spotted over Miami after powerful Hurricane
10/24/05 20:30,North Miami,FL,Light,10+minutes,MOVING STARS
10/24/05 10:17,Lauderhill,FL,Oval,1 minute or less,Stonebridge Gardens Lauderhill FL spacecraft sighting in wake of Hurricane Wilma 10/24/2005
10/20/05 21:10,Brandon,FL,Light,4 secs.,10/20/05 21:10 Brandon Fl. Light 4-5 seconds Fast moving and turning at a steadily increasing speed until it went out of sight
10/20/05 20:14,Gainesville,FL,Triangle,~1 min,Slow moving low flying black triangle with dim star-like lights
10/18/05 23:00,Orlando,FL,Other,10 seconds,I was standing out side and saw what I thought was going to be a shooting star but it went way to far. Horizon to horizon There was
10/17/05 06:45,Orlando,FL,Light,7-8 seconds,Odd movement and speed of star-sized object in early morning sky
10/16/05 06:28,Daytona Beach,FL,Light,20 min,We were picnicking on a pier over the beach as the tide was high and the water engulfed the entire beach. We had layed down on the bla
10/13/05 20:00,Miami,FL,Other,2 minutes,A boomerang shaped craft moving north to south stopped circled and continued south movement.
10/13/05 04:30,Jupiter,FL,Light,10 seconds,Single small white light
10/12/05 02:05,Longwood,FL,Formation,20 seconds,Two glowing discs slowly glide accross Longwood FL night sky.
10/11/05 00:00,Holiday,FL,Light,ohrs,light dancing over holliday florda
10/10/05 21:30,North Miami Beach,FL,Other,60 min,a manta ray shaped object with orange and yellow lights flashing in
10/10/05 11:30,Edgewater,FL,,300,orange ball in sky video taped over edgewater florida
10/10/05 09:30,North Miami Beach,FL,Oval,30 minutes,i sent you an e-mail 2 days ago and really want to be contacted PLEASE contact me asap I'm not crazy and nether is my wife please c
10/8/05 06:15,Orlando,FL,Light,1 minute,As I was looking I noticed this light almost like a star or a plane moving slowly.
10/5/05 23:30,Clearwater,FL,Chevron,6 Sec,While sitting outside at night a dark boomerang flew silently above me. It was sharp edged with appx 4 blurry whiteish lights on each
10/5/05 02:00,Stuart,FL,Unknown,2 hours,not sure what i saw
10/1/05 18:00,West Palm Beach,FL,Teardrop,1 min,I've seen the black teardrop/sphere/baloon too....
10/1/05 12:00,Lake Worth,FL,Sphere,3 minutes,LARGE SPHERE SHAPPED OBJECT SIGHTED HOVERING WEST OF LAKE WORTH
10/1/05 08:22,Homestead,FL,Light,5mins,its the same spot where my brother said he saw sumtin up in tha sky a few years earlier....
9/30/05 18:28,Coral Springs,FL,Disk,1 minute,SHIP BY THE SUN TOOK A PICTURE IN AMAZEMENT
9/29/05 20:00,Port Richey,FL,Unknown,1 hour,Bright Lights Above Port Richey.
9/29/05 19:00,Miami,FL,Fireball,5sec,HUGE OBJECT ON FIRE APPROACHING EARTH AT HIGH SPEED SEEN FROM MIAMI FL
9/29/05 19:00,Florida (coastline),FL,Fireball,about 20 secs,Fireballs seen along Florida's coastline in a couple weeks
9/29/05 18:50,Lake Worth,FL,Unknown,seconds,we just saw a big flash in the sky on the eastern horizon  when we looked up the only thing there was a line of smoke like if a airpl
9/29/05 18:00,West Palm Beach,FL,Unknown,30,bright light streaking and smoke floowing the burn up.
9/28/05 05:52,Port Richey,FL,Other,3 Seconds,Unique Flying Boomerang Seen !
9/28/05 02:38,Jacksonville Beach,FL,Triangle,15 minutes,Huge triangle of lights gliding smoothly southeast with no sound.
9/26/05 23:39,Indian Harbour Beach,FL,Fireball,one minute,11:39 pm watched a huge yellow ball of flame slowly cross the sky leaving glowing pieces falling behind
9/26/05 03:15,Panama City,FL,Flash,In The Sky,Unidentifed Flashing Object In Sky Observed.
9/25/05 23:45,Port St. Lucie,FL,Fireball,45 Sec,Orange firebal went across the sky from ~WNW to ESE over the ocean
9/25/05 13:45,Melbourne,FL,Diamond,1,Unusual object in digital photo noticed only when downloaded on laptop...nothing seen during photo shoot
9/24/05 23:00,Deerfield Beach,FL,Triangle,30 seconds,I saw a boomerang/triangle shaped object sort of swimming through the air. It moved like a jelly fish and looked like it was plasma.
9/23/05 23:30,Chipley (15 miles southeast of),FL,Light,10 mins,Bright lights with no sound in NW Florida area. Jets in full AB's in area also.
9/23/05 21:00,Palm Coast,FL,Light,30,These sightings began on 23 Sep 2005 at approximately 2100. Two lights one traveling north to south and the other one east to west. T
9/20/05 18:30,Deltona,FL,Fireball,2 seconds?,Very bright fireball over Deltona Florida skies
9/19/05 19:30,Miami,FL,Other,30 seconds,Objects photographed over Miami
9/18/05 23:50,Plantation,FL,Light,5 min,While driving in my jeep with my top down an object in the sky caught me eye so I pulled over to watch it. It looked like an extremely
9/16/05 19:20,Edgewater,FL,Sphere,30 seconds,Fire from the sky
9/14/05 22:20,Estero,FL,Teardrop,15 seconds,Large bright green object with a small amount of red in back was observed rapidly crossing the sky moving west to east at a low angle t
9/11/05 23:00,Dade City,FL,Light,3-4 minutes,bright light-moved slowly over city for a couple of minutes thenat a high rate of speed zipped away.
9/9/05 04:00,West Palm Beach,FL,Light,15 min,I woke up to get a drink of water. I looked out of my 2nd floor terrace doors and saw 2 small red lights.
9/8/05 00:00,Miami,FL,Light,40 minutes,Darting light popping ears
9/4/05 21:45,Venice,FL,,15 seconds,Venice Florida boomerang shaped group of 10-15 objects
8/22/05 21:00,Bonita Springs,FL,Formation,00:00:15,Two formation flying lights and red spheres flew across the sky out of distance.
8/18/05 03:00,New Port Richey,FL,Other,15 min,object light was constant looked like a shooting star with a short tail
8/14/05 22:15,St. Petersburg,FL,Cross,3 minutes,White Cross composed of 4 lights down and three across ocer my home in St. Petersburg Florida
8/11/05 23:30,Homestead,FL,Light,45 minutes,We went out to see the meteor shower tonight. We figured the best place away from the Kendall area (and bright city lights) was Homest
8/9/05 23:45,New Smyrna Beach,FL,Fireball,3 to 4 sec,Bluish ball of light observed at New Smyrna Beach Florida. Possible bolide.
8/4/05 22:30,Fernandina Beach,FL,Egg,90 sec at most,Two rose-red ovals chase each other 5k feet overhead on straight course little or no sound.
8/1/05 07:00,St. Petersburg,FL,Light,one hour,We saw something in the sky.
7/29/05 21:30,Miami,FL,Light,2 minutes,Two separate lights within ten minutes.
7/27/05 07:30,Davie,FL,Teardrop,10 minutes,black teardrop shaped object floating over davie florida
7/22/05 16:00,Jacksonville,FL,Light,30min,at first i thought that they were aircraft but they weren't as high or low as the airplanes and helicopters were. They seem to just lin
7/21/05 19:30,Jacksonville/Ft. Pierce,FL,,,Dozens of people from Jacksonville to Ft. Pierce flooded the U.S. Coast Guard late Tuesday with calls about a mysterious ball of fire
7/18/05 19:15,Jacksonville,FL,Light,7 min,Eight silvery relflective objects. Six stationary and two moving near the others. All faded from view in 7 minutes.
7/15/05 14:00,Boynton Beach,FL,Circle,5 seconds,Strange round object seen against a very clear blue sky in the middle of the day.
7/14/05 00:20,Palm Harbor (Clearwater),FL,Light,22 minutes,saw a light in the sky i thought was a planet and after a few minutes it shot off and disappeared. Reappeared later then disappeared.
7/13/05 00:20,Mile Marker 120 (approx.),FL,Unknown,12 mintues,Object hovers over community and emmits 4 shooting star like object down towards the community.
7/11/05 23:45,Port Saint Lucie,FL,Diamond,1 minute,Two diamond shaped lights in the sky pulsating.
7/9/05 18:00,Titusville,FL,Formation,5 min,2 objects moving sw to ne 50 mph2000-3000 aglconstant cousrespeed 1st obj lower in front2nd higher and behind
7/5/05 21:00,Sebring,FL,,10 minutes or more,Flashes on camera screen could not be seen looking into the sky or through the eye of the camera. It became part of the shed.
7/4/05 19:00,Davie,FL,Disk,3 hours,7/4/05 seven to eleven(approx) Northwest of Ft. Lauderdale-saucer shape-light on top pulsing- 5/24/06
7/4/05 12:30,Sanford,FL,Triangle,10 mins,Triangle shaped Craft.
7/4/05 09:00,Fort Walton,FL,Fireball,ten seconds,((HOAX)) It looked like a slow-moving fireball.
7/3/05 21:00,Clearwater,FL,Unknown,1 hour,Strange lights fast movements clear sky
7/3/05 08:30,Destin,FL,Unknown,4 minutes,Object with an array of white lights
7/2/05 02:48,Offshore/West Coast,FL,Cigar,3 min,"this was seen by 6 other person""s aboard a fishing charther boatand maybe one of the deck handsmost of the other fisherman were in th"
6/30/05 14:00,Jacksonville,FL,Light,2 hours,I was flying at 45 thousand feet in a Lear Jet when I sat back in the seat and looked up into the sky and saw a bright star like object
6/30/05 13:00,St. Petersburg,FL,Cigar,15 minutes,In 2005 I was walking to a phone booth to call my husband and I felt that I was being watchedI looked up and there it wasI told my hu
6/30/05,Koh Samui (Thailand),FL,,long,Large object(s) hovering low on horizont in Koh Samui island
6/29/05 21:45,Lantana,FL,Unknown,2 min.,4 lights moving slowly and disappearing with loud boom
6/29/05 20:45,Lantana,FL,Unknown,2 min.,"This is in reply to the report.

I looked at the pictures and I can clearly see that this is an aircraft moving away from the witnes"
6/28/05 13:00,Naples,FL,Sphere,about 2 seconds,White sphere with contrail.
6/24/05 19:00,Miami Beach,FL,Chevron,10 MINUTES,SAW A CHEVRON UFO WHILE RIDING MY BICYCLE
6/24/05 19:00,Fort Pierce,FL,Light,2 hours,Date:6/24/2005; City: Fort Pierce Florida USA; Shape: Dark object and Ligths; Duration: 1:30 minutes
6/20/05 21:30,Frostproof,FL,Fireball,2 min.,Giant orange ball of light rising from the woods and had no noise to it.
