date_time,city,state,shape,duration,summary
5/7/21 21:20,Grove,OK,Light,20 minutes,It was like watching a hundred lights marching off to war single file
5/2/21 04:00,Claremore,OK,Triangle,3 seconds,Large triangular object with soft points light blue edges and black towards the center. It was moving incredibly fast. It was moderate
4/17/21 03:00,Porter,OK,Unknown,5 seconds,Two bright white objects fly across sky
4/10/21 21:45,Edmond,OK,Cylinder,10 minutes,12 yellow fireballs that made patterns with a cylindrical object below the lights not visible with the naked eye.
4/10/21 21:30,Edmond,OK,Cylinder,4 minutes,12 Fireballs and one cylinder shaped craft above Edmond OK on Saturday April 10 2021 between 9:30 pm and 10:00 pm
4/7/21 21:02,Nicoma Park,OK,Formation,45 seconds,UFO seen in Oklahoma. ((Starlink satellites??))
4/7/21 09:10,Tulsa,OK,Other,1 minute,I was outside on my porch when I saw a string of 50 lights or so crossing over the sky from the northeast. ((Starlink satellites??))
3/24/21 20:36,Muskogee,OK,Light,20 minutes,Orange Lights in Muskogee Sky
2/24/21 20:15,Maysville,OK,Oval,4 seconds,Strange unidentifiable light
2/24/21 08:10,Pryor,OK,Light,10 seconds,Was walking dog saw a bright white light in The sky no much higher than a tower moving in a downward angle at a slow but steady speed t
1/22/21 22:00,Heavener,OK,Light,1 minute,Light object in the sky near Heavener Oklahoma
1/17/21 22:15,Ramona,OK,Light,15 minutes,Three brightly colored lights took up position on the horizon.
1/12/21 16:00,Mustang/OKC,OK,Light,30 seconds - 1 minute,Bright blue/white ' star-like' light in broad daylight appears moves then vanishes.
1/4/21 23:46,Colcord,OK,Circle,15 seconds,Bright white at the center blue light haze exterior was about 50 Ft from my vehicle if I had to guess the size 10-20 feet in diameter
1/3/21 22:20,Mustang,OK,Cylinder,3 minutes,2 groups of 3 to 6 bright orange cylindrical objects appearing and then disappearing as though they &quot;burned out&quot;.
12/14/20 00:00,,OK,Fireball,,Fireball resembing color of other meteors that night fell perfectly straight down as if it was a drop delivery or disguised landing.
12/6/20 19:00,Edmond,OK,Unknown,45 seconds,Two extremely bright lights appear quickly high in the sky and disappear as fast.
11/28/20 17:14,Ardmore,OK,Other,5 seconds,The creature was tall slender dark humanoid.
11/23/20 19:15,Stillwater,OK,Circle,4 minutes,5 White Circles Moving in random formation.
11/18/20 18:55,Bartlesville,OK,Oval,2 minutes,I was outside taking pictures of the moon. I turned my head away from the moon glancing another direction. As I did so I saw a rathe
11/16/20 21:30,YUKON,OK,Rectangle,2 minutes,Large dark silent object flies over town before turning and disappearing from view.
11/16/20 18:30,YUKON,OK,Light,2 minutes,I saw two very different UFOs in the same night. This is the first of the sightings. I was watching the sunset and it was still very
11/15/20 01:30,perkins,OK,Circle,2 hours,Small bright orb flashing with disco lights when moving on and off in the sky very bright
11/14/20 20:30,Oklahoma City,OK,Circle,20,Flickering orb that may have been two orbs near the end.
11/6/20 21:25,Oklahoma City,OK,Cigar,0.001,Fast moving white and green that disappears.
11/1/20 12:13,Delaware,OK,Sphere,5 minutes,Comet like object which changed speed and direction.
10/27/20 07:28,Midwest city,OK,Light,7:28am-7:31am,Bright misty orange or amber light flashing sporadically like lighting almost. Has rained all at but this was NOT lighting! It was isol
10/24/20 21:30,Davis,OK,Formation,30 seconds,Horizontal string of lights evenly spaced flying in a straight line. ((Starlink satellites?))
10/24/20 20:03,Yukon,OK,Unknown,20 seconds,Looked like a string of white light diamond shaped objects heading due south. ((Starlink satellites?))
10/24/20 20:00,Norman,OK,Cylinder,30 seconds,Long string of white lights. ((Starlink satellites?))
10/24/20 20:00,Cache,OK,Light,2-3 minutes,Think it could of been starlink there was a scheduled launch at 11am but no reports of being over Oklahoma.
10/24/20 20:00,Enid,OK,Other,25 seconds,20 or so individual lights in a close line moving as one. ((Starlink satellites?))
10/24/20 19:57,Duncan,OK,Cigar,2 minutes,Long maybe 16 lights on side the same on the other side very uniform in the middle of the lights ((Starlink satellites?))
10/16/20 20:34,Oklahoma City,OK,Light,10 minutes,Bright white lights flying in military formation. ((Starlink satellites??))
10/11/20 18:00,Norman,OK,Sphere,30 seconds,Bright white orb with no sound.
10/6/20 06:40,Tulsa,OK,Circle,4 minutes,Light came from southwest moving east northeast. Thought it was iss but as it came closer it was too bright. Was very bright white not
10/4/20 21:30,South edmond,OK,Cigar,5 seconds,White craft cigar shaped traveled west to east There were no lights on just a white cigar shaped craft. Approximate speed was 800 to 9
10/3/20 08:32,Ponca City,OK,Formation,5-10 minutes,Pentagon Formation folloiwed by huge vapor trail
10/2/20 08:00,Yukon,OK,Sphere,3-4 minutes,Yellow light above treeline in the country too big to be a light or plane
9/30/20 17:08,Edmond,OK,Egg,30 seconds,Silver UFO seen in Edmond suddenly vanished
8/31/20 21:30,Bartlesville,OK,Oval,10 minutes,Red orbs (4) dancing erratically for 10 min then disappeared suddenly in the north sky!
8/28/20 22:00,Choctaw,OK,Light,5 minutes,bright light over eastern choctaw oklahoma thought it might of been just a radio tower cause it had a slight red color to it cause was
8/19/20 00:16,Glencoe,OK,Other,30 minutess,Silver pipe shaped craft hovers with no support or sounds and then vanished in a flash of green.
8/16/20 22:15,Norman,OK,Light,2 minutes,Saw a light move slowly high into the sky then the light when out and when it came back on again it zoomed out through the ozone.
8/11/20 20:30,Cushing,OK,Circle,2 hours,My daughter called about 20:30 and ask if I would go outside and see if I could see the object in the sky that she and her family were
8/5/20 01:57,Park Hill ( Tahlequah),OK,Fireball,All night,8 balls of fire we saw moving into a line in the sky. Other objects as well later saw a circular object in sky
7/30/20 05:12,Elgin,OK,Cylinder,15 seconds,UFO near Elgin Oklahoma
7/29/20 21:20,Chelsea,OK,Disk,5 min,Unable to identify
7/28/20 21:00,Pauls Valley,OK,Circle,30 minutes,The objects I saw were orange flashing moving at incredible speeds and didn’t look like anything I’ve ever seen before.
7/25/20 21:45,Moore,OK,Light,10 seconds,Bright light hovers then vanishes at the speed of light
7/25/20 00:00,Sapulpa,OK,Flash,15 seconds,White flashing pattern of one bright flash followed by two faint ones half a second later and repeating
7/11/20 02:40,Yukon,OK,Triangle,3-4 seconds,UFO triangle composed of spheres sighting over Yukon Oklahoma
6/14/20 23:00,Oklahoma City (SW OKC/ Moore,OK,Light,20 minutes,Multiple flickering objects seen at cloud level near Will Rogers Airport.
6/14/20 13:00,Hendrix,OK,Circle,30 minutes,Clearly visable light or white object in the northwest sky moving southwest. used binoculars and looked possibly like a weather balloo
6/7/20 22:17,Norman,OK,Changing,:20,Bright Disappearing Light.
6/7/20 22:17,Norman,OK,Changing,:20,Bright Disappearing Light
5/31/20 22:00,Lawton,OK,Triangle,2 minutes,Saw the first craft pop up on the east side of Lawton zoom all the way out to the wichita mountains range and back in a matter of abo
5/28/20 21:00,Ada,OK,Rectangle,15 seconds,The object was rectangular green and horizontal.
5/20/20 23:15,Edmond,OK,Light,30 seconds,Saw what I thought was a spotlight then it began to move at no speed a normal aircraft could maintain and in a jagged pattern. Flew ac
5/19/20 23:00,Perry,OK,Unknown,10 minutes,4 Lights following appearing one after each other not completely uniform but going same direction west to east ((Starlink satellites?))
5/14/20 16:00,Medicine park,OK,Circle,Unknown,Object with halo.
5/8/20 22:00,Muskogee,OK,Sphere,2 minutes,One red orb moving from left to right up and down  back left and disappeared covering miles of sky in seconds.
5/1/20 00:04,Mill Creek,OK,Sphere,25 seconds,The Silent Amber Sphere
4/29/20 23:55,Tulsa,OK,Circle,7seconds,Object appeared Southwest moving very very quick to the northeast. After the object made it a ways to the northeast it turn quite abrup
4/28/20 21:45,Lawton,OK,Formation,5 minutes,Linear light formation traveling east. ((Starlink satellites??)
4/28/20 20:27,Tulsa,OK,Triangle,58 seconds,Photos of ufo hidden in cloud bank after thunderstorm.
4/28/20 20:26,Spencer,OK,Disk,30-45 seconds,There was a single line of 13 saucer shaped disc headed east there was no no noise. ((Starlink satellites??)
4/20/20 20:30,Calera,OK,Teardrop,5 minutes,Red yellow orb travels erratically.
4/17/20 22:45,Seminole,OK,Light,20 minutes,My husband and I were driving last night and I was watching this bright orange light slowly rise straight up above the tree line. The f
4/16/20 23:00,Lawton,OK,Light,15 minutes,Saw 18 bright small lights following each other in a line. ((Starlink satellites))
4/16/20 22:40,Broken Arrow,OK,Circle,10 minutes,White light circular in shape changed to orange over Creek Turnpike.
4/16/20 21:50,Muskogee,OK,Circle,10 minutes,I noticed a solid l ight and then another solid light then another. ((Starlink satellites?))
4/16/20 21:35,Claremore,OK,Formation,10 minutes,Line of craft moving in formation from south to north perfect line spaced exactly. ((Starlink satellites?))
4/16/20 21:00,Atoka,OK,Formation,15 minutes,Single line formation fast moving star-like in the western sky. ((Starlink satellites?))
4/14/20 09:00,Muskogee,OK,Circle,15,Tons of satellites. ((Starlink satellites?))
4/5/20 20:25,Oklahoma City,OK,Light,3-4 seconds,"Dog was barking like crazy in the back yard.

Went outside to see why and saw a red and blue rhythmically flashing light in the south"
3/31/20 23:00,Altus,OK,Triangle,,There were 5 triangler shaped objects with lights flying real low they were slowly flying around in the same area they would stop for
3/31/20 21:41,Broken Arrow,OK,Formation,1 minute,I saw 6 UFO's tonight in a v shape around Venus
3/31/20 21:00,Bixby,OK,Cigar,60 minutes,Bright stationary cigar/tube shaped light. ((NUFORC Note: Venus?? PD))
3/25/20 23:05,Yukon,OK,Unknown,3 minutes,It was a clear night with no clouds in the sky
3/25/20 06:00,Oklahoma City,OK,Sphere,15 minutes,Flight of Orbs in early morning Oklahoma City sky. ((Starlink satellites??))
3/24/20 20:48,Kiefer,OK,Light,2 minutes,Eleven sightings four following each other boomerang shape all within an hours time. ((Starlink satellites))
3/10/20 22:00,Hobart,OK,Formation,30 minutes,Lights moving over Hobart look like shooting stars or satellite
3/10/20 17:29,Chandler,OK,Circle,Few minutes,Small slow white ufo. ((anonymous report))
3/6/20 19:35,Manchester,OK,Light,15 minutes,Approx. 735 pm we witnessed a perfect line traveling from south west to northeast direction. ((Starlink satellites))
2/28/20 05:45,Okmulgee,OK,Circle,5-7 minutes,We were traveling south on highway 75 and were about 10 miles outside of Okmulgee when I noticed what at first I thought was a star con
2/28/20 05:00,Wister,OK,Sphere,5 minutes,"Line of single orb like lights. ((""Starlink satellites??)) ((anonymous))"
2/27/20 20:13,Oklahoma City,OK,Triangle,2 minutes,Obtuse triangle shaped UFO in downtown OKC
2/25/20 06:18,Guthrie,OK,Sphere,3-4 minutes,Myself and my husband observed and incredibly straight line of spherical objects in the early morning sky. ((Starlink satellites))
2/22/20 20:03,Oklahoma City,OK,Light,5 minutes,"10 lights travel across the sky and disappear in the same place one by one. ((""Starlink"" satellites??))"
2/17/20 20:50,Oklahoma City,OK,Sphere,~1 minute,Red sphere moving north to south over Oklahoma City 2/17/20
2/15/20 19:30,Fay,OK,Light,30 minutes,Large bright light with smaller lights flying away from it.
2/13/20 23:04,Tulsa,OK,Triangle,13 minutes,Triangular object with a single white bright light on each corner. Hovered until I got closer and then took off north
2/8/20 06:30,Oklahoma City,OK,Light,2 minutes,String of lights that disappeared one by one
2/7/20 13:00,Muskogee,OK,Cigar,5 minutes,Sighting in afternoon with military aircraft
2/7/20 11:15,Elgin,OK,Cigar,2 minutes,White cigar shaped ufo over Elgin
2/7/20 05:36,Sand Springs,OK,Light,2 minutes,Observed 5 same sized luminous objects in sky traveling from South to North in a straight line. First object was slightly ahead of the
2/2/20 21:00,Apache,OK,Circle,15 minutes,"Saturday Feb 2nd went outside to my truck to get keys  seen a single file of dim white lights((""Starlink"" satellites??))"
1/24/20 19:45,Oklahoma City,OK,Flash,1 second,Green light across sky
1/6/20 08:15,Jenks,OK,Triangle,,It was a triangular shape aircraft and had one bright light and flashing lights on both sides like an airplane but it was moving slowly
1/4/20 15:15,Tulsa (Tulsa airport Sheridan Rd.),OK,Disk,2-3 minutes,Gigantic disc seem very clearly Tulsa International Airport. I can't be the only one that ever seen it was so gigantic
1/3/20 22:30,Stilwell,OK,Light,2 minutes,Saw a bright white light in the sky. It was flashing slowly. Just hovering in one spot for about 2 minutes. it disappeared when an ai
1/3/20 21:00,Ada,OK,Light,5 minutes,I took a small bag to our poly cart already at the curb in front of the house for next day pickup. My eye caught a blinking light in th
1/3/20 20:20,Tulsa,OK,Sphere,5-6 seconds,Technically this was a ufo simply because I truly can't imagine what could have met the same velocity it was traveling that would also
12/22/19 18:20,Shidler,OK,Circle,15 minutes,"Multiple objects appearing in the west traveling east 50+ observed. ((""Starlink"" satellites??))"
12/21/19 23:50,Poteau,OK,Triangle,3 seconds,Admiring the stars while walking dog looking up and observed 3 lights with equal distance apart moving quickly and no noise made and t
12/14/19 23:57,Oklahoma City,OK,Light,2 seconds,Fastest lights ever seen
12/2/19 20:22,Oklahoma City,OK,Oval,5 minutes,While on the Will Roger's turnpike from okc to Tulsa: a green light appeared in the west sky such as a star. Then the green light dropp
12/2/19 20:09,Broken Arrow,OK,Light,15 seconds,Happend to look up NE of Broken arrow was a VERY bright shiny light. ((anonymous report))
11/25/19 18:20,Indianola/Canadian (between),OK,Light,30 minutes,Well after sunset traveling west on SR 113 from US 69 I observed two equally sized lights to the (general) west. They stayed motionless
11/24/19 22:30,Claremore,OK,Triangle,5 minutes,Gray triangular aircraft flying low circular aircraft following.
11/24/19 05:30,Moody,OK,,5 minutes,"Approx 40 White lights in single file flying East near Moodys OK ((NUFORC Note: ""Starlink"" satellites? PD))"
11/22/19 05:19,Noble,OK,Light,4min,stream of lights in a perfect line. ((NUFORC Note: Starlink satellites? PD))
11/22/19 05:19,Noble,OK,Light,4 minutes,"stream of lights in a perfect line. ((NUFORC Note: ""Starlink"" satellites? PD))"
11/15/19 01:07,Miami,OK,Triangle,10-15,Three orangish-red lights. Maybe 8 stories above my car hovering made more of blowing noise than propeller noise. Slowly began to move
11/13/19 23:00,Norman,OK,Triangle,O,I was asleep until I was woken up with the noise of a flying object what I think is a USA I am currently 9 Years of age to this day I w
11/12/19 19:00,Chickasha,OK,Light,2 minutes,"Line of lights that disappeared one by one in order. ((NUFORC Note: Cluster of ""Starlink"" satellites. PD))"
11/12/19 18:32,Bokoshe,OK,Formation,1-2 minutes,"I looked out my car window at the sky and immediately noticed 15-20 lights. ((NUFORC Note: Cluster of ""Starlink"" satellites. PD))"
11/12/19 18:30,Tuttle,OK,Light,10 minutes,"very long staggered string of lights. ((NUFORC Note: Cluster of ""Starlink"" satellites. PD))"
11/12/19 18:29,Norman,OK,Formation,2 minutes,"a string of lights that went on for miles in the West sky((NUFORC Note: Cluster of ""Starlink"" satellites. PD))"
11/12/19 18:00,Locust Grove,OK,Formation,10 minutes,No sound and 20 single lights in a straight line about a mile long. ((NUFORC Note: Spacelink satellites. PD))
11/10/19 12:31,Tahlequah,OK,Oval,3 minutes,Two round black objects in a formation heading NNW. No sound slow moving at least 3000ft.
11/10/19 00:30,Glenpool,OK,Egg,20 minutes,3-4 lights and/or round-egg shaped craft near Glenpool Ok multiple times
11/9/19 19:02,Lawton,OK,Light,24 seconds,1 flickering light hovered above sky lights for and 10 seconds before dropping vertically to just above ground level. Hovering there fo
11/8/19 21:00,Tulsa,OK,Light,all night long,Multi-color rotating star object
11/2/19 13:36,Oklahoma City,OK,Flash,1 minute,Looked like a meteor appeared out of no where
11/1/19 00:30,Fort Gibson,OK,Sphere,20 minutes,I have seen this shpere shaped craft 3 non consecutive nights this week. It is multi colored and pulsating. Hovers in a general area an
10/27/19 22:00,Tulsa,OK,Circle,30 minutes,"((NUFORC Note: ""Starlink"" satellites? PD))"
10/26/19 05:55,Broke.n arrow,OK,Other,Walking to car,Look like a helicopter with a little flashing lights headed west then turned South and just look like a cloak went over it and moved aw
10/12/19 23:15,Tulsa,OK,Chevron,20 sec,Slow moving boomerang object
10/12/19 10:00,Bristow,OK,Circle,1 hr so far,Something is hovering over Bristow Oklahoma!
10/8/19 02:30,Oklahoma,OK,Sphere,,Flashing circles in the sky. They get closer when noticed
9/29/19 19:30,Alva,OK,Circle,1 minute,While driving home from Colorado my wife son and I saw two round circular lights fly North while driving East for about 15 seconds t
9/14/19 20:00,Chandler,OK,Other,20 minutes,There were two sets that with the naked eye appeared round. They were above us in Chandler Oklahoma for about 10 and 20 minutes. Throu
8/20/19 20:56,Bartlesville,OK,Triangle,0:54,Bright Light flashing bouncing down up side to side hoovering triangle with lights at each point of triangle
8/19/19 16:35,Tonkawa,OK,Cylinder,<1 minute,Cylindrical object moving against the wind no visible control surfaces
8/14/19 15:49,Oklahoma City,OK,Sphere,00:02,I was on S. Miller Ave. and S.W.61st St. walking north .The UFO heading West towa..rd Will Rodgers World Airport. I heard a helicopter
8/12/19 21:29,El Reno,OK,Unknown,5-10 minutes,AC broken in home and cooler in backyard on lounge chair. Viewing Saturn very bright and Jupiter at 180° and 200° at 50° and 30° res
8/11/19 17:10,Perkins,OK,Fireball,3 seconds,Headed towards the ground at a slight angle really fast. Had a trail/tail behind it. Went down till I couldnt see if from trees blockin
8/10/19 23:00,Oklahoma City,OK,Other,Continues,Multiple ongoing encounters with triangular objects that have un-fathomable speed.
8/10/19 01:30,Lawton,OK,Light,30 seconds,Around 1:30 a.m. I was outside star gazing and just happen to see a sphere shaped light fly across the sky and disappear into thin air.
8/9/19 17:20,Tulsa,OK,Triangle,45 seconds,Triangular object at high altitude SW of Tulsa in evening sun. Made quick 90* turns. stopped then accelerated out of sight to west
8/4/19 09:57,Yukon,OK,Cigar,1 minute,Two glowing orange objects seen speeding across the sky with flames coming out of them.
7/31/19 22:25,Oologah,OK,Other,7 minutes,Diamond shape with swinging projection underneath flashing lights and sporadic movement
7/27/19 23:55,Stigler,OK,Cigar,5 minutes,There's was 4 cigar shaped objects flying crazy like this at first stayed in one spot above us until we hollered then they took off....
7/21/19 19:55,Jenks,OK,Rectangle,26 seconds,Rectangle shaped air craft that appeared to change lengths
7/17/19 21:27,Apache,OK,Light,5 minutes,Thought it may have been a satellite but idk had no flashing lights just looked like 1 or possibly 2 bright lights but it could have
7/17/19 09:30,Eufaula,OK,Circle,1 minute,One white circle traveling incredibly fast above Eufaula Oklahoma.
7/10/19 19:46,Newcastle,OK,Unknown,work,Markings on the grass ame patteren.
6/30/19 22:00,Noble,OK,Other,20 seconds,Saw stingray shaped object in the sky.
6/24/19 18:45,Alva,OK,Fireball,1 second,((NUFORC Note: Witness provides virtually no information. Hoax?? Source elects to remain anonymous. PD))
6/17/19 09:46,Asher,OK,Circle,1 hour,Multiple UFOs Around The Moon Looking Through Telescope
6/13/19 21:10,Tulsa,OK,Light,approximately 1-2 minutes,At least three lights in the sky and vanish.
6/12/19 13:15,Tulsa,OK,Unknown,10 seconds,Flat white cylindrical disc shape moving N through cloud cover over N Tulsa. Observed from E Tulsa.
6/12/19 11:30,Lawton,OK,Oval,30 seconds,Bright shiny craft seen over Oklahoma mountains.
6/1/19 23:30,Tahlequah,OK,Light,5 minutes,Saw a circular object flashing ligh watched it for about a minute go up and al of a sudden shot straight down. ((anonymous source))
5/15/19 23:00,Perry,OK,Circle,30 minutes,Saw very bright light fading in and out would blink about 3 times first in E sky then in N sky. ((anonymous report))
5/12/19 17:00,Shawnee,OK,Unknown,10 minutes,Object appears in the middle of the day and moves southeast at various speeds
4/19/19 17:35,Oklahoma City,OK,Oval,30 seconds,"Black oval object in sky flashing blue lights that ""winked-out"" followed by a circling jet and then three helicopters."
2/26/19 19:05,Elgin,OK,Disk,<40 seconds,Driving on the highway right before Elgin exit going towards OKC. On the right the sky lit up with a bright yellow/orange.
2/26/19 01:19,Seminole,OK,Light,2 minutes,I'm here to be descriptive as possible. Last night around 01:19 there was a very loud humming outside my window i got curious and deci
2/19/19 06:45,Bixby,OK,Rectangle,1-2 minutes,Triangular lights in sky over Bixby OK.
2/19/19 02:27,Yukon,OK,Fireball,1.5 minutes,Color changing fireballs that rose into the sky and flew away.
2/8/19 01:00,Muskogee,OK,Unknown,Neighborhood,((HOAX??)) We seen about 2 men with black hats come up the street going house to house.
2/7/19 21:00,Hugo,OK,Rectangle,15 minutes,A square object with lots of windows/openings VERY close to my vehicle with a BRIGHT pure white blinking light.
2/6/19 21:30,Guthrie,OK,Other,5 seconds,Multiple small white and yellow lights hovering low outside of window.
1/26/19 02:03,Tulsa,OK,Unknown,1 minute,I was laying in bed trying to go to sleep and felt something slightly shaking my room and a very loud noise buzzing. I looked out my wi
1/23/19 16:00,Oklahoma City,OK,Changing,30 minutes,Flying object seen over Oklahoma City.
1/20/19 13:10,Springer,OK,Rectangle,7 minutes,A brilliant pure white silent object moving across the sky at a hight rate of speed also had no markings exhaust or light.
1/19/19 21:00,Oklahoma City,OK,Triangle,45 minutes,A large Photographed Triangular UFO over Oklahoma City.
1/14/19 23:40,Glenpool,OK,Unknown,1 minute,Something was outside my home that was not human or animal. ((anonymous report))
12/17/18 15:00,Tulsa,OK,Unknown,Hovering over the side ro,Driving along hwy 412 you in the sky it had 4 lights one on each side. It just hovered with each light blinking one after another. It w
12/16/18 17:15,Sugden,OK,Circle,5 minutes,Large circular bright light.
12/9/18 04:00,Miami,OK,Disk,20 minutes,I was asleep in bed then awoke from a loud noise. It sounded like a road crew was in my backyard tearing up asphalt or concrete. I was
12/3/18 22:30,Shawnee,OK,Triangle,1-2 minutes,A black triangle shaped craft with lights on each corner in backyard next door flys away above above tree line
11/30/18 05:56,Adamson,OK,Changing,Month,Ball and disc shaped UFO orbs and objects
11/29/18 22:00,Yukon,OK,Circle,1 minutes,A round orange object moved north to south. It was at a low altitude and moved in a straight line. ((anonymous report))
11/27/18 05:05,Eufaula,OK,Light,15 minutes,Looking over the house toward the south I saw a very bright light as light as a night light. ((NUFORC Note: Possibly Venus? PD))
11/19/18 16:45,Oklahoma City,OK,Other,1.5 minutes,Object headed N and quickly made a correction into the S direction unlike any plane I have ever witnessed. ((anonymous report))
11/19/18 12:30,Oolagah,OK,Circle,20 seconds,My eyes caught 4 white spheres moving towards the south just east of Oolagah Oklahoma.
11/2/18 19:20,Owasso,OK,Light,10 seconds,Solid green point light moving extremely fast horizontally northbound in sky. 3 bright flashes of light and sparks that lit up the sky
9/18/18 20:05,Lawton,OK,Triangle,10 minutes,Triangle shaped bright white light moving slowly over Mount Scott. Disappeared after approx 12 min.
9/15/18 22:15,Tulsa,OK,Circle,3-4 minutes,Midtown Tulsa Oklahoma:witnessed one bright ball of light high in the night sky. Looked up to notice the beauty of the moon lit clouds
9/2/18 06:47,Muskogee,OK,Triangle,30-45 seconds,Triangular non-flashing lights
8/12/18 04:50,Tulsa,OK,Changing,30 seconds,Unusual colored object changing to white rapidly diminishing in size tapering brightness.
8/11/18 04:49,Tulsa,OK,Other,5 seconds,Appeared as a very large whistling meteor turned almost 90° and then appeared and sounded as very fast moving aircraft over Oklahoma.
8/1/18 20:00,Skiatook,OK,Disk,45 minutes,Looking southeast toward city of Owasso I saw a a saucer with a wider white base with an orange dome top. Object held still about 10 m
7/13/18 23:30,Pawhuska,OK,Oval,30 seconds,2 aircraft side by side 1 was orange orb shape other was cargo jet flying low and slow.
7/13/18 21:45,Arcadia,OK,Rectangle,5 minutes,Large rectangular slow moving craft over farm
7/11/18 23:55,Owasso,OK,Formation,20 seconds,Two oddly lit craft one following the other disappear from view on a clear cloudless night.
7/7/18 21:50,Tulsa,OK,Sphere,3 minutes,Spherical red light moving through the night sky. It came from the north and moved south. Lost sight of it after 3 minutes. The light w
