date_time,city,state,shape,duration,summary
7/6/12 22:01,Yukon,OK,Fireball,2 minutes,Red fireball Oklahoma canadian low flying
7/4/12 22:35,Oklahoma City,OK,Fireball,1-2 minutes,We saw a low-flying brilliant orange object flying silently and steadily from SSE to NNW and are sure it wasn't a traditional craft.
7/4/12 22:30,Moore,OK,Circle,approx. 2 minutes,2 Red Balls Flying North from South. Objects Flying Parallel 1000 feet apart at kite level. Silent. Disappeared
7/4/12 22:30,Enid,OK,Circle,15-20 minutes,Large circular red object flying very slowly at high altitude overhead travelling SSW to NNE.
7/4/12 22:00,Broken Arrow,OK,Fireball,2 minutes,Seven people saw 4 orange fireballs flying very fast in formation. There was very little wind and no noise!
7/4/12 22:00,Tulsa,OK,Fireball,2-3 minutes,Red Orb in Broken Arrow OK Flew Over
7/4/12 22:00,Sand Springs,OK,Fireball,1 hour,20+ huge red fireballs flying south to north near SandSpringsOklahoma
7/4/12 21:45,Choctaw,OK,Light,2 minutes,Bright red light with no sound that move across the west sky.
7/4/12 21:45,Tulsa,OK,Sphere,4 minutes,UFO mimicking fireworks
7/4/12 21:30,Muskogee,OK,Circle,1.5 hours,2 dozen red orbs in 2's and a group of 5 with multiple origination points and directions of travel
7/4/12 21:00,Broken Arrow,OK,Fireball,15 minutes,All gave the appearance of being on fire giving off a bright orange light the also appeared to be under power and being under control
7/4/12 21:00,Checotah,OK,Oval,2 hours,Red glowing objects seen over Checotah ok on the 4th of July 2012!
7/4/12 20:40,Durant,OK,Sphere,every few minutes for alm,Videotaped 20+ silent orange orbs traveling solo & in groups; not airplanes or fireworks
7/3/12 23:00,Ardmore,OK,Fireball,5 minutes,Bright orange orb Ardmore Oklahoma. 7-3-2012
6/30/12 13:50,Ada,OK,Disk,2 - 3 minutes,White disk shaped object above Ada OK.
6/27/12 23:42,Tulsa,OK,Formation,6 minutes,Flashing lights in formation moving west to east over a 6 minute period in Tulsa OK
6/26/12 20:30,Moore,OK,Fireball,1minute,fireball object in plain view CREAPY CIRCUMSTANCE..
6/19/12 23:45,Kiefer,OK,Fireball,3-5 seconds,No other bright stars in the southern sky and lower then regular stars..clear night outside 4-5 nights a week…
6/17/12 10:05,Moore,OK,Circle,30 seconds,Bright red orb in sky that illuminated through windows of house.
6/16/12 23:00,Muse,OK,Light,1:35,Strobe light in the southern sky!
6/12/12 15:30,Tulsa,OK,Formation,seconds,Light formation.
6/5/12 23:00,Alva,OK,Fireball,5 seconds,Bright blue ball of light over alva ok.
6/1/12 20:00,Tulsa,OK,Circle,20 seconds,Saw a glowing orange light traveling at constant speed and altitude no nav lights no sound.
5/23/12 21:30,Bristow,OK,Sphere,2 hours,Illuminated spheres moving through the sky at consistent speeds moving in all directions. ((NUFORC Note: Possible satellites? PD))
5/23/12 03:30,Oklahoma city,OK,Rectangle,5 minutes,Rectangle transparent object sitting above HW I-35 stationary red & green lights on corners no sound
5/20/12 23:30,Moore,OK,Circle,10 minutes,Yellow-Orange circular sightingwith ascending lights hovering above Moore OK
5/19/12 21:00,Tulsa,OK,Circle,5 minutes,Four Round bright orange low and slow objects over Tulsa
5/15/12 08:30,Tulsa,OK,Circle,South,When I was at a Sonic's in Tulsa Ok. out of no where I've seen a Blue Blue Green and Withe UFO over Pine and Peoria. Then like about
5/12/12 22:50,Broken Arrow,OK,Circle,2 minutes,2 bright orange/red orbs traveling together seperate then fades out
5/12/12 22:40,Edmond (northeast of),OK,Light,4 minutes,Red and Green lights
5/12/12 22:00,Edmond,OK,Oval,15 minutes,Red and Green Lights over Edmond Ok.
4/24/12 16:45,Ada,OK,Cigar,1 to 3 min.,Cigar shaped almost aluminum in color hazy around it no sound
4/15/12 14:15,Shawnee,OK,Rectangle,5 seconds,Large low-flying craft south of Shawnee OK.
4/2/12 20:50,Okarche,OK,Unknown,12 min,Red and Blue Lights East of Okarche OK
4/1/12 20:15,Holdenville,OK,Unknown,20 second,Green lights over oklahoma
3/31/12 00:00,Atoka,OK,Triangle,30 minutes,Delta shaped lights hovering over areas of Bigfoot activity.
3/26/12 20:00,Seminole,OK,Other,25 minutes,Saw 7 separate star like objects travel North to South & South to North within a 30 minute period
3/24/12 23:27,Mustang,OK,Light,15 to 20 seconds,Ball of bright white light spotted near S.W. 59th. and Czech Hall Rd.
3/12/12 21:30,Lawton,OK,Teardrop,2 minutes,Two objects Teardrop shape slight red to orange glow in front and less of a glow in the rear. Traveling South to North side by side
2/25/12 20:14,Pocola,OK,Light,2 Hours,Stationary light in the sky. ((NUFORC Note: Sighting of Jupiter and/or Venus we suspect. PD))
2/24/12 13:15,Oklahoma City,OK,Circle,1 min,Huge circular craft high in the sky.
2/12/12 21:00,Eufaula,OK,Oval,8 sec,Faint oval shape with moving lights at bottom....but very large 1/2 mile long oval shaped
2/5/12 04:00,Wewoka,OK,Triangle,5 min,Officer sees bright light/ blue light over local park
1/29/12 23:30,Norman,OK,Unknown,5-10 seconds,An oval light appeared over the moon shined a beam of light over Lake Thunderbird and then streaked off.
1/28/12 21:00,Norman,OK,Circle,15 minutes,Sightings of red orbs in Norman
1/16/12 02:00,Wildlife Refuge Medicine Park Ft. Sill,OK,Oval,,Ufo above a Military Jumbo plane!
1/14/12 21:00,Fort Cobb,OK,Cigar,25 mins.,Vertical strip of lights over Fort Cobb Lake
1/14/12 18:30,Medicine Park,OK,Circle,,Multi colored object in the sky by Medicine Park Oklahoma after sunset !
1/8/12,Muskogee,OK,Unknown,30 min,3 Dead Batteries
1/6/12 17:00,Seminole,OK,Circle,3 minutes 20 seconds,Silver ball shaped object near jet moved in opposite direction of jet blinked like a star heavy jet traffic
1/3/12 17:50,Nowata,OK,Light,four min,Blueish white ball seen by me .
12/20/11 21:10,Moore,OK,Light,15 min,Lights in the sky SE of Moore - hovering and moving around.
12/19/11 21:45,Clinton-Sherman Airpark,OK,Light,20 min,Very big very bright rose red light moving north over Clinton-Sherman
11/28/11 03:20,Tyrone,OK,Light,I watched for 15/20 minut,It was then that I saw the brightest yellow star emitting lights around it.
11/24/11 05:55,Broken Arrow,OK,Unknown,45 min,White light becomes two and changes colors
11/17/11 18:45,Pink,OK,Triangle,3 minutes,Triangular shaped. 2 white lights & 1 red light. Low & slow flying silent.
11/16/11 19:00,Norman,OK,Light,<5 seconds,Small faintly triangular light seen over east Norman OK
11/8/11 20:00,Newalla,OK,Triangle,9 sec,Triangle shaped no sound no light
11/7/11,Yukon,OK,Disk,2 min,ufo seen in night sky with movment like nothing man made
11/1/11 20:30,Nomran,OK,Fireball,1-2 minutes,Sighting over Norman of two reddish spheres.
10/28/11 21:30,Tulsa,OK,Circle,6 to 8 Minutes,My 2 Sons and myself were driving home around 8:30 P.M. We were about 3 blocks from our house. We were heading North on Rockford ave
10/21/11 12:00,Ardmore,OK,Oval,8 minutes,two machines one silver and one red/oranges oval ufo there no clouds like the sky opened and they went in.
10/13/11 01:36,Norman,OK,Oval,2 min,Yellowish center middle orange with a outter red glow sphere
10/6/11 01:00,Stillwater,OK,Disk,7 mins,((HOAX??)) I came from the Northwest and flew over our building.
10/5/11 06:00,Enid,OK,Circle,30 seconds,Object tracked from north to south high in sky became bright stopped in mid flight and disappeared.
10/2/11 01:50,Owasso,OK,Light,,On Oct 2 2011 between 1:50am-2:05am 7 to 9 fighter planes flew over my house. A few hitting there boosters making a loud sound shaking
9/29/11 23:45,Shawnee,OK,Chevron,15 seconds,i was laying outside in the driveway looking at the stars and noticed what appeared to be the upper air pushing and was able to see a d
9/23/11 09:45,Oklahoma City,OK,Light,5-10 minutes,A series of red lights moving south to north.
9/15/11 02:20,Konawa,OK,Disk,20 min,Object over konawa
9/13/11 10:45,Springer,OK,Light,,It was bright aqua blue almost turqouis.
9/9/11 13:00,Tulsa,OK,Oval,two nights,Tulsa Oklahoma UFO sighting
9/8/11 20:00,Tulsa,OK,Light,2 min,Bright stationary light in western sky at sunset.
8/31/11 00:00,Ardmore,OK,Triangle,2 minutes,Triangular craft with three red lights hovering and then circling areas in Ardmore Oklahoma.
8/24/11 05:50,Geronimo,OK,Light,1 Hour,At 0550 on 23 August 2011 I observed a light in the ESE sky approximatly 25 degrees above the horizon. At the time the moon was in a
8/22/11 21:00,Hugo,OK,Fireball,5 min,orange lights over Hugo Oklahoma
8/18/11 05:30,Slaughterville,OK,Triangle,10 minutes,TRIANGLE UFO AS BIG AS A FOOTBALL STADIUM.
8/15/11 02:00,Oklahoma City,OK,Flash,2 - 4 seconds,Street lamp appearance orange flashing extremely fast silent...phone lost signal.
8/8/11 20:00,Tulsa,OK,,,Unidentified object in photo of storm clouds.
8/1/11 00:00,Bokchito,OK,Light,3-4 minutes,Bright orange/blue light moving really fast then disapearing.
7/27/11 11:45,Edmond,OK,Light,5-6 seconds,Stars foating off and shooting away
7/27/11 01:00,Watts,OK,Changing,15 minutes,Big light in the middle of town that changed shape and color
7/20/11 21:00,Talihina,OK,Light,3 hours,Strobing Ball of light and craft. ((NUFORC Note: Possible hoax?? PD))
7/19/11 22:30,Sapulpa,OK,Fireball,3 minutes,Three UFO's Witnessed by four people.
7/10/11 22:45,Durant,OK,Fireball,5:00,Wife son and I observed two fireball objects and one silver object over Okla.
7/9/11 10:35,Owasso,OK,Triangle,3-4 minutes,Triangular shaped UFO passes over my house in broad daylight.
7/3/11 22:00,Broken Arrow,OK,Cylinder,3 minutes,Large object with orange/red light.
7/2/11 23:00,Cleora,OK,Cylinder,5 minutes,3 bright orange UFO's with revolving red lights spotted a Grand Lake in Oklahoma.
7/2/11 21:00,Oologah,OK,Light,3 minutes,Bright Orange Light or orb
6/25/11 00:00,Oklahoma City,OK,Circle,10 minutes,((HOAX??)) I saw a circular object spinning in the stars. ((NUFORC Note: We are uncertain whether the report is a serious one. PD))
6/23/11 22:55,Moore,OK,Light,13 min,Bright Blue lights over Moore Oklahoma.
6/16/11 05:55,Muskogee,OK,Light,3 min at least,Bright light in the morning sky
6/5/11 22:56,Lawton,OK,Sphere,~ 1 min. 30 sec.,Luminous flying sphere observed near Lake Quanah Parker Wichita Mountains Wildlife Refuge Lawton OK
6/3/11 12:00,Kenefic,OK,Other,2 minutes,This was not manufactured on earth but whoever built it looks like they are using very similar aircraft technology.
5/13/11 10:30,Norman,OK,Formation,5 seconds,3 white lights in formation spotted over oklahoma city
5/3/11 05:20,Tulsa,OK,Light,2 seconds,Fast moving low flying bright object makes path across south Tulsa neighborhood
4/16/11,Norman,OK,Triangle,15-20 minutes,Slow Moving Triangular shape craft no sound tree top level
3/23/11 21:20,Shawnee,OK,Disk,4 seconds,A large fast bright saucer was flying west in Oklahoma.
3/17/11 20:25,Lawton,OK,Light,5-10 seconds,St. Patrick's Day U.F.O. sighting in Lawton OK
3/15/11 03:07,Jenks,OK,Light,2 minutes,Two lights changing from column to right echelon formation traveling appx. due north with no commercial flights listed in the area.
3/4/11 20:15,Alaska??,OK,Flash,seconds,Episode 8 of Flying Wild Alaska. As the red Cessna rose above the hillside the blue sky was in the background. A horizontal streak/fla
3/4/11 02:00,Seminole,OK,Oval,15 min,bright orange ball of light moving in figure 8 patterns.....
2/12/11 06:00,Calumet,OK,Egg,1 hr,Egg shaped Orb west of Okc
2/8/11 01:00,Tulsa,OK,Triangle,1hr. 30 minutes,Triangle shaped craft with lights on the corners and 1 big one in the middle.
1/6/11 15:00,Broken Arrow,OK,Cylinder,Floating in the sky,Cylinder floating in the sky.
1/5/11 03:25,Guymon,OK,Circle,3 MINS,green and red lights in a shape of a circle close to the ground
1/4/11 00:30,Sand Springs (west of),OK,Circle,45 seconds,Orange glowing round object seen in the sky just 2 miles of Lake Keystone Sand Springs Oklahoma
1/3/11 01:00,Checotah,OK,Diamond,0100=0600,was at lake eufala oklahoma on 01032011 with a friend setting around bomb fire listoning to music relaxing we went to turn off truck an
12/24/10 18:00,Morris-Okmulgee,OK,Fireball,10-15sec,orange-red fireball falling from sky in Morris (Okmulgee Co.) OK
12/10/10 12:00,Tulsa,OK,Cigar,5-10 sec.,Moved very slowly looked like a cigar w/ rounde ends and a fin at back.
11/27/10 19:25,Tuttle,OK,Teardrop,5 seconds,Teardrop shaped object in the night-sky...
11/20/10 21:00,Oklahoma City,OK,Light,10-12 sec.,It was motionless then moved forward very fast did a loop-the-loop then flew away at about a 15' degree angle
11/9/10 21:19,Hugo,OK,Rectangle,30 secs,Very bright mirror like skewed rectangle shaped object over southeastern Oklahoma.
11/3/10 18:00,Muskogee,OK,Cylinder,,cylinder shape
10/30/10 23:50,Broken Arrow,OK,Changing,30s,Seven unexplained lights over Broken Arrow OK...2 witnes Army Vet.
10/30/10 22:23,Tuttle,OK,Diamond,35 mins,cloaked UFO at high school track.
10/30/10 22:23,Tuttle,OK,Triangle,20 minutes,Three yellow-orange lights flying over-head numerous times.
10/30/10 21:45,Moore,OK,Oval,3 Mins,Bright Yellow/Orange light that seemed to come out of nowhere. A second object appeared hovering got bright and both dissppeared.
10/18/10 02:45,Helena,OK,Triangle,3 seconds,Suspicious Object In The Sky
9/14/10 21:25,Tulsa,OK,Unknown,4 seconds,Star drops out of sky straight down.
8/28/10 22:20,Mannford,OK,Unknown,5 Minutes,Reddish-orange orbs hovering them disappearing in the night sky
8/24/10 21:45,Woodward,OK,Light,60s,A supersonic plane?
8/16/10 23:59,Broken Arrow,OK,Light,,Large bright light moving zig zagging in the sky above the tree line. ((NUFORC Note: Jupiter?? PD))
8/9/10 23:15,Oklahoma City,OK,Circle,55 seconds,Circular bright orange object flying north in the sky that fell apart and disappeared.
8/5/10 03:15,Broken Arrow,OK,Light,5 minutes,Bright white light becomes two bright lights over Broken Arrow Oklahoma
8/5/10 00:00,Walters,OK,Other,approx. 30 seconds,Bright yellow flowy UFO sighted in Walters Oklahoma by working mother.
7/25/10 20:30,Oklahoma city,OK,Cylinder,15 Min,Inverted craft 40+ft long over North Oklahoma City hovering moving and changing directions
7/25/10 11:00,Oklahoma City,OK,Rectangle,7 minutes,Upside-down landing carrier about 40-50 feet in length.
7/24/10 00:00,Oklahoma City,OK,Circle,3 hours,Circular craft blinking red yellow orange green blue. ((NUFORC Note: Possible twinkling star or celestial body perhaps? PD))
7/18/10 02:30,Oklahoma City,OK,Unknown,9 seconds,Bright bluish light. that vanished
7/4/10 23:15,Broken Arrow,OK,Fireball,3 min,possible ufo sighting
7/4/10 21:00,Durant,OK,Fireball,West,We saw 2 orange fireball ufos traveling west on July 4th 2010
7/4/10 20:15,Claremore,OK,Other,10 secs,Looked like a transparent Squid with paluseing lights.
7/3/10 22:12,Poteau,OK,Sphere,2-3 minutes,Four orange spherical glowing lights moving slowly in formation at tree top level at 10 pm over Poteau OK.
7/3/10 20:45,Poteau,OK,Light,5 minutes or longer,White Light Glimmering Correction*
6/30/10 09:45,Poteau,OK,Other,2 minutes,Shadow in the Atmosphere
6/4/10 04:05,Muskokee,OK,Light,1 Hour,"6-4-10 LIGHTS ""PLAYING"" IN SKY SOUTH OF MUSKOKEE OK"
5/15/10 01:20,Broken Arrow,OK,Light,3-5 minutes,Two orange lights moving across the sky in formation and then each one dimmed and disappeared.
4/28/10 21:30,Durant,OK,Unknown,1 min 30sec,Super bright light on bottom of craft moving very fast with no sound at all
4/7/10 23:13,Tulsa,OK,Light,8-10 seconds,I saw the object at approx. 60 degrees to the east-northeast. Thought it was a shooting star and pointed it out to my husband. As we w
4/7/10 22:13,Tulsa,OK,Light,8 to 10 seconds,This is the best I can do. If straight above my head in relation to the surface of the earth is 90 degrees it was east-northeast at ap
3/25/10 23:00,Edmond,OK,Unknown,10:55 - 11:05 PM,Two UFO's appear within ten minutes of each other.
3/25/10 18:00,Colcord,OK,Changing,2 minutes,strange lights in Oklahoma sky outside Siloam Springs Arkansas March 25 2010
3/23/10 23:00,Tulsa,OK,Light,15 minutes,Two different colored lights stationary & above the clouds.
12/12/09 04:00,Oklahoma City,OK,Other,60 sec,Craft with lights but no sound
12/5/09 16:00,Hugo (southeast OK),OK,Unknown,10 seconds,((Report retracted.)) Dark human-like figure that was glowing orange around it and floating.
11/28/09 02:15,Noble (15 miles east of),OK,Oval,1 TO 2 SECONDS,VERY BRIGHT ROUND OBJECT. FLYING VERY FAST. SOUTH TO NORTH. TREE TOP LEVEL.
11/21/09 00:00,Tulsa,OK,Circle,40min and still there,a light in the sky that flashes.
11/8/09 06:55,Tulsa,OK,Circle,4 SECONDS,Round blue and fast
11/3/09 18:50,Oklahoma City,OK,Other,About seven minutes,Possible booster streams in a state with launch sites I've been able to find.
11/3/09,Owasso,OK,Triangle,1 minute,Triangular shaped aircraft hovering over apartment complex in Owasso OK on 04/01/2020
10/24/09 03:00,Tulsa,OK,Circle,1 hour,3:30am Tulsa sky has 4 objects flashing blue lights
10/24/09 00:15,Midwest City/Del City,OK,Other,5 min,My nephew and I were at the fire on our patio when he asked of birds flew at night. We saw what looked like a bright white bird flying
10/16/09 05:19,Tulsa,OK,Light,45-50 seconds,Two bright motionless lights in Tulsa's northern sky.
10/10/09 12:42,Tulsa,OK,Unknown,6 seconds,In't see nothing in the park
10/1/09 15:38,Whitefield,OK,Light,seconds,Looked like a light that appeared to be moving upwards.
9/4/09 11:15,Maysville,OK,Light,20 seconds,unidentified white light object with two windows in it appeared to be burning or crashing towards earth
8/26/09 20:50,Lawton,OK,Light,10 minutes,It would move slowly and sometimes quick in a circular pattern.
8/16/09 22:30,Oklahoma City,OK,Light,10 MIN,Me and my children where coming home as we drove up in the drive way we seen a lights going real slow in the sky and it was going so sl
8/11/09 00:30,Ardmore,OK,Oval,5 seconds,Polished oval shaped craft with green illumination moving in a controlled manner
7/26/09 21:15,Tulsa,OK,Light,5 seconds,07/26/09 Tulsa OK Light bright light flashing on and off moving rapidly across sky
7/25/09 21:40,Muskogee,OK,Sphere,2:00 min,a single ball of light. ((NUFORC Note: ISS. PD))
7/23/09 15:00,,OK,Other,,Strange long light figure in front of storm
7/16/09 21:00,Enid,OK,Light,5 min,Extremely low flying light.
7/15/09 05:00,Cleveland,OK,Sphere,2 hours,the sphere that was chased by a fighter jet in the morning sky
7/12/09 04:00,Tulsa,OK,Fireball,30,UFO sighting in the eastern night sky over very populated area.
7/8/09 23:30,Edmond,OK,Light,10-15 seconds,Two lights traveling extremely fast starting northeast of Edmond.
7/7/09 22:45,Owasso,OK,Sphere,10 mins,Amber glowing Sphere flys over Owasso Oklahoma
7/2/09 18:30,Ponca City,OK,Other,3 minutes,Ponca City Ok about 18;30 hrs long shaped object with no sound
6/22/09 03:00,Oklahoma City,OK,Unknown,3 hours,Pulsating colored lights southern sky Oklahoma City. June 22 2009
6/19/09 15:00,Sand Springs,OK,Cigar,2 MINUTES,A cigar shaped object with 5 lights running left to right.The outer light were pulsing.Sounds similar to another sighting over Shell la
6/12/09 22:50,Tulsa,OK,,10 seconds,Star gets brighter then fades completely out. ((NUFORC Note: Flare from Iridium satellite? PD))
5/30/09 21:40,Norman,OK,Circle,Roughly 10 minutes,Orange and Red light above Norman Oklahoma.
5/15/09 22:00,Shawnee,OK,Light,15 sec,Orange light moving accross sky that turned bright white and vanished in Shawnee OK 5/15/2009
5/15/09 04:45,Lehigh,OK,Light,2-3 Minutes,Extremely fast moving non-flashing non-airline non-meteoric non-star Light
5/14/09 22:02,Tulsa,OK,Cigar,10 seconds max,"Large very bright bluish white ""strip"" of light seen on bottom of a large craft"
4/21/09 04:30,Shawnee,OK,Circle,roughly 20 seconds,This was the morning of april 21st the ufo was circular and emitted a beam of light from the underbelly.
4/15/09 01:00,Tulsa,OK,Triangle,10-15 seconds,UFO Sighting in Tulsa OK
4/8/09 14:50,Oklahoma City,OK,,20 minutes,Group of round silver objects traveling across sky and reversing direction .
3/24/09 21:40,Sand Springs,OK,Other,5 minutes,Line of 5 lights blinking in a pattern over Shell Lake 30 minutes outside of Tulsa.
3/16/09 01:00,Oklahoma City,OK,Light,2 to 3 sec,Unknow fast moving light
2/21/09 20:19,Cushing,OK,Other,4-7 seconds,what appears to be bright planet disappears in the Northern sky over N Central OK 02/21/09
2/11/09 21:00,Mountain View,OK,Light,1 hour,A bright light which seems to be stationary and changes colors before lowering and diminishing from sky. ((NUFORC Note: Venus?? PD))
2/3/09 19:00,Watson,OK,Light,3 min,Round bright flying object moving in a NE to SW direction then does a star trek exit from sight straight up.
1/26/09 16:00,Owasso,OK,Triangle,10minutes,The u.f.o. was a triangle and it had lights!!!!!
12/24/08 17:45,Oklahoma City,OK,Light,10-15 sec.,I saw a light in the sky then another light eminated from it and fell to the earth when it reached earth the object in sky went out.
12/22/08 03:43,Oklahoma City,OK,Oval,4 minutes,Large oval or triangular metallic object hovering in OKC
11/27/08 10:30,Ardmore,OK,Light,5 to 10 min.,Family sees strange light moving across night sky that flickers dims and brightens.
11/22/08 00:00,Broken Arrow,OK,Changing,0,regarding this post: http://nuforc.org/webreports/063/S63866.html I am the one who posted the adjacent post from Tulsa listed here: htt
11/4/08 19:30,Duncan,OK,Light,15 seconds,Brilliant red light slowly descends from high in the sky and disappears behind buildings.
10/26/08 01:45,Lawton,OK,Unknown,10 sec. each,Two sightings - 4 UFO's - 10 minutes apart - It was amazing!!!
10/20/08 23:12,Lawton,OK,Triangle,4 seconds,Large triangular object flying over military base.
10/15/08 20:42,Norman,OK,Unknown,About 2-3 minutes,"I saw a light blue UFO with a low sound emitted that seemed to abduct a dog and then vanish.

500 Lights On Object0: Yes"
10/8/08 19:30,Tulsa,OK,Light,60 seconds,Round white light/object moving through sky and suddenly disappearing
10/7/08 22:00,Claremore,OK,Light,Five seconds,Bright greenish white streak in silent sky looked very close.
10/5/08 00:00,Toppsey,OK,Cone,5 hr,((HOAX??)) CONE SHAPED.
9/29/08 20:30,Healdton,OK,Light,15-25 seconds,While out on an evening walk I witnessed a light that suddenly flew off.
9/29/08 19:45,Okmulgee,OK,Light,about 1 min.,bright light seen in the north going from west to east
9/24/08 21:33,Duncan,OK,Other,30 Minutes,Numourous Objects In Night Sky For About 45 minutes. ((NUFORC Note: We suspect satellites and stars. PD))
9/18/08 08:30,Tulsa,OK,Cone,2 minutes,Two syncrinized space crafts moving in and out of existance through Tulsa Sky's.
9/18/08 05:30,Tulsa,OK,Cone,3 mins,AWESOME SIGHT.... couldn't believe our eyes.
9/16/08 01:35,Tulsa,OK,Formation,10 minutes,Line formation of Lights in TulsaOk.
9/14/08 06:40,Walters,OK,Circle,7 minutes,bright white circle light from west to south east completely silent no flashing lights at all for around 7minutes
9/1/08 11:00,Yukon,OK,Triangle,20 minutes,I have lived in yukon all my life. I was 17 when this occurred and will take what me and a friend seen to the grave. we sneeked outside
8/17/08 20:01,Oklahoma City,OK,Unknown,4,while waiting for pizza object spotted in sky lasted about 6 min.
8/7/08 21:40,Choctaw County (southeastern OK),OK,Light,30 seconds,Bright glowing white light moving slowly above us with no blinking lights. ((NUFORC Note: ISS? PD))
8/2/08 11:45,Tulsa,OK,Teardrop,10 seconds,While laying down studying stars with binoculars I saw a ovel-teardrop shaped craft up close with bare eye then with binoculars
8/2/08 11:45,Tulsa,OK,Oval,10 seconds,August 2nd 11:45 pm. I saw a oval -teardrop shaped UFO up close with binoculars.ASTOUNDING! I am still perplexed.....
7/25/08 23:00,Yukon,OK,Triangle,<1 minute,Huge Triangle
7/12/08 09:00,Texhoma,OK,Unknown,10 min,The green light zoomed across the lake leaving a splitting wake that parted the water.
7/5/08 23:00,Leonard,OK,Light,constant,sighting over lake area
7/5/08 21:41,Blue,OK,Sphere,2 minutes,A low small hovering red orb with a white aura around it.
7/5/08 20:15,Checotah,OK,Unknown,1 minute,White-Silver Shining Object in Oklahoma Sky
7/3/08 16:00,El Reno,OK,Diamond,30 SECONDS,White diamond shape' (s) over El Reno Oklahoma
6/22/08 23:00,Kingston,OK,Circle,7 minutes,Twin Balls of Fire traveling south to north
6/13/08 22:20,Tulsa,OK,Light,10 minutes,A white light circling in and out of the side of a thunderstom and planes moving to intercept it.
6/4/08 23:00,Muskogee,OK,Oval,5min.,I was out side doing my yard work and I happen to look up and I saw this object just sitting there about 75 to 100 feet up and the cl
6/3/08 13:55,Moore,OK,Cigar,3 minutes,Wife and I saw cigar shaped object silver shiny for about 1 minute not moving anywhere and then vanish.
5/24/08,Fort Suppy,OK,Disk,3-5 seconds,Fort Supply Oklahoma Twister Video Shows 2 Disk objects during tornado footage
5/14/08 00:45,Ponca City,OK,Circle,20 seconds,Bright round orange object over Ponca City OK. moving due east.
5/11/08 23:00,Tulsa,OK,Fireball,1-2 sec,Mother's Day Night Fireball!
5/11/08 23:00,Claremore,OK,Fireball,5-10 seconds,Large Fireball appears from nowhere in Rogers County Oklahoma. ((NUFORC Note: Possible meteor? Any other witnesses? PD))
5/3/08 23:00,Tulsa,OK,Circle,15 Seconds,Three objects traveling North to South over Tulsa/Jenks OK
4/5/08 16:50,Tecumseh,OK,Unknown,unknown,group of objects over Tecumseh towards North on sunny clear day.
3/25/08 22:42,Owasso,OK,Triangle,45 sec.,large triangle very load
3/8/08 14:50,Tulsa,OK,Changing,1min 10sec,A strange changing shape UFO over Tulsa.
3/1/08 19:30,Ryan,OK,Formation,1 hour,Had just finished campfire dinner a took dog for a walk noticing all the stars as there was not a cloud in the sky. Upon returning to
