date_time,city,state,shape,duration,summary
1/4/15 21:00,Yukon/Oklahoma City,OK,Light,50 minutes,"UFO in Oklahoma City. ((NUFORC Note: Sighting of the star ""Sirius?"" PD))"
12/16/14 09:00,Oklahoma City,OK,Changing,01:00,Shiny small fast moving object in Oklahoma City
12/15/14 03:00,Canadian County,OK,Rectangle,Am,Large craft triangle size with rainbow lights flashing around it hovering over the freeway off nw 10 council. ((anonymous report))
12/7/14 06:55,Hooker,OK,Circle,45 seconds,Large bright orb moved across sky in irregular patterns before vanishing.
12/3/14 05:51,Broken Arrow,OK,Fireball,2 minutes,Orange glow in sky above broken arrow.
11/27/14 05:50,Ponca City,OK,Diamond,20 minutes,Diamond star ufo sighted.
11/25/14 21:00,Adel,OK,Light,15 minutes,Two bright white lights moved at right angles very fast.
11/25/14 15:30,Oklahoma City,OK,Circle,30 seconds,Group of light orbs in sky during the day.
11/20/14 22:00,Tahlequah,OK,Triangle,4 seconds,Triangle craft with lights at corners moving silently.
11/19/14 03:57,Tulsa,OK,Sphere,10 minutes,Silver ball sphere next to sun.
11/18/14 19:37,Sulphur,OK,Other,20 seconds,Upside-down V-shaped lights on top of no noise dark as night i could see through it.
11/15/14 23:45,Wyandotte,OK,Unknown,1 minute,Twin bridges hoving just feet over the rivere right by the highway
11/13/14 21:00,Edmond,OK,Other,1 second,Suddenly a bright rectangular light popped up in the night sky jetted to the left then disappeared.
11/6/14 20:00,Quapaw,OK,Oval,5 minutes,While driving home tonight we saw a super bright white light with blinking blue and reddish lights moving in different directions above
10/31/14 19:15,Oklahoma City,OK,Sphere,3-4 seconds,An usual co-incidence with an amazing bright sphere falling or just moving towards the ground.
10/29/14 18:50,Edmond,OK,Rectangle,1 minute,Black angular UFO shaped object near Old North Tower University of Central Oklahoma Edmond
10/25/14 22:00,McAlester,OK,Triangle,Continuous,Triangle shaped object with front of object red and back of object orange appeared to possibly be orange flames. Silent.
10/24/14 21:00,Tulsa,OK,Formation,2 seconds,Four reddish lights in square formation in NW sky.
10/24/14 20:30,Perkins,OK,Light,30 seconds,Bright star like objects.
10/20/14 14:50,Oklahoma City,OK,Cone,25 minutes,Small stationary shiny metallic object high in atmosphere with 3 orange rotating and revolving lights white cone shaped tail.
10/18/14 20:30,Ada,OK,Fireball,7 minutes,Glowing orange and noiseless object in sky ocer AdaOk
10/14/14 19:15,Oklahoma City,OK,Changing,3 minutes,Orange/Reddish flying object seen in the Oklahoma City area.
10/10/14 21:00,Ardmore,OK,Light,:45,Unknown aircraft that zipped around the sky.
10/7/14 12:00,Oklahoma City,OK,Changing,~4 minutes,UFO over Oklahoma.
10/6/14 22:00,Kingston,OK,Changing,1 hour,At approximately 10:00 pm a spherical orange like began to ascend from the trees. It ascended 55 degrees and then turned into what look
10/2/14 16:45,Oklahoma City,OK,Fireball,15 seconds,Three consecutive fireballs with boom white light at an angle toward the earth the size of road signs at a quarter mile distance. Last
9/29/14 04:06,Norman,OK,Unknown,ongoing,East close horized multicolored flashing light.
9/28/14 01:00,Del City,OK,Triangle,10 seconds,3 whitish orbs emitting great light in the shape of a triangle with a smaller orb in the center spinning about very oddly. The objects
9/27/14 21:33,Tulsa,OK,Light,20 minutes,Glowing round light that flickered and moved slowly NW across the sky.
9/26/14 20:20,Milton,OK,Changing,10,Strange bright orange light in sky.
9/25/14 22:00,Guymon (west of),OK,Circle,90 minutes,We were travelling West out of the panhandle of OK into NM. We were still in OK when we saw a white ball hanging in the sky. The sun
9/24/14 21:00,Midwest City,OK,Triangle,4 minutes,Three lights in the shape of a triangle traveled west to east across the sky. The lights were a redi orange color. Either three craft.
9/16/14 22:00,Ada,OK,Light,3 minutes,TWO BRIGHT STRANGE LIGHTS VISIBLE FROM ADA OKLAHOMA - HOVERING BRIGHT THEN ASCENDING TO THE SKY QUICKLY AND DIMMING OUT AS THEY ASCEND
9/8/14 21:40,Muskogee,OK,Unknown,5 seconds,"What looked like a typical satellite flashed and disappeared. ((NUFORC Note: Probable ""flare"" from ""Iridium"" satellite? PD))"
9/6/14 23:55,Broken Arrow,OK,Triangle,15-20 seconds,Flying objects in bird-like formation
8/31/14 06:10,Glenpool,OK,Formation,5 minutes,Three pulsating lights in the eastern sky far right one spit out a orange/peach colored object that took off east.
8/29/14 20:54,Oklahoma City,OK,Light,6 minutes,Orange lights over Oklahoma City.
8/28/14 19:45,Henryetta,OK,Circle,3 minutes,Saw a bright orb looking star and it exploded.
8/23/14 03:30,Barnsdall,OK,Unknown,30 seconds?,"Observed large black ""stealth-like"" craft pass overhead silently."
8/22/14 07:50,Tulsa,OK,Triangle,Downtown,I just seen a strange craft flying strange in the sky. It was wight and blue light. It showed up righter I just d/l an ufo doctor app o
8/20/14 22:45,Ochelata,OK,Circle,13 seconds,Circle bluish light flashing. Not moving hovering..
8/19/14 02:02,Owasso,OK,Light,20 minutes,UFO over Owasso spotted earlier in downtown tulsa. Have picture!
8/18/14 22:46,Glenpool,OK,Light,15 minutes,Orange-Red lights/circles seen in SW sky near Glenpool
8/18/14 22:00,Cleveland,OK,Circle,4 minutes,UFO.
8/16/14 21:15,Harrah,OK,Unknown,3.5 minutes,Bright light with no sound slowly hovering and floating in the sky then sped off and vanished into the darkness.
8/14/14 21:48,Tulsa,OK,Triangle,5 minutes,At the Guthrie Green tonight when several people including my family saw an unidentified flying object over downtown Tulsa.
8/12/14 19:00,Moore,OK,Triangle,20 minutes,Daylight no clouds flew a short distance stopped still disappeared as i stared at it.
8/8/14 20:00,Tulsa,OK,Circle,5-10 seconds,Bright light above cloud.
8/2/14 22:45,Oklahoma City,OK,Other,1 minute,Very bright white light moving at high speed west to northeast with no flashing colored lights.
8/1/14 21:36,Tulsa,OK,Triangle,3 minutes,Moved at very slow speed but sounded like a very slow jet propulsion.
7/20/14 23:30,Catoosa,OK,Fireball,15 seconds,Large fireball falling slowly stayed bright till I lost sight.
7/15/14 22:30,Tulsa,OK,Triangle,15-20 minutes,At least one craft with very bright lights very low in the sky seen by 2 people in Tulsa.
7/12/14 22:00,Durant,OK,Unknown,10 seconds,Two white lights converge on location seem to be connected by invisible object was elongated for a few short seconds then dissapears
7/10/14 21:40,Tulsa,OK,Fireball,60 seconds,Slow moving fireball.
7/4/14 22:15,Supulpa,OK,Light,3 minutes,3 Red orbs hovering then disappeared.
7/4/14 21:00,Chickasha,OK,Oval,5 minutes,Oval Shaped Orange Light Incredible Speed.
7/3/14 23:00,Miami,OK,Unknown,10 minutes,Three unidentified illuminations east of Miami Ok.
6/30/14 05:50,Oklahoma City,OK,Triangle,5 seconds,Large brightly lit object plummets from the sky in NW OKC
6/26/14 22:00,West Tulsa,OK,Circle,~1 second,Bluish white circular unidentified object over West Tulsa
6/24/14 21:55,Oklahoma City (NW part of city),OK,Egg,30 seconds,Quickly descending and then slowly moving lit object in NW okc sky.
6/21/14 22:20,Edmond,OK,Light,10 seconds,White bright light ascending at immense rate.
6/16/14 21:15,Tulsa,OK,Other,5 seconds,Green light raveling from East to West.
6/16/14 21:00,Broken Arrow,OK,Other,5 seconds,5 people at 9 pm saw blue green flash to white over Broken Arrow OK.
6/16/14 18:30,Sand Springs,OK,Cigar,5 minutes,White bar at angle moving slowly across sky.
6/15/14 11:00,Talala,OK,Triangle,5 minutes,A small black triangular object keeps pace with me.
6/5/14 21:00,Tulsa,OK,Sphere,10 minutes,12 orange orbs above downtown.
6/1/14 22:00,Bethany,OK,Changing,1 second,My brother and I were sitting outside and looking up at the sky a few years back. We both looked up and saw something so bright flash
5/27/14 12:00,Watonga,OK,Disk,1:00,((HOAX??)) Tornado watching turns into ufo sighting.
5/26/14 04:00,Pryor,OK,Other,1-2 hours,Low humming vibration like noise.
5/25/14 09:23,Midwest City,OK,Light,3 seconds,Looking out bedroom window noticed a light streak across the sky blinking four times. The light blinked out completely each time not
5/21/14 23:10,Claremore,OK,Disk,10 seconds,Gray flying object over rural Oklahoma.
5/19/14 00:00,Healdton,OK,Disk,15,There were no critical details.
5/17/14 19:30,Duncan,OK,Triangle,10 minutes,Standing on my porch saw triangle shaped craft with red glowing orb in the center.
5/15/14 22:10,Owasso,OK,Light,30+ minutes,5 UFOs spotted by 3 residents in Owasso OK
5/10/14 20:55,Owasso,OK,,3 seconds,There was a fast moving bright light over Owasso it turned red and blue and flashed then disappeared.
4/23/14 22:40,Tulsa,OK,Triangle,4-5 minutes,Pyramid shaped UFO sighted over Southern Hills Golf Course Wednesday April 23rd over TULSA OKLAHOMA.
4/21/14 00:00,Lawton,OK,Circle,11/2 minute,I went outside to my backyard to see what the weather was like. There was allot of clouds in the sky when I notice way up a black roun
4/18/14 22:58,Tulsa,OK,Changing,3 minutes,A bright white light in form of a cross appeared from southwest of Tulsa. As it approached the craft moved to right for a second th
4/8/14 04:00,El Reno,OK,Oval,3 seconds,UFO over lucky star caught on camera up close.
3/26/14 21:00,Oklahoma City (southwest of),OK,Flash,5 seconds,Bright flash SW OKC.
3/18/14 00:01,Glenpool,OK,Light,2+ hours,White light in sky over Glenpool OK area. Light looks long and horizontal.
2/28/14 01:00,Claremore,OK,Light,3 hours,Blue and red flashing lights in Oklahoma.
2/22/14 12:00,Miami,OK,Oval,,There was no police report?
2/22/14 04:00,Ada,OK,Other,2 hours,UFO on pond dam.
2/19/14 15:00,Tulsa,OK,,,((HOAX??)) Multiple witnesses report hearing a very strange sound emanating from the sky.
2/18/14 16:25,Warr acres,OK,Cone,20 seconds,White UFO in nw Oklahoma City.
2/17/14,Unspecified city,OK,,5 days,The USGS believes the booming noises everyone's been hearing in Oklahoma is due to the earthquakes. They have had several this month.
2/14/14 06:15,Tulsa,OK,Unknown,5-8 minutes,While driving down 41st headed west we saw a strange light in the sky moving straight up with streams of lights under it.
1/29/14 23:00,Oklahoma City,OK,Disk,30 seconds,Nearby nighttime viewing of brightly lit saucer in South Oklahoma City.
1/24/14 19:00,Stilwell,OK,Light,<1 minute,Light hovers then shoots straight up out of sight.
1/20/14 18:00,Marshall,OK,Other,<1 minute,Humanoid figure sited crossing road near Marshall Oklahoma.
1/17/14 13:00,Glenpool,OK,Unknown,5:00,Two streams flying into each other.
1/16/14 19:00,Glenpool,OK,Rectangle,1-2 minutes,Several different colored lights in the sky.
1/12/14 00:56,Lawton,OK,Teardrop,5 seconds,Very light blue flame heading towards the ground.
1/3/14 21:23,Jenks,OK,Circle,5 minutes,Fire-orange orb flying over Jenks faster than a jet and stopping before disappearing.
12/22/13 21:30,Sapulpa,OK,Light,<1 minute,Massive craft with 4 large lights masked in fog moving over Sapulpa OK.
12/15/13 21:30,Stillwater,OK,Light,Presently occurring,Three UFOS in a triangular formation one was much closer than the other two with bright flashing red and white lights it was moving and
12/14/13 20:00,Purcell,OK,Sphere,1 minute,"""Christmas Star"" - Multicolored pulsating sphere spotted on northern horizon."
12/13/13 05:15,Edmond,OK,Triangle,5 minutes,The shapes drifted across the sky. They were triangle with an orange light center. They drifted across the sky then some turned black t
12/11/13 19:00,Edmond,OK,Other,90 minutes,Almost fight been bright starlike crafts and some kind of government aircrafts!!!!!
12/10/13 18:30,Lawton,OK,Triangle,3 minutes,V-shaped aircraft with bright white lights and little colored lights.
12/6/13 01:30,Tulsa,OK,Circle,15 minutes,During the snow fall on Friday night I stepped out for a cigarette. I heard a strange sound that seemed to be a mix between very dista
12/5/13 18:00,Porum,OK,Other,15 minutes,Odd helicopter sighted landed and strange phone call too
12/5/13 18:00,Porum,OK,Other,15 minutes,Black helicopter and strange phone call
12/1/13 20:15,Moore,OK,Formation,1/2 minutes,5 lights in V formation-no sound- it was dull as there was fog coming down it did not go out of formation.
12/1/13 19:37,Oklahoma City (near),OK,Circle,5-10 minutes,Round
11/30/13 20:20,Oklahoma City,OK,Sphere,3 minutes,2 Amber Orbs Above Lake Overholser Area
11/30/13 20:20,Moore,OK,Other,2 minutes,5 lights in v formation - then began to move independently. Then lights out was how it disappeared.
11/30/13 18:06,Coweta,OK,Other,1.5 hours,Bright light in the air. ((NUFORC Note: We suspect a sighting of Venus. PD))
11/27/13 19:00,Owasso,OK,Triangle,30 minutes,White light triangular over central oklahoma ((NUFORC Note: Sighting of Venus. PD))
11/27/13 13:11,Oklahoma City/Weatland,OK,Flash,45 seconds,Bright ball of light observed near Hobby Lobby warehouse.
11/26/13 07:30,Amber,OK,Disk,1 hour,Disk shaped object spotted in Amber Oklahoma.
11/16/13 22:10,Crescent,OK,Sphere,15 seconds,Blueish/green orb or oval over central Oklahoma flew south by south west. Seen by two young men on the phone simultaneously 60mi. apart
11/10/13 21:00,Tulsa,OK,Triangle,20 minutes,Video of giant triangular craft and helicopters that come shortly after and hover beneath it.
11/9/13 09:08,Stillwater,OK,Light,45 minutes,I saw 7 or 8 balls of white light in clear sky at 9:00 AM that were flying in non linear fashion with a strange zigzag trajectory to NE
11/6/13 01:00,Moore,OK,Cigar,3 minutes,Floating craft over my neighborhood.
11/3/13 20:00,Poteau,OK,Triangle,10 minutes,We had just been released from church and was getting gas in Poteau (Murphy's USA) when I looked up and saw two triangle craft.
11/1/13 01:35,Okmulgee,OK,Formation,5 seconds,3 lights in formation flying south.
10/31/13 21:00,Del City,OK,Chevron,10 seconds,A dark chevron shaped craft moving quickly while phasing in and out.
10/31/13 10:45,Elmore city,OK,Fireball,3 minutes,Fireball parked 40 ft above highway.
10/28/13 00:06,Stillwater,OK,Sphere,10 minutes,3 Fire Orange Glowing Spheres Move Through the Skies Over Stillwater Oklahoma
10/26/13 23:00,Mustang,OK,Fireball,8-10 minutes,Fireballs over Mustang OK.
10/24/13 21:00,Broken Arrow,OK,Oval,15 minutes,2 Orangish/Red/Yellow Oval Objects hovering over a Broken Arrow OK residential district.
10/23/13 19:28,Choctaw,OK,Disk,2.5 seconds,Bluish white disk with trail behind it.
10/23/13 19:28,Choctaw,OK,Disk,2-3 seconds,Bluish white disk with contrail moving west to east.
10/21/13 22:00,Cleveland,OK,Teardrop,15 minutes,Bright lights hovering in the sky low to the ground disappeared out of sight within a few minutes.
10/21/13 20:30,Wilson,OK,Light,4 minutes,Strange bright star moving oddly while military jets fly by it.
10/15/13 23:00,Catoosa,OK,Other,1 minutes,I looked to the south at night and saw a very Large V shape ship it did not have lights and was very slow in flight and no sound.
10/7/13 20:00,Oklahoma,OK,Circle,4 months,Bright flying orb.
10/6/13 03:00,Cedar Lake (south of),OK,Circle,5 minutes,Multiple white glowing orbs seen in tree top near Talimena drive.
9/29/13 21:00,El Reno,OK,Fireball,2 minutes,10 Orange orbs hovering in the sky then faded out.
9/24/13 14:00,Tulsa,OK,Disk,5 minutes,Tulsa OK 61st & Harvard residential area UFO 20 - 25 feet off the ground above the trees (front yard).
9/23/13 20:40,Muskogee,OK,Light,2 minutes,What was thought to be a satellite stopped completely in its travels and sat stationary for a full minute.
9/22/13 06:45,Norman,OK,Light,10 seconds,Star-like object moving away from Sirius and then disappeared
9/21/13 21:11,Lawton,OK,Circle,<5 seconds,I saw a green and blue orb of lightcircular falling in a straight line silently changing colors into the tree line so of Rogers n Sher
9/9/13 23:00,Edmond,OK,Cigar,17 minutes,2 witnesses 2 miles apart Red & White Elongated-Cigar Shaped Flashing lights NW of Oklahoma City
9/4/13 20:53,Moore,OK,Light,1 minutes,Extremely fast red/orange orb of light.
8/28/13 22:00,Shawnee,OK,Light,1 hour,Distant intermittent erratic bright white object dancing around in Northern Star sky region after dark freaky!
8/24/13 01:00,Edmond,OK,Oval,5 minutes,Underwater Light appeared shot up out of a lake and hovered then disappeared.
8/24/13 01:00,Edmond,OK,Other,15 minutes,Craft comes out of lake hovers over me then shoots up. Then converse with 3 human like beings.
8/22/13 21:30,Broken Arrow,OK,Light,3-5 minutes,Lights in formation over South Broken Arrow Ok
8/18/13 08:45,Poteau,OK,Oval,15 minutes,Oval lights over north side of Cavanal Hill Poteau Ok August 18 2013
8/7/13 22:00,Poteau,OK,Light,30 seconds,6 reddish/orange lights hovering in sky
8/1/13 01:30,Tulsa,OK,Formation,5 minutes,Bright fast light making full circle in mid town in under 5 min
7/24/13 00:00,Tulsa,OK,Light,15 seconds,Green beam of light over Tulsa
7/17/13 22:30,McAlester,OK,Disk,30 minutes while travelin,It started as a mile long craft before it separated into many smaller ones.
7/17/13 21:52,Clayton,OK,Disk,10 minutes,Kiamichi Mountains- Hwy 271 South-glowing fire balls/UFO craft.
7/17/13 21:00,Lane,OK,Fireball,45 seconds,Orange fireball split into 4 equal sized spheres then disappeared.
7/11/13 03:00,The Village,OK,Circle,10 seconds,9 amber red circles.
7/9/13 14:53,Norman,OK,Cigar,10-15 seconds,Cigar shaped craft hovering over Norman Oklahoma.
7/5/13 21:30,Wyndotte (Grand Lake),OK,Oval,2-3 minutes,Three orange/red oval objects over grand lake/ ok. 7/5/2013
7/4/13 22:30,Spencer,OK,Fireball,1 minute,small round object moved across sky from s.e to n.w at high velocity without trail no noise disappeared
7/4/13 22:30,Bessie,OK,Light,2 minutes,Retired public employee witnesses four (?) large orange objects float overhead headed west (?).
7/4/13 21:30,Moore,OK,Circle,2 minutes,Circular object with singular non blinking reddish-orange light at front end.
7/4/13 20:30,Tulsa,OK,Unknown,20 minutes,Two orangish-red ufo's over downtown Tulsa on the night of the 4th of July.
7/4/13 18:30,Broken Arrow,OK,Sphere,4 hours,5-6 Reddish Orange Orbs spotted around the greater Tulsa area 4th July night.
7/3/13 01:20,Broken Arrow,OK,Light,5 minutes,Two orange lights moving in line with each other then fading separately.
7/3/13 00:15,Ft. Gibson,OK,Light,15 seconds,Gold/orange light disappears over Hwy 62.
7/2/13 22:50,Owasso,OK,Fireball,10 minutes,Two flying fire balls.
6/2/13 22:30,Oklahoma City,OK,Sphere,3 minutes,Multiple spherical orange lights seen over Oklahoma City
5/29/13 23:30,Moore,OK,Triangle,48 hours,Multiple ufo sightings in the past 48 hours detailed notes and drawings.
5/25/13 08:29,Purcell,OK,Disk,11 minutes,A small round object moved across sky from southeast to northwest at high velocity without vapor trail no noise at a altitude lower tha
5/18/13 20:55,Moore,OK,Formation,1-3 minutes,Amber colored formation of lights in eastern sky.
5/18/13 20:45,Moore,OK,Formation,2 minutes,Eight fiery red lights hang over downtown Moore Oklahoma just two days before deadly tornado strikes town.
5/14/13 21:14,Tulsa,OK,Unknown,1 minute,Bright star moving across the sky at very slow speed.
5/5/13 23:30,Yukon,OK,Rectangle,~1.8 minutes,UFO over LDS temple in Yukon Oklahoma.
5/1/13 03:20,Stillwater,OK,Light,15 seconds,"Bright ""star"" dimmed then picked up speed shot across the sky then altered direction and disappeared."
4/27/13 21:40,Edmond,OK,Triangle,5-10 minutes,Red lights forming a triangle in Logan County Oklahoma 04/27/2013.
4/24/13 00:00,Stillwater,OK,Light,10 minutes,2 or 3 small lights randomly floating around in the sky. No clear flight path at all.
4/19/13 00:00,Ludlow,OK,Circle,1 hour,Moving lights over Ludlow OK.
4/12/13 22:21,Warr Acres,OK,Light,2 seconds,A quarter size ball of light.
4/11/13,Bethany,OK,,20 seconds,"Object my brother and i seen was a ""v-shaped"" objectthen it seemed to change shapes to a circle type shape."
3/19/13 03:06,Inola,OK,Triangle,~3-5 minutes,Couple see's triangler ufo in inola oklahoma.
3/17/13 15:00,Indiahoma,OK,Unknown,20-30 seconds,A pressurized-sounding wind seen moving slowly about a Wildlife Preserve without any visible craft above its effects.
2/19/13 04:39,Stillwater,OK,Light,45 seconds,2 brilliant headlight shaped objects appeared suddenly then disappeared.
1/6/13 17:31,Claremore,OK,Light,10-12 minutes,Very bright light changed shapes flashing lights went straight up in sky had smoke coming out.
12/29/12 20:50,Edmond,OK,Circle,40 seconds,"Around 15-20 orange lights in sky first make a snowflake shape but then a ""W"" shape; start to move NE towards Guthrie OK."
12/21/12 00:58,Tulsa,OK,Other,10 minutes,UFO over Tulsa Oklahoma at 12:58am 12/21/12
12/20/12 21:00,Luther,OK,Sphere,3 minutes,Big ball of yellow light in Central NE Oklahoma
12/20/12 18:00,Tulsa,OK,Other,2 minutes,Large airplane flying low to ground stopping in mid-air hovering for a few seconds then continuing to fly.
12/20/12 05:45,Tulsa,OK,Light,1 second,MORE PEOPLE HAD TO HAVE SEEN THIS AND NEED TO REPORT TO TULSA NEWS.
12/18/12 09:00,Tulsa,OK,Other,15-20 seconds,A large metallic cigar/blimp like object that hovered in the air for 15 to 20 seconds and then shrunk into dispearnace in 1.5 seconds.
12/16/12 16:50,Durant,OK,Formation,30 seconds,Line of lights.
12/12/12 18:41,Talihina,OK,Fireball,80 seconds,Four orange fireballs witnessed hovering very close to ground in Oklahoma that beamed white light to ground.
12/10/12 22:00,Talihina,OK,Light,30 seconds,Strange lights appeared to line up in the sky and then dimmed out.
12/10/12 19:46,Buffalo Valley,OK,Fireball,20 seconds,Four orange fireballs witnessed hovering very close to ground in Oklahoma.
11/23/12 17:00,Fort Towson,OK,Cylinder,3 minutes,Clearly seen craft starts shimmering red orange underneath craft pop then appears to cloak.
11/19/12 20:00,Cordell,OK,Light,5-6 minutes,Blue and red light orb falling from sky then rising again.
11/16/12 03:00,Pond Creek,OK,Teardrop,3 minutes,Slow moving teardrop shaped craft
11/8/12 23:57,Agra,OK,Unknown,45-60 seconds,Falling fire ball or stream
11/6/12 16:15,Miami,OK,Unknown,~10 seconds,Shiny reflective object
11/1/12 19:15,Oklahoma City,OK,Circle,25 seconds,Ball of lights
10/24/12 22:30,Jenks,OK,Circle,10 minutes,Two blinking circular crafts hover over northern sky and then vanish.
10/19/12 21:40,Oklahoma City/Edmond,OK,Triangle,10 to 15 minutes,Lights Over Oklahoma City/Edmond Area
10/17/12 21:00,Poteau,OK,Unknown,21:00,Lights going to fast to be a plane
10/17/12 19:00,Norman,OK,Sphere,5 minutes,"A bright soundless orb of light hovering about 200 feet in the air which went east into norman.

500 Lights On Object0: Yes"
10/14/12 21:30,Elmore City,OK,Unknown,10 minutes,Several multi-colored lights seen hovering over Elmore City/Pauls Valley area. Sometimes a white one shows up as well.
10/12/12 20:30,Oklahoma City,OK,Sphere,5 minutes,Multiple silent red orbs under power over Oklahoma City approx. 5 min. duration.
10/5/12 20:08,Tulsa,OK,Formation,<2 minutes,Armada of Star-like Objects Moving Across Oklahoma Night Sky
9/23/12 21:00,Owasso,OK,Cross,1-2 minutes,Before last night I always shook my head and thought everyone who told a UfO/alien story was silly and ridiculous.
9/20/12 21:45,Colcord (6 Miles north of),OK,Triangle,3 minutes,Three lights over north east Okla.
9/13/12 04:20,Muskogee,OK,Light,20 minutes,Cluster of 20 or more multicolored lights hovering in same area for 20 or more minutes.
9/6/12 07:07,Cogar,OK,Circle,3 minutes,Orange circular UFO lands 20 feet in front of woman in Caddo County Oklahoma.
9/4/12 17:40,Moore (southeast of),OK,Light,2-3 minutes,2 bright orbs of light moved west at rapid speed after first seen hovering above 149th between Harrah an Moore Ok..
9/3/12 21:15,Owasso,OK,Light,10 seconds,Driving south toward Tulsa from Owasso OK a green and white bar of light was seen traviling at a high rate of speed.
9/1/12 17:45,Norman,OK,Unknown,30 seconds,A blinking light which changed intensity and had a non-recurring pattern moving in a non-uniform direction then streaked across sky
8/28/12 02:30,Tulsa,OK,Disk,1-2 hours,Three stationary multi-colored lights in triangle formation over Tulsa Ok
8/26/12 21:00,Seminole,OK,Circle,3 minutes,Orbs of light moving in the evening sky
8/19/12 23:30,Tulsa,OK,Triangle,45 minutes,Red white and green flashing lights
8/15/12 18:00,Oklahoma City,OK,Circle,Ufo,((HOAX??)) Ufo was dancing in the sky over lake hefner
8/13/12 22:00,Wilburton,OK,Light,30 seconds,Large very bright orange light seen close in Wilburton OK.
8/13/12 03:45,Edmond,OK,Formation,60 seconds,2 Steady moving lights that were similar to stars one behind the other traveling very fast and disapearing.
8/13/12 00:15,Norman,OK,Triangle,5 hours,Firey orange triangle-aprox. one hundred white spheres/orbs. and a triangle shaped craft with circles on each point.
7/22/12 04:00,Ardmore,OK,Unknown,1 hour 30 minutes,My husband and I went outside at 4am last night to look at this strange star my husband told me he saw the other night. The star wasn't
7/22/12 03:00,Wagoner,OK,Triangle,20 seconds,Low flying silent triangular shape with green and white lights
7/21/12 22:00,Oklahoma City,OK,Light,10 minutes,Hello I am a 52 year old male and live in central OK. I build custom cars and motorcycles for a living and work in a private shop
7/19/12 23:00,Ardmore,OK,Fireball,1 minute,Orange/Yellow flying ball
7/8/12 21:30,Norman,OK,Changing,2 minutes,A redish-orange shape-changing orb over Norman Ok. on July 8 2012 that changed from a north to west direction before dimming out.
7/7/12 21:50,Dewey,OK,Circle,2 minutes,Red round light changing colors traveled silently over Dewey Oklahoma
