date_time,city,state,shape,duration,summary
6/5/15 22:50,South Kingstown,RI,Light,2 seconds,At the above time and date a bright light blueish-white streaked overhead going S to N. ((NUFORC Note: Possible meteor?? PD))
6/5/15 13:00,Providence,RI,Unknown,5 minutes,Multiple reflective objects high in the sky.
6/4/15 22:30,Tiverton,RI,Circle,1 hour,Seven glowing lights appear in the sky and each disappear and reappear multiple times within about an hour in Tiverton RI.
5/30/15 22:00,Providence,RI,Circle,10 seconds,I was outside talking to my father with my aunt and my little cousin I look to the right of me I thought it was firework coming in the
5/30/15 12:32,Riverside,RI,Formation,unknown,Something strange in the sky.
5/1/15 20:37,Pawtucket,RI,Light,30 seconds,Extremely small light moving at a constant speed like an airplane but extremely far in the skies.
4/23/15 00:00,Middletown,RI,Unknown,44 years known,Satellite Imagery of the course of 44 years.
2/27/15 03:50,South Kingstown,RI,Other,30 seconds,Small sparkling lights in the air/sky.
1/2/15 06:09,North Kingstown,RI,Light,30 seconds,2 separate sightings of medium brightness star lights traveling at high speed and great distance and making 90deg turns
12/14/14 04:33,Rumford,RI,Light,2 seconds,An apparent shooting star that had a U-shaped trajectory.
12/12/14 20:25,Pawtucket,RI,Oval,,4 oval shaped blue lights in the sky circling and in a pattern of coming all together. ((NUFORC Note: Advertising lights. PD))
11/29/14 19:45,North Providence,RI,Circle,60+ minutes,I was in my backyard and I saw 4 balls of light dancing together in the sky. ((NUFORC Note: Advertising lights?? PD))
11/29/14 05:15,Cumberland,RI,Circle,6 minutes,Leaving my house for coffee the noticed a ball of light extremely quiet no noise also big in size flying S the as 1 object.
11/16/14 18:15,Coventry,RI,Fireball,3 minutes,I was walking my dogs on this particular night and observed what looked like a plane taking off from Green Airport.
10/31/14 21:50,Charlestown,RI,Unknown,7 seconds,Heard a power down of an engine in the sky with no visible object and slight home power flicker
10/27/14 18:50,South Kingstown,RI,Fireball,5-10 minutes,Fireball going across the sky when trying to watch the initial Antares launch on 10/27/14
10/25/14 01:25,Pawtucket/Rumford,RI,Diamond,~60 minutes,Diamond shapes in the sky. Moving side to side. Blinking/flashing at each other. Almost dancing with each other. Zig zagging across the
10/21/14 23:30,Pawtucket,RI,Unknown,2 minutes,Bright orange/red light filling room.
10/14/14 22:30,Hope,RI,Light,6 minutes,Bright red stationary light low in sky never moves and inch then disappears.
10/9/14 22:00,Kingston,RI,Fireball,1/2 hour,Fireballs all moving same direction.
9/27/14 21:00,Providence,RI,Fireball,3-5 minutes,While walking in Providence husband and wife and others view 3 orange orbs in the night sky
8/26/14 05:00,Warwick,RI,Cylinder,3 minutes,A very large circle of light. which dissipated.
8/23/14 21:25,South Kingston,RI,Fireball,2 minutes,Two fireballs traveling together.
8/18/14 22:30,Narragansett,RI,Fireball,10 minutes,Orange flaming orb flying over Narragansett RI beach.
8/17/14 10:21,Johnston,RI,Oval,1 minute,Oval shaped craft with three big round bright lights!!
8/4/14 21:00,Jamestown,RI,Light,3-5 minutes,Two red/orange plasma shapes soundless close range for 3 minu by two witnesses one following the other by about 60 secs then vanished
7/28/14 22:00,Johnston,RI,Light,7 minutes,Red sphere in sky.
7/26/14 21:10,Middletown,RI,Light,5 minutes,Two yellowish-orange lights flying in the sky and then vanished.
7/24/14 18:30,East Greenwich,RI,Oval,10 minutes,An unidententifiable vehicle at significant speed.
7/12/14 22:30,Warwick,RI,Circle,1 minute,10 objects moving in formation.
7/7/14 13:00,Westerly,RI,Egg,30-45 seconds,Dark cloud followed by 5-6 chrome egg shaped crafts
7/6/14 22:15,Johnston,RI,Sphere,3 minutes,Thee Orange Redished Spheres appeared from behind a row of pine trees.
7/5/14 21:00,Bristol,RI,Light,hour,Light flying across sky.
6/21/14 20:03,Woonsocket,RI,Sphere,1 1/2,2 Orange balls that have came out of cloud and moved west slilently...Second time I seen1 in front of meabove a home.
6/7/14 21:00,Pawtucket (Central Falls),RI,Triangle,3 hours,Seen at least 10 have a lot of pictures and videos it started at 9pm it's 11pm and still going a triangle shape Turning red and white a
6/6/14 23:00,Providence,RI,Triangle,3-4 minutes,Objects flying over Providence RI.
6/6/14 22:30,Providence,RI,Circle,10 minutes,Circular lights moving quickly and low in sky.
6/3/14 00:33,East Providence,RI,Light,5 seconds,"A light went in a ""Z"" pattern and disappeared."
5/19/14 08:30,Middletown,RI,Circle,5 minutes,Orange fireball flying at the speed of a low-flying plane heading south seen out my bedroom window by my son and I
4/24/14 10:00,Warren,RI,Cigar,3 minutes,I was driving N into Warren in the mid-morning and I saw 3 cigar shape crafts with no wings. 2 ships heading East.
4/15/14 19:00,Wakefield,RI,Oval,10 seconds,Multiple color changing ufos quickly disperse in all directions in the evening sky et. al.
3/20/14 19:45,Harrisville,RI,Triangle,3,Saw a triangle shaped object with lights that didn't move then abruptly took off.
3/18/14 23:00,Providence/Johnston (between; traveling),RI,Sphere,Unknown seemed to stay,"Large red and spherical object ""hiding"" behind the moon at night."
2/1/14 15:25,South Kingstown,RI,Triangle,3 minutes,While out in my backyard with my dogs at above time I hear the unmistakeable 'jet-like' roar..EXTREMELY loud sound..of craft that have
1/30/14 17:30,West Greenwich,RI,Circle,1 minute,Two hovering black disk's no lights. Seen by 2 people and photographed
1/18/14 23:00,Pawtucket,RI,Triangle,3 minutes,Saw a triangle ufo hovering over the the street. Started to come straight towards us and then took a sharp turn to the right and flew a
1/5/14 18:45,East Providence,RI,Light,10 minutes,Orange lights formation speed fast low multiple ufo.
12/28/13 13:00,Providence,RI,Teardrop,15 minutes,White bright streak like teardrop shape in clear blue sky.
12/25/13 20:15,Woonsocket,RI,Fireball,3mins,3 orange fireballs.
12/24/13 17:45,Providence & Cranston,RI,Fireball,5 minutes,Fireball-like lights on Christmas Eve.
11/29/13 20:00,Coventry,RI,Sphere,1-1.5 seconds,Bright white light travels across the night sky and vanishes.
11/29/13 08:07,North Providence,RI,Fireball,4 seconds,Bright white low object split second gone.
11/24/13 19:00,North Providence,RI,Light,2.5 hours,Read above. ((NUFORC Note: We wonder whether the object might have been in the SW sky therefore Venus. PD))
11/23/13 17:30,Coventry,RI,Other,days,A light over Rhode Island for more than 10 days. ((NUFORC Note: If the time is p.m. we suspect Venus. PD))
11/16/13 18:30,Jamestown,RI,Fireball,8 minutes,When outside with our dog around 6:30 pm on Sat. Nov. 16th I spotted a bright white orange light pulsating somewhat coming above the
11/10/13 22:51,Providence,RI,Rectangle,1 minutes,Was coming home from a friends house and before my exit i saw an unidentified flying object. it started out right out front my windshie
11/2/13 22:30,Wakefield,RI,Fireball,5 minutes,Silent flaming ball moving around 50 knots at 1500 feet altitude. Dead calm wind. Could see flames dancing.
10/20/13 19:42,Woonsocket,RI,Triangle,5 minutes,A flashing triangular object hovering in sky with white beaming lights and body changing color.
10/9/13 20:00,Woonsocket,RI,Light,2 minutes,Bright light.
10/1/13 12:40,Lincoln,RI,Light,4 seconds,Two white dots crossing paths around Lincoln and Providence RI.
9/29/13 18:00,Johnston,RI,Disk,90 seconds,4 objects seen in upper atmosphere maneuvering at high speed then up out of sight!
9/25/13 03:39,Hopkinton,RI,Light,45,I went to let my dogs out and have a smoke. The moon was bright high above my yard and the sky was clear I could see all of the stars
9/22/13 18:00,Warwick,RI,Circle,30 minutes,It looked like a star but moved in various directions.. that a plane could not do. we realized it was moving because it was between two
9/19/13 20:00,West Warwick,RI,Fireball,15 seconds,Bright orange fireball with 300 meter trail.
9/10/13 23:00,Warwick,RI,Formation,10 minutes,Silent orange lights in formation.
9/7/13 22:00,Coventry,RI,Circle,2 minutes,Driving on the road the car in front of me pulled to the sholder I looked up to the sky to see 5 circular shaped lights in a crescent.
9/1/13 01:30,North Providence,RI,Disk,5 seconds,Bright greenish blue circular disc object moving over head leaving a white trail behind it.
8/17/13 09:30,Cranston,RI,Light,30 minutes,I pulled into work last night and realized my co worker and a few people from the restaurant next to ours were staring at the sky. I g
8/16/13 20:15,Woonsocket,RI,Sphere,2 minutes,Orange orb moving in the sky silently.
8/3/13 22:40,Woonsocket,RI,Fireball,~3 minutes,A bright red circle/light/fireball in the sky that didn't blink and suddenly disappeared.
8/2/13 22:00,Charlestown,RI,Cylinder,30 seconds,White cylinder with orange flames hovering at rooftop height.
7/27/13 21:00,Pawtucket,RI,Circle,minutes,Round hovering objent with bright colored lights
7/26/13 20:00,Pawtucket,RI,Light,20 minutes,Light in sky above pawtucket ri
7/23/13 17:40,Providence,RI,Sphere,Unknown,UFO Stuck within a Storm Cloud
7/4/13 21:20,North Providence,RI,Fireball,5 minutes,Unknown red ball object in the sky near fireworks display.
7/4/13 20:00,North Providence,RI,Sphere,3 minutes,Red sphere at a Fireworks display in Rhode Island 2013
6/18/13 17:00,Woonsocket,RI,Diamond,1 minute,A UFO was sighted flying over a school in Woonsocket RI.
4/18/13 20:00,Exeter,RI,Diamond,30 seconds,Two diamond shaped objects flying just above tree line odd movement and light color
3/30/13 20:20,North Kingstown,RI,Unknown,10 minutes,Two bright yellow/orange lights moving Northwest to Southeast over North Kingstown RI
3/17/13 00:50,Cranston,RI,,20 minutes,Light blue disk over Cranston RI for 20 minutes. ((NUFORC Note: Possible advertising lights?? PD))
3/9/13 19:30,Providence,RI,Other,20 seconds,Orangish glowing object soared at low altitude  followed by white shooting star streaking across sky for 3 seconds
3/3/13 21:00,Cranston,RI,Fireball,1 minute,Orange ball of light hovering at a low altitude in cranston vanishes then reappears seconds later in diff location
2/5/13 07:30,Providence,RI,Cigar,3:00,Bright light cigar shape hovering and disappearing.
1/14/13 17:00,Pascoag,RI,Light,2 minutes,Glowing orange light larger than north star located north hovers and travels down past tree line.
12/13/12 17:00,North Providence,RI,Unknown,22:00,I Julian Smith witnessed and others mutiple ufos speeding faster then the fighter jet plans and all other objects near 100miles in eyes
12/13/12 08:18,,RI,Light,12 minutes,6 fast crarft appear then fly out of view.
12/5/12 17:00,Westerly,RI,Fireball,1/2 second,Intense yellowish white fireball with greenish tint.
11/29/12 20:00,Richmond,RI,Chevron,30 seconds,Insanely large craft wierd shape purpleish blue blue and white spotlights very low over my car flying slow.
11/29/12 16:25,Coventry,RI,Fireball,5 minutes,Fireball falling straight down.
11/28/12 17:45,North Smithfield,RI,Other,2 seconds,Super fast blue green object jets in sky and just disappears.
11/21/12 22:00,Newport,RI,Circle,1 minute,Slow moving white light with red sphere rotating tightly around it disappears into thin air.
11/19/12 18:00,Providence,RI,Teardrop,4-9 minutes,Around 6 am I saw something in the sky that looked like a silver teardrop.
11/5/12 17:23,South Kingstown,RI,Circle,~1 second,Large Fast Moving Blue/Green Circlular Object Flying Through The Sky In North East America
11/5/12 09:40,Cranston,RI,Sphere,1 minute,3 spheres in Cranston RI.
11/1/12 19:00,Coventry,RI,Light,15 minutes,Hope they land.
10/29/12 22:00,Woonsocket,RI,,flash of camera,Alien? looking in a second story window. It's a strait drop beneath it but there it is. ((NUFORC Note: We suspect an artifact. PD))
10/29/12 10:30,Woonsocket,RI,,seconds,Unusual alien in the window - non grey.
10/21/12 23:57,Cranston,RI,,90 seconds,Large orange ball over Rhode Island.
10/18/12 22:00,Rumford,RI,Light,30 minutes,On 10/18/12 at 10:30 p.m. Two bright lights were seen in the eastern sky. At first they were stationary but then they started moving b
10/6/12 00:40,Cranston,RI,,90 seconds,I am a retired plychologist age 64. I sit out every night till about 2pm facing the south. I saw a large round orange ball like a pu
9/20/12 01:30,Warwick,RI,Light,3 minutes,I got up to let my dogs out at 1:30 AM on September 20 2012. Standing out on my deck I noticed how clear the sky was. When I looked to
8/22/12 23:15,Block Island,RI,Fireball,3 minutes,Saw 5 fireballs some in V formation that went out one by one.
8/17/12 20:42,Warwick,RI,Circle,@30 seconds,Circular Object (Fiery?) over Warwick RI
8/17/12 11:25,Warwick (6 miles north of),RI,,,Object behind blimp
8/5/12 23:00,Coventry/Exeter,RI,Circle,3 minutes,Flickering lights in RI skies on Aug. 5 2012.
8/4/12 21:00,Pawtucket,RI,Cylinder,3 minutes,Bright Red/Orange Light flying across sky weeving in and Out Slowing down and Speeding up.
7/25/12 22:25,Cumberland,RI,Circle,,Lights flying in the sky
7/10/12 22:22,Coventry,RI,Fireball,15 seconds,Orange balls flying very fast seen over Coventry
7/7/12 22:09,Newport,RI,Fireball,2 minutes,2 fireball objects changing to triangle objects pulsing orange light flying overhead at purgatory chasm in Newport.
7/4/12 23:00,Woonsocket,RI,Changing,5 mimutes,Heard a vibrating sound and looked out the 3rd floor window. Saw a rotating star tetrahedron. It lit up the sky like it was day. Moved
7/1/12 20:00,Newport,RI,Circle,10 minutes,I saw a red fire ball that I thought was a plane on fire coming down diagonally from the sky.it landed in the ocean at first beach in N
6/30/12 22:15,Riverside,RI,Circle,15 20 minutes,My kids were out side playing when one of them look up to the west and saw a lot of redish Orange orbs in the sky they ran the house to
6/28/12 03:09,Pawtucket,RI,Sphere,1 minute -5minutes,((HOAX??)) I had just finished watching a rerun of ghost hunters and i got on my laptop and as usual i go to google.
6/14/12 23:00,Cranston,RI,Sphere,15 minutes,Bright spheres forming huge triangle.
6/14/12 23:00,Cranston,RI,Fireball,1 minute,2 fireballs bright white interiors bright red flaming edges moved SW across the sky then disappered one at a time.
6/1/12 12:30,Greenville,RI,Other,3 seconds,there was a loud boom and a flash of light
5/24/12 21:00,Narragansett,RI,Circle,2 hours,8 witnesses viewed 9 ufo's in the Rhode Island sky.
5/19/12 21:30,Woonsocket,RI,Light,3 minutes,Large bright fire orange in colora perfect globe of light
5/12/12 21:00,Woonsocket,RI,Sphere,15 minutes,Orange [large] Ball with invisable stuff
5/12/12 11:00,Riverside,RI,Circle,5 minutes,flying redish orange balls without tails flying down the street at a high rate of speed.
5/12/12 01:30,Kingston,RI,Light,5-6 seconds,Red star weaving back and forth across the sky
5/9/12 09:15,Woonsocket,RI,Sphere,15 minutes,Light TECH. that moves stuff OUR future [U.S.A.] will have light motion...I told you first!!!
5/9/12 09:15,Woonsocket,RI,Sphere,5 minutes,Orange sphere than blinking lights to slow down craft until stopped. ((anonymous report))
3/20/12 21:30,Pawtucket,RI,Light,60 seconds,An object producing a large bright orange glow could be seen in the clear night sky for about one minute. It seemed to hover over us in
3/18/12 20:00,Warwick,RI,Circle,10 mintues,Orange circular orbs in the sky.
3/18/12 19:15,Warwick,RI,Circle,3 minutes,A red circular fire that moved across the sky was seen by 5 people in RI.
2/27/12 22:20,Coventry,RI,Light,5/10 secs,BRIGHT WHITE LIGHT WITH A BLUE AURA MOVING EXTREMELY FAST
2/27/12 09:25,Coventry,RI,Fireball,seconds,Flash was so bright it hurt my eyes like a camera flash to close it lasted seconds and it was gone looked like a fire ball yellow and
2/21/12 18:45,Ashaway,RI,Unknown,about 1 minute,Four or five chevron type craft flying at night.
2/15/12 23:35,South Kingstown,RI,Light,5 seconds,At approximately this time I let one of my dogs out into my large fenced and wooded backyard. The night was cold clear and many sta
2/5/12 14:00,Warwick/Coventry,RI,Other,8 minutes,Black bell kiowa sightings over 95
1/15/12 17:00,Smithfield,RI,Triangle,5 minutes,Triangular lighted shape in the sky around 5 pm
1/8/12 17:27,Westerly,RI,Fireball,5 min.,Four Reddish-orange fireballs-changed direction-disappeared.
12/17/11 20:00,North Scituate,RI,Light,5 min,I noticed 6 or 7 constant red/orange lights low on the horizon behind the trees.
11/26/11 09:00,Providence,RI,Unknown,1-2 hours,The object was extremely close to my car when driving and traveled at a high rate of speed when it was not idle.
11/18/11 20:00,Woonsocket,RI,Circle,5 seconds,Moved faster that a plane but much slower than a meteor.
10/10/11 14:30,North Kingstown,RI,Oval,40 sec,Bright oval object in sky
9/17/11 20:05,West Warwick,RI,Light,@ 5 min,I saw 6 or 7 red lights slowly moving in the sky north of West Warwick RI that were heading north
9/17/11 20:05,Johnston,RI,Sphere,1 minute,Orange Sphere in the night sky.
9/12/11 21:30,Providence,RI,Triangle,1 second,Fleeting triangular object following a meteor path
9/3/11 22:15,Narragansett,RI,Unknown,2 minutes,Newton Ave/ Hazard Rock area- Huge hovering object with light formations dissapeared.
9/1/11 02:30,West Greenwich,RI,Light,30 seconds,I awoke to find orbs of light floating outside my bedroom window
7/9/11 22:15,Mapillville,RI,Fireball,60 seconds,On 7-9-2001 i was driving home from a friends house in Mapillville Road Island . I was 1000 feet from my driveway. There was a clearing
7/4/11 22:00,Warwick,RI,Fireball,20 mins,Red lights in the sky on the 4th of july
6/1/11 12:00,Warwick,RI,Disk,5-10 seconds,It was a sunny day I was driving on airport road toward Post road with my wife. as I'm coming up on the intersection about three to fo
6/1/11 12:00,Warwick,RI,Disk,5-10 seconds,It was a sunny day I was driving on Airport road toward Post road when a glimmering shiny metallic saucer appears over trees ahead. It
5/8/11 23:00,Exeter,RI,Diamond,20min,A disbeliever firmly becomes a believer after spotting this thing in the sky.
3/7/11 18:50,Wakefield,RI,Formation,30-60 sec.,Two White Lights Fly Simultaneously WNW to EAST
2/18/11 19:40,North Kingston,RI,Flash,Seconds??,Man sitting in car is bathed in light from three very bright flashes of light in rapid sequence.
1/25/11 19:20,South Kingstown,RI,Unknown,10 minutes,Mystery 'jets' again over Rhode Island
1/21/11 17:11,Warwick,RI,Light,10 Seconds,Blue ball of light arching in the sky in Warwick Rhode Island
1/16/11 21:00,Pawtucket,RI,Circle,60 sec.,3 flying orange orbs.
1/3/11 21:40,Wakefield,RI,Disk,1.5 seconds,A large disc shaped craft entered my field of vision and disappeared before i could observe further details.
11/2/10 17:00,Coventry/West Greenwich,RI,Other,about 10 mins.,2 missile shaped objects in broad daylight. 95 SOUTH EXIT 7. They were moving extremely slow or not at all. Was not a plane.
9/20/10 00:00,Westerly,RI,Unknown,40 minutes,Low flying jet like sound followed by a long sighting of three color lighted object hovering.
9/15/10 22:45,East Greenwich,RI,Triangle,1 minute,Three bright white lights in a triangular shape - with a red pulsing light at the rear moving over highway - LOW
8/14/10 23:00,Providence,RI,Diamond,15 minutes,lights over providence
7/27/10 00:15,Cranston,RI,Other,20 minutes,Pulsating white red geen light in the Western Sky of Rhode Island. ((NUFORC Note: Sighting of star. PD))
7/15/10 19:45,Newport,RI,Disk,3 to 4 minutes,Dark stationary object w/ no lights; some type of stat. undercarriage. ((NUFORC Note: Report from Air Traffic Controller. PD))
7/11/10 03:00,West Warwick,RI,Light,the past two days so far,several flying objects surrounding one bright light that moves in different directions. ((NUFORC Note: Jupiter in E sky?? PD))
7/4/10 23:30,Providence,RI,Unknown,1 minute,A bright light in the sky croosing the sky of Providence pulling with it small and big clouds with out sound.
6/3/10 14:00,Newport,RI,Disk,Unknown,UFO photo sighting
5/24/10 14:30,Charlestown,RI,Other,1 hour,Strange aircraft again over southern Rhode Island
5/20/10 11:00,South Kingstown,RI,Chevron,5 minutes,Odd chemtrail and jet formation over souther Rhode Island
5/16/10 09:40,South Kingstown,RI,Cylinder,30 seconds,Stationary gray cylinder slowly accelerates turns white then opaque and disappears.
5/14/10 04:30,Providence,RI,Other,2 seconds,Star slides to left in sky then Disappears
4/10/10 21:00,Warwick,RI,,,this is not a sighting report but perhaps a clarification of an event that occured on the night of April 10 2010 in which a UFO was re
4/10/10 00:00,Warwick,RI,Disk,10 minutes,bright light hovering over the warwick mall
4/2/10 20:45,Greenville,RI,Formation,5 minutes,orange lights over Greenville RI started in formation then disappeared from sky very weird
3/16/10 12:45,Westerly,RI,Circle,10,Object flying along side an airplane disappeared into the clouds emerged 5 minutes later and flew southwest.
1/26/10 11:00,South Kingstown,RI,Other,5 minutes,This morning at 11am I again heard the now familiar jet-like sound of an approaching craft. I went outside to see a low flying jet of
1/21/10 18:40,South Kingstown,RI,Cylinder,7 minutes,Jet-like objects again over southern Rhode Island
1/20/10 18:45,South Kingstown,RI,Chevron,10 minutes,Jet-like craft with loud noise and strange lights in over southern RI
10/11/09 19:00,North Smithfield,RI,Circle,10 to 15 seconds,I was watching the sky like I always do on a clear night because you can always see what appear to be stars riding along the night sky.
10/1/09 20:00,Providence,RI,Disk,5 minutes,saucer with red and blue lights over providence RI
10/1/09 08:00,Pawtucket,RI,Cylinder,10 minutes,Hovered over Pawtucket RI and had red flashing lights at the bottom
9/25/09 22:30,Wakefield,RI,Light,seconds,two lights moved horizontally then zig zaged very fast and shot out of sight.
9/19/09 20:23,North Kingstown,RI,Light,3 min,There was a bright bell shaped light in the sky. ((NUFORC Note: Missile launch. PD))
9/19/09 20:12,Cranston,RI,Cone,3 min,cone shaped hazy light pointed downward from sky. ((NUFORC Note: Missile launch. PD))
9/19/09 20:10,Wakefield,RI,Triangle,1minute,Bight ball of light in the sky trailed by a more diffuse morphing cloud of light. ((NUFORC Note: Missile launch. PD))
9/19/09 19:58,North Smithfield,RI,Sphere,>1 minute,I was looking up at the stars and all of the sudden a giant circle was right in front of my eyes. ((NUFORC Note: Missile launch. PD))
9/19/09 19:50,Providence,RI,Unknown,20 seconds,I ran across information that seems to explain the beams. ((NUFORC Note: Missile launch. PD))
8/23/09 03:00,Little Compton,RI,Fireball,3 mins,Strange orbs/lights seen above and around Warren Point during Hurricane Bill
8/19/09 22:00,Leeds (UK/England),RI,,2 minutes,controlled and deliberate manouvers
8/8/09 21:00,Middletown,RI,Fireball,0:05,~24 orange/red fireball shaped objects moving in pairs along common flight path before ascending and dissappering.
8/1/09 20:15,Warwick,RI,Sphere,15 sec,oakland beach  green glowing illuminated object moving very fast east to west
6/8/09 03:00,Providence,RI,Teardrop,7 minutes,UFO seen floating over providence RI
5/30/09 17:00,Smithfield,RI,Chevron,10 min,Chevron shaped craft filmed in daylight.
4/23/09 19:10,Cranston,RI,Disk,1 minute,Two Silver Objects diagonal from each other hovered then jolted upwards and vanished out of sight on a clear day.
1/19/09 14:21,Providence,RI,Formation,6 minutes 20 seconds,Rhode Island Providence Nantucket 19th January - formation flying craft of ther sky
1/9/09 21:00,Johnston,RI,Oval,5 mins,object did not move in normal manner
12/5/08 07:30,Tiverton,RI,Cylinder,5-6 seconds,Brilliantly lighted cylindrical object seen in northern sky moved at a high rate of speed and vanished.
11/27/08 06:00,Warwick,RI,Flash,1 second,Cloud like object streaks through sky at tremendous speed - for one second!
10/31/08 19:00,Wakefield,RI,Flash,1 second,Bright white flash
10/8/08 18:45,Wakefield,RI,Formation,3 min,2 sets of 5 or 6 red tumbling lights move steadily across southern sky.
10/4/08 23:15,Providence,RI,Oval,Approximately 1 minute,3 illuminated oval objects spotted flying closely together.
10/1/08 19:00,Warwick,RI,Circle,ten minutes,Myself and two of my friends were driving down the road to pick up my girlfriend when my friend in the passenger seat noticed two unide
8/21/08 14:00,Newport,RI,Disk,30sec,((HOAX)) flying saucer speeds by overhead while bystanders are appaled while the traind investigator me is not surprised.
8/20/08 20:30,Newport,RI,Cone,10mins,((HOAX??)) 4 cigar shaped craft hovering over newport
7/15/08 23:30,Johnston,RI,Triangle,20 sec,triangle over johnston with blue red and white lights
7/12/08 00:38,Cranston,RI,Light,approx. 12 minutes,See's light over Cranston
7/11/08 13:30,Riverside,RI,Circle,3 minutes,Round white object spotted traveling faster than a conventional aircraft no smoke trail/tail
5/24/08 05:10,Narragansett,RI,Circle,4-5 minutes,I saw this object just above the moon and slightly to the left and it changed from whitish to light bluish and back to whitish.((Star?)
4/17/08 23:45,Cumberland,RI,Disk,15 Minutes,Unknown Object Acting Strangely In The Sky With No Sound To It At All
3/31/08 01:00,Newport,RI,Triangle,present,occuring right now
2/21/08 18:00,Providence,RI,Other,10 seconds,Object shaped like a backslash (\) zoomed across downtown Providence sky.
1/7/08 06:30,Cranston,RI,Circle,4minutes,round golden glowing orb with spike shaped projections
