date_time,city,state,shape,duration,summary
5/5/21 20:30,Cumberland,RI,Fireball,2-3 minutes,3 yellow/orange fireball like lights traveling silently and following each other.
3/30/21 20:42,Newport,RI,Unknown,10:59,(I HAVE ALL OF THIS ON VIDEO. 11 MINUTES) A &quot;light&quot; appeared in the night sky seemingly out of nowhere in the distance. I've
3/5/21 12:00,Ashaway,RI,Cigar,2-3 minutes,I was on 216 headed twords RT 3 I saw a metal tick tack shaped object. I lost it's view because of the tree line. I turned right into
2/20/21 22:00,Newport,RI,Disk,2-3 minutes,Hovering Saucer with 3 blue/white thruster looking lights. large and undeniably visible.
11/29/20 21:51,Providence,RI,Circle,2 minutes,November 29th 2020 9:50pm I changed our names in my report for privacies sake I was laying in bed after walking my girlfriend to her
10/19/20 22:44,North Providence,RI,Oval,5 seconds,I was in my yard looking up at the sky. Smoking a cigarette. Above the Treeline above 146north. I definitely saw a glowing orb with a t
10/9/20 19:10,South Kingstown,RI,Light,4 minutes,Tiny red object ejects small white light
9/28/20 21:00,East Providence,RI,Circle,2 minutes,Outside on the back porch at night when I saw something in the sky. Object was circular with red panels on the bottom that looked like
9/1/20 15:00,North Providence,RI,Egg,Home,I don’t even know where or how to start this ... I just got back home with my daughter who at the time was 4 . It was sunny and pretty
8/29/20 03:00,Westerly,RI,Other,10 seconds,Star Shaped Fast-Flying Object.
8/25/20 19:35,Pawtucket,RI,Other,2 mins 45 secs,White ball of light/orb flying silently.
8/14/20 04:30,North Providence,RI,Formation,15 seconds,I saw six small star like orbs In a line slowly moving across the sky fading off one by one. ((Starlink satellites?))
8/9/20 21:20,Smithfield,RI,Sphere,1 minute,I was on my motorcycle riding west bound on log road. The night was clear and I saw two very bright orange orbs above me. I pulled into
8/5/20 04:00,Warwick,RI,Circle,30 minutes,At 4:00 am we observed a bright moon like object that darted around in the sky and enlarged in burst like activity and then reduced is
8/1/20 21:15,Woonsocket,RI,Light,4 minutes,I went outside to bring my cat out and there was a Bright light with a small light following it about 10 feet behind[ the perspective i
6/28/20 23:00,Jamestown,RI,Light,1hr+,6 plus people witness a bright light .oving in strange directions
6/23/20 14:51,Jamestown,RI,,,MADAR Node 43
6/11/20 23:00,Westerly,RI,Cross,4 seconds,I saw a weird star-like thing and another weird thing with rainbow-lights and I think the aliens know me.
6/4/20 02:30,Narragansett,RI,Disk,13 seconds,I was with my cousin and dad and we’re all fishing and I hear my dad yell “holy shit p*** turn around” and I turn around to see a disc
5/2/20 09:00,Jamestown,RI,Circle,2+ hours,10 to 15 orbs flying in same direction one after the other never swaying from the path of the one in frony ((Starlink satellites?))
4/23/20 01:00,Pawtucket,RI,Light,1-3 hours,Pawtucket RI/Attleboro MA line. Two lights one being bright moving very slowly along tree line. To the NE closer prox drone w/ light
4/16/20 20:55,Westerly,RI,Light,7 minutes,Fast light being followed by helicopter darting all over the place.
3/27/20 19:23,Richmond,RI,Sphere,5 minutes,Extremely bright orange object similar to Chinese lantern flying at rate of speed similar to aircraft in a straight trajectory from Nor
3/17/20 20:58,Woonsocket,RI,Cross,Going on an hour still th,It started around 850pm and i was sitting eating dinner. ((UFORC Note: Venus? PD))
2/24/20 05:30,Charlestown,RI,Light,2-3 minutes,Light moving at a high rate of speed.
2/23/20 01:00,North Kingstown,RI,Light,5 seconds,The object was a big ball of light and above the road. I saw this same object with a friend driving in north smithfield a different par
2/21/20 13:20,South Kingstown,RI,Other,5 minutes,Strange looking 'plane' flies low from ocean northward
1/24/20 02:00,Pawtucket,RI,Circle,,I saw a flying saucer outside of a retail company but that was not the first a few years ago
1/22/20 17:45,Warren,RI,Egg,19:00,Upside down egg shaped glowing object with blue whispy tail and red blinking orbs.
1/8/20 01:00,Seekonk/Pawtucket Line,RI,Unknown,1-2 minutes,Large circular lights hoovering above golf course
12/31/19 19:18,North Kingstown,RI,Other,2 minutes,Fast amazing lights in the shape of a dart craft fast and jagged path and disappeared quickly heading East
12/24/19 22:38,North Providence,RI,Fireball,3 minutes,3 balls of light exact same distance apart and exact same speed.
12/24/19 09:30,Warwick,RI,Light,,We are not alone!!
12/19/19 06:45,Cranston,RI,Fireball,1 to 2 min,I was driving to work and i saw a ball of fire falling from the sky in the far distance. At first i thought &quot;WOW&quot; a shooting
12/19/19 06:15,Coventry,RI,Oval,2 minutes,Strange lights sighted above tree line just before sunrise
11/26/19 05:22,Woonsocket (North Smithfield),RI,Other,10,Square aircraft with lights hovering
11/14/19 20:20,East Greenwich,RI,Circle,4 minutes,Was driving on highway and looked up to see two orbs glowing a greenish white flying back and forth across the sky.
10/24/19 22:31,Warren,RI,Sphere,10 seconds,softball sized white orb moving very fast.
10/6/19 05:08,Central Falls,RI,Light,4 minutes,4 star like circles together. 3 of the objects started moving away in a straight line at very high speeds. The 4th light moved slowly i
9/23/19 02:40,Warwick,RI,Light,4 seconds,Band of dim light moving across sky. ((anonymous report))
9/13/19 21:37,East Greenwich,RI,Unknown,4 seconds,Super fast circular object zipped across the night sky
9/1/19 02:00,North Providence,RI,Circle,1 minute,On Sunday 9/1/19 approximately 2:00am I was driving home on 146 north (not far past providence) I saw 12-15 round bright orange ligh
8/21/19 07:08,West Warwick,RI,Cigar,,Very loud and it was slow. ((anonymous report))
8/5/19 14:00,Charlestown,RI,Chevron,30 seconds,Very unusual extreme chevron-shaped aircraft observed mid-afternoon clear sky flying west overhead East Beach Charlestown RI
8/3/19 21:30,Woonsocket,RI,Circle,10-15 seconds,Flew over screen two at Rustic Drive In. Looked up over Toy Story on screen and saw a steady moving white dot with no flashing lights.
7/28/19 01:15,Foster,RI,Sphere,2 minutes,Foster/Scituate UFO/UAP
7/25/19 11:30,Warwick,RI,Triangle,5 minutes,first I saw a meteorite immediately after noticed a bright light in the sky. at first I thought it was the moon because of how bright
7/24/19 23:00,Middletown,RI,Flash,5 seconds,Sitting at second beach and we witnessed a large green flash shoot across the sky in close proximity.
7/15/19 01:00,South Kingstown,RI,Unknown,4 minutes,Two sets of bright white lights low in the sky over farm fields in Matunuck Beach RI
7/15/19 00:45,Cranston,RI,Other,3 to 5 secs,Object appears moves and disappears.
7/6/19 22:13,New Shoreham,RI,Disk,2 seconds,My husband and I were sitting outside the Atlantic Inn on Block Island New Shoreham Rhode Island at 10:13 PM on Saturday July 6 20
6/22/19 15:00,North Smithfield,RI,Sphere,2 minutes,Shiny sphere sighted over N. Smithfield farm.
5/25/19 12:00,Cranston,RI,Circle,10-15 seconds,Circular looking UFO comes out of a chemtrail line after plane sprays over my house may 25 12:02 PM 2019
5/19/19 15:00,Forestdale,RI,Sphere,20 seconds,Was standing in my back yard taking pictures of birds and happened to look up and see a semi transparent white sphere moving silently a
5/19/19 15:00,Forestdale,RI,Sphere,20 seconds,Was standing in my back yard taking pictures of birds and happened to look up and see a semi transparent white sphere moving silently a
5/18/19 21:30,Warwick,RI,Light,1 minute,Light spotted from my deck! Last night i went out on my deck to cover my grill. I was looking up at the moon due to it was
5/18/19 21:30,Warwick,RI,Light,1 minute,Summary - light spotted from my deck! Last night i went out on my deck to cover my grill. I was looking up at the moon due to it was
3/27/19 20:37,Scituate,RI,Cigar,20 seconds,I saw what seemed to be a cigar shaped obj. glowing brightly zoom across my home then fly across the sky again. ((anonymous report))
3/16/19 20:50,Cranston,RI,Sphere,10 seconds,orange spheres moving side by side over rhode island
2/9/19 02:55,Johnston,RI,Triangle,10 minutes,Triangle aircraft moving in various patterns across the sky with pulsating lights. ((anonymous report))
1/26/19 15:58,Cranston,RI,Other,1 minute,Heading towards work in a Uber i silently sat in the backseat of the car. I notice a plane which seems low but nothing alarming. Its wo
1/21/19 21:48,Narragansett,RI,Light,1 minute,The light was stationary and bright yellow somewhere over the ocean between Narragansett and block island. It disappeared within a minu
1/16/19 17:30,Wakefield,RI,Light,10 seconds,The object was moving low across the sky west to east across route 1. It was a rather large blue/greenish light that glowed for several
1/5/19 01:30,Rumford,RI,Unknown,Constant,Located in the southern night sky is a total of four illuminated objects
12/17/18 02:00,Tiverton,RI,Diamond,10 minutes,Red lights along outer edge diamond shape. ((anonymous reports))
11/28/18 09:56,Providence,RI,Disk,3 minutes,Reddish blueish disk flying by my window slowly.
10/5/18 21:00,Tiverton,RI,Diamond,none,Lights were coming down int a point from both sides of the craft.
9/20/18 18:30,Foster,RI,Other,5-8 seconds,Object moving SE with 2 flaming engines before disappearing.
9/1/18 22:42,Warwick,RI,Fireball,3-5 minutes,Red/orange pulsating orb moving steady slow and low altitude traveling SE to NE
8/8/18 21:30,Bradford,RI,Circle,3 minutes,Whitish/Circular Object.
8/3/18 01:30,Providence,RI,Disk,1 minutes,gray dark gray in color slowing moving across sky rotated and turned I could see some type of shining. ((anonymous report))
7/22/18 11:30,Johnston,RI,Other,<1 minute,~11:30 am 4 loud booms in the sky shook the house.
7/21/18 03:25,Cranston,RI,Circle,3 minutes,Bright shimmering circular disk/orb seen and videoed as it crossed central Rhode Island.
7/18/18 18:05,Warwick,RI,Sphere,15 minutes,Three orange balls of light traveled past the backyard. ((anonymous report))
7/17/18 03:00,Barrington,RI,Oval,1 minute,Two witnesses see a star-shaped UFO on Fathers Day which appeared responsive.
6/4/18 01:00,South Kingstown,RI,Disk,8 minutes,Disk shaped ship four big bright lights on the bottom followed me
5/8/18 05:10,Newport,RI,Cigar,15 minutes,Cigar-shaped object uncertain of color had white green & red counter-clockwise traveling lights moving slowly at daybreak.
4/6/18 19:15,South Kingstown,RI,Light,10 seconds,Star like object gives sudden bright flash.
3/12/18 23:00,Cumberland,RI,Unknown,>30 minutes,Tonight Sunday 3/11at 11pm there were about 12 to 15 drones(white and red lights) in the southern sky flying pretty high in the air. Mo
2/18/18 18:15,Warwick,RI,Cigar,2 minutes,Cigar shaped craft captured in photo off the coast of Oakland Beach RI
2/10/18 03:43,Westerly,RI,Other,2-3 seconds,Loud Boom!!!!!! Shook my bed house -woke me up out of sleep.
1/7/18 23:30,Warwick,RI,Changing,5 seconds,An orange glowing crescent that shrunk until it was just a dot and then vanished. ((anonymous report))
11/11/17 21:00,Warren,RI,Diamond,3,Triangular diamond shape with red and green lights and bright bright lights in the center could see holdcraft was right above my head.
10/27/17 21:02,South Kingstown,RI,Light,30 seconds,Bright silvery-white light/object smoothly and silently traverses the night sky.
10/18/17 18:00,Providence,RI,Other,~10 minutes,On 10/18/17 At about 6 p.m. I observed 4 unidentified air crafts in the sky that were flying over under and around eachother and also
10/10/17 02:00,Cumberland,RI,Light,2:45,Hovering and flashing light in night sky seen for 45 minutes. ((NUFORC Note: Cappella or Venus? PD))
10/10/17 02:00,Cumberland,RI,Light,2:45,Hovering and flashing light in night sky seen for 45 minutes.
10/5/17 21:25,Scituate,RI,Rectangle,1 minute+,Massive rectangle-shaped craft. ((anonymous report))
9/26/17 20:45,Cranston,RI,Circle,45 seconds,red slow moving object in W sky. moved slowly. red glow slowly deminished until gone. ((anonymous report))
9/13/17 14:00,Charlestown,RI,Other,10 seconds,Odd 'jet liners' with bright lights fade into thin air.
9/2/17 02:13,Greenville,RI,Light,1-2 minutes,2 crafts in the sky with lights like a strobe flying around and above and below each other.
8/25/17 09:38,Pawtucket,RI,Light,10 seconds,Staring at this bright flickering star in the sky; behind the star appeared a slightly smaller brightly lit orb. ((anonymous report))
8/17/17 21:02,Smithfield,RI,Light,30-45 seconds,2 circle shape lights almost like strobe lights moving around one another. As soon as I got my phone out to video it was almost like t
8/16/17 22:00,Warwick,RI,Other,2/3 minutes,A triangle/square object with 3 huge lights at front sat in place and hovered for a few moments and then changed direction from N.
8/16/17 10:00,Coventry,RI,Other,2/3 minutes,Heading south on 95 saw 3 huge lights in a row in the sky heading towards us n then hovers for a bit n then moved NWt with turning.
8/10/17 22:30,Narraganssett,RI,Formation,1 minute,Sighted Thursday August 10th about 9:30 PM near Port Judith lighthouse 4 bright lights spread very far apart reddish in color.
8/3/17 21:30,West Warwick,RI,Unknown,45 minutes,Jet-like roaring craft over Rhode Island...no true explanation from media.
7/27/17 20:55,Warwick,RI,Disk,3 minutes,saw disk like object circling around area for about couple minutes  i thought i was a plain but when it came into view it looked like
7/26/17 21:35,South Kingstown,RI,Light,10 seconds,Extremely bright light hanging motionless 1000 ft up.
7/20/17 04:35,Cumberland,RI,Flash,4 seconds,There were a total of 4 flashes each 1 second apart the sighting lasted only 4 seconds.
6/24/17 03:15,South Kingstown,RI,Light,4 seconds,Bright white light slowly and briefly travels part of the night sky.
4/18/17 22:00,Warren,RI,Triangle,30 seconds,((HOAX??)) Triangular moving quickly over Warren RI and turned around when it was spotted.
4/18/17 22:00,Warren,RI,Triangle,30 seconds,Triangular moving quickly over Warren RI and turned around when it was spotted.
4/10/17 19:15,South Kingstown,RI,Light,2 minutes,Star-like object moves slowly across the sky until changing shape and fading out.
4/8/17 22:00,Providence,RI,Disk,3:00,White disk that moved dimmed and flashed green and red lights until disappearing.
4/2/17 22:00,Middletown,RI,Light,7-8 seconds,Two dim circular lights following one another about 100 feet above the tree line. Moving faster than an airplane.
3/25/17 22:15,Newport,RI,Circle,15 seconds,Bright orange ball in western sky. Then disappeared. Near Orion's belt.
3/20/17 21:30,Cranston,RI,Light,7-8 seconds,Two lights moving faster than an airplane. ((anonymous report))
2/3/17 01:00,Bristol,RI,Triangle,5 seconds,The object appeared as three white lights and when going to look at the lights they moved so fast they appeared as white lines across t
1/13/17 06:15,Rumford,RI,Light,10 seconds,1/13/17 6:15 AM 3 extremely bright &quot; stars&quot; that appeared shone with a bright flash and blinked off east of the Big Dipp
1/1/17 17:45,Rumford,RI,Other,Continuous,Large star-like object with pointed spikes like green light-sabers that come and go. To L of moon. ((NUFORC Note: Venus? PD))
12/30/16 02:39,Providence,RI,Light,10 minutes,About 2:40 am and looked up in the sky and rite above my house was 10/12 what looked like stars. ((anonymous report))
12/24/16 16:45,Providence,RI,Circle,15 seconds,A very large dim milky-white round object resembling a full moon situated next to and on the left side of the sun.
11/28/16 18:00,Seekonk (general area),RI,Circle,3-4 seconds,White circular shaped object flying about 300 feet traveling more than 200 MPH!
11/5/16 19:35,Charlestown,RI,Light,30 seconds,Basketball size yellowish light crosses my field of vision near rural road intersecion.
10/16/16 19:35,South Kingstown,RI,Light,4 minutes,Very bright non-blinking bluish-white soundless light travels slowly NW to SE in clear night sky then fades out to nothing.
9/26/16 23:26,Providence,RI,Unknown,3 seconds,Extremely fast (hypersonic+) aircraft (UFO) captured on Live TV over Providence RI....Please Help me ID this thing.
9/22/16 19:00,Woonsocket,RI,Circle,30 seconds,Red flashing object.
9/7/16 09:23,Portsmouth,RI,Fireball,2 minutes,A strange bright red light much bigger than a plane or satalite lit up hugely and bright then just dissapred into the night. It looked
9/3/16 21:30,Smithfield,RI,Light,Few seconds,Four to five glowing red lights slowly moving south while maintaining a triangle formation.
8/23/16 21:30,East Providence,RI,Light,2 minutes,For ~2 mins. a low lying bright amber covered light hovered in the sky and disappeared without moving and in the area of a/c.
8/16/16 05:30,Providence,RI,Circle,10 minute,Red circular object moving quickly then stops and hovers over Providence RI changes colors and then disappears.
8/16/16 05:30,Providence,RI,Circle,5 minutes,Red orb moving quickly then stops multiple times over Providence RI.
8/12/16 01:00,Lincoln,RI,Triangle,20 minutes,Observed Bizarre UFO Hovering over Trees-Lake- & then Flew right over our head while watching the meteor shower.
8/11/16 23:00,Woonsocket,RI,Changing,25 minutes,I have had more then 20 sightings for the past year.This sighting that occured was the most frightening.I was looking out of my window
8/11/16 22:00,North Providence,RI,Light,10 seconds,A bright light moving zig-zag formation. Not like a satellite or airplane that moves straight. Then disappeared. ((anonymous report))
7/25/16 17:30,Providence (Olneyville),RI,Other,2 minutes,Walked out with dog and observed a dark craft overhead. No lights. Thought it could be a drone but too large.
7/24/16 12:20,Galilee,RI,Light,Seconds,E of Galilee we saw this orange colored light low in the sky it went to the R then L then R then straight away.((anonynous report))
7/23/16 17:54,Bristol,RI,Rectangle,3 minutes,Bright reflective yellowish rectangular object larger than a plane.
7/21/16 10:30,South Kingstown,RI,Unknown,10 minutes,Sickly sweet smell permeates the air with no discernible cause. My dog's barking was an alert.
7/5/16 21:46,Portsmouth,RI,Diamond,continuous,At least 4 kite-shaped bright stationary objects over Portsmouth RI.
7/3/16 22:15,Cranston,RI,Oval,15 minutes,Four bright orange orbs drifted in the Eastern sky over CranstonRI at 10:15 pm on July 3rd.
7/2/16 22:15,Warwick,RI,Circle,10 minutes,Red spherical light with green moving light and no white light.
6/25/16 21:23,Cranston,RI,Cylinder,5 minutes,Orange fiery cylinder traveling slowly across the night sky. ((anonymous report)) ((NUFORC Note: Possible airliner in Sun? PD))
6/22/16 22:00,Riverside,RI,Circle,3 minutes,I saw a small red lighted ball in the clear night sky for approximately 3 minutes. I was able to take 3 photos of it. No sound.
6/11/16 01:00,Cranston,RI,Light,15 minutes,Nine bright orange orbs drifted over Cranston RI.
6/1/16 00:52,West Greenwich,RI,Light,2 minutes,Bright light in sky seen by two sisters over East Greenwich RI
4/28/16 22:00,Woonsocket,RI,Oval,Few seconds,Unexplainable logic in what I saw.
4/27/16 14:45,South Kingstown,RI,Unknown,2 minutes,Small gold spinning star-like object above electrical wires
4/15/16 15:35,South Kingston,RI,Rectangle,5 minutes,Orb Jane rectangLe craft in sky.
3/11/16 00:35,East Greenwich,RI,Disk,15 minutes,I followed a bright orange light as I was driving it started veering off behind a neighborhood and looked as if it was landing.
3/6/16 17:00,North Providence,RI,Disk,45 seconds,2 bright metallic disc objects with a dark underside were flying in unison in a circular pattern high in the sky at 5:00 pm.
3/2/16 23:00,Lincoln,RI,Light,10 seconds,Waiting in a empty parking lot with my freind in his car I observed a blue and white light appear out of pitch black sky and completely
1/10/16 22:30,Ocala,RI,Diamond,2-3 minutes,I walk my dogs every night about 10:30 or 11:00. A COUPLE MONTHS AGO i spotted two diamond shaped objects in the WestNorthWest sky.Abo
12/24/15 23:00,Cranston,RI,Oval,3 minutes,As soon as I exit the Walgreens on Broad. St My attention is immediately captured by a very bright very low hovering light. The light
11/27/15 20:40,Middletown,RI,Teardrop,1 minute,Looking out my patio sliding glass door in a southerly direction I saw three oblong football shaped objects slowly flying NE.
11/26/15 18:00,Woonsocket,RI,Rectangle,4-5 seconds,Green falling fireball.
11/21/15 16:20,Tiverton,RI,Circle,5 minutes,Different color flashing object seen from RT 24
11/18/15 16:00,Hope Valley,RI,Other,30 seconds,Dome shaped object.
11/17/15 20:00,Warwick,RI,Light,5 minutes,((HOAX?? Date is flawed; contact information defective.)) saw a round ball of light moving slowly then disappeared
11/5/15 16:30,Tiverton,RI,Fireball,45 minutes,5 oblong shaped fireballs seen in the sky over Tiverton Middletown RI 11-5-2015.
11/4/15 09:02,North Smithfield,RI,Other,35-50 seconds,Watching 2 sets of lights in sky when the 1st set flashed became one single light & shot straight to the ground.
11/2/15 23:15,North Kingstown,RI,Other,10 minutes,Sphere shaped object with red striped lights in back and white lights Flashing around the sphere;flying towards Quonset.
10/16/15 20:00,Cumberland,RI,Light,3-4 seconds,I saw a bright light off in the distance in MA to my right come out of nowhere from the sky and shoot down toward earth at an extreme
10/10/15 20:00,Warwick,RI,Unknown,2-3 minutes,We saw two slow moving triangle formations.
10/10/15 15:45,North Smithfield,RI,Sphere,40-60 seconds,Walked outside to garage immediately caught my eye sphere shape. Thought it was balloons at 1st because the way Sun was hitting it. Wa
10/6/15 20:00,East Providence,RI,Light,2-3 seconds,Fast green light.
9/28/15 17:00,Smithfield,RI,Rectangle,30 seconds,Driving home from work I saw a very large craft clear as day. It looked like it was put together by leggo blocks. It had no wings.
9/27/15 22:00,Narragansett,RI,Teardrop,2-3 minutes,Gold teardrop lunar eclipse 9/27/2015 Narragansett RI.
9/27/15 21:30,Narragansett,RI,Sphere,2-3 minutes,Gold Orb Sphere Lunar Eclipse Narragansett RI.
9/26/15 21:50,Pawtucket,RI,Formation,20 min,Orange lights ufo seen In Rhode Island.
9/26/15 21:35,Pawtucket,RI,Formation,15 minutes,Series of yellow orbs w/red outer glows moved from N. to W. in single file dimmed to red then fizzled out sequentially.
9/19/15 18:15,Block Island,RI,Circle,10-15 seconds,While swimming we witnessed a pink circular craft float across sky and drop down into the ocean.
9/14/15 23:45,North Providence,RI,Circle,3 seconds,Bright light moving very fast in a pointed direction across the sky.
9/12/15 00:00,Warwick,RI,Light,10 minutes,2 lights in the sky disappeared and came back super bright before vanishing
9/11/15 18:45,East Providence,RI,Formation,2 minute,3 shimmering constant yellow lights moving across the sky changing configuration as they flew. One broke off left and up and flew out
9/11/15 18:30,Westerly,RI,Other,10 minutes,Hundreds of thousands of tiny white shimmery dots converging into clusters and going up into the sky. Lasted about 10 minutes.
9/9/15 18:30,Middletown,RI,Cylinder,10 seconds,Silver cylinder shaped object moving super fast from north to south followed by another identical object a minute or so after the first
9/8/15 10:00,Providence,RI,Disk,10 minutes,Saw a disc shaped ufo with a green glow with green and red flashing lights hovering slowly over the Providence River Bay area
9/5/15 23:00,Warwick,RI,Changing,4 hours,Every night I see a bright light star shape thing move across the sky. But last night was different. This one I watched for 4 hours.
8/25/15 21:00,Woonsocket,RI,Diamond,2 minutes,Flying low no sound lights flash in a diamond shape.moved from side to side then hoverd for a minute then took off
8/11/15 06:05,Cumberland,RI,Light,25 seconds,Morning UFO over Cumberland RI.
8/8/15 01:15,Groton Long Point,RI,Circle,20 minutes,Bright lime a star small moved fast then hovered.
8/2/15 18:40,Warwick,RI,Sphere,10 seconds,Bright reddish/orange self-illuminated sphere rising up from Warwick Pond in Warwick Rhode Island.
7/29/15 21:00,Bristol,RI,Sphere,30 seconds,Three purple/red objects with strobe traveling SE to ENE.
7/25/15 00:48,East Providence,RI,Fireball,3 minutes,Red and blue light UFO over Cranston Rhode Island landing vertically in Narragansett Bay.
7/17/15 00:00,Exeter,RI,Circle,5 minutes,((HOAX??)) A blue orb went down the street-a few minutes later it was seen flying past a house window.
7/12/15 22:00,Narragansett,RI,Fireball,5-10 minutes,Extremely bright reddish orange pod/egg-shaped obj. moving NE over Narragansett Bay near Ocean Rd; followed coast then E.
7/4/15 22:00,Johnston,RI,Fireball,20 minutes,10-12 single line formation yellowish/orange spheres flying overhead into the clouds then disappearing one by one.
7/4/15 21:00,Providence,RI,Formation,5-7 minutes,8 disc shaped crafts w/4 or 5 orange lights...they made no noise whatsoever and they should have if they were produced on this planet.
7/3/15 21:30,Pawtucket,RI,Light,~30 minutes,Possible UFO or military aircraft above McCoy Stadium after the Pawtucket Red Sox - Scranton Willkes-Barre Rail Riders baseball game.
6/26/15 01:05,Coventry,RI,Other,20 seconds,Driving down I-95 S coming home from a friend's passing exit 6a I took a picture with my phone of the moon because it was eluminingat
6/24/15 09:46,Providence,RI,Light,5 minutes,I seen a bright blue light that seemed to get dim then glow red then started moving at a slow pace then 2 other pulsating lights coming
