date_time,city,state,shape,duration,summary
8/30/03 12:30,Knoxville,TN,Triangle,45 to 60 sec,MY FRIEND AND HAD JUST FINISHED CUTTING THE LAWN WHEN THE SUN WINKED OUT THATS THE WAY IT SEEMED THEN WE SAW THREE CRAFT MOVING SOUTH W
8/22/03 20:10,Antioch,TN,Unknown,approx. 20 min.,Four lights circling inside storm cloud
8/9/03 23:00,Nashville,TN,Unknown,1 hour,ON 8/9/03 I OBSERVED AN OBJECT IN THE DISTINT NIGHT SKY. AT FIRST I THOUGHT IT WAS A STARBUT THEY WERE NO OTHER STARS IN THE NIGHT SKY
8/2/03 19:45,Bristol,TN,Disk,15 minutes,Videotaped disc shaped craft in broad daylight
8/2/03 01:00,Waverly,TN,Other,20 minutes,the greatest light show of my life!!!
7/26/03 19:45,Bristol,TN,,,Peter your show with Art Bell 17 Jan. The tape of the UFO that is on your web site needs to be reviewed again & again. Perhaps someone
7/23/03 06:30,Memphis (near),TN,Unknown,Unknown,Possible sighting associated with a strong storm
7/11/03 19:12,Spring Hill,TN,Oval,5-10 seconds,Whitish-silvery oval shaped object appeared in the sky NW of Spring Hill TN at 19:12pm
7/9/03 21:30,Sweetwater,TN,Light,Approx. 1.5 hours,Brilliant red-orange light that could maneuver unlike any human aircraft...
7/9/03 00:30,Westmoreland,TN,Triangle,10-12 minutes,Huge triangle with white lights over Tennessee Kentucky Border
7/3/03 22:47,Benton,TN,Circle,5 MINUTES,HUGE RED ORANGE CRAFT
6/30/03 17:00,Nashville,TN,Triangle,4 minutes,I have pictures
6/15/03 21:30,Manchester,TN,Triangle,3 mins,slow erie green craft
6/15/03 19:00,Manchester,TN,Disk,45 min-1 hour,Another (belated but discovered) Bonaroo witness. Science Major SKEPTIC
6/15/03 02:00,Manchester,TN,Light,45 min,"My girlfriend and I saw an object that resembled a moving ""star"" for about 45 minutes."
6/13/03 23:00,Springfield,TN,Sphere,30 seconds,Winesssed Glowing white/blue neon sphere and aliens in field while camping with my buddy.
6/10/03 03:15,Signal Mtn,TN,Formation,about 5 min,I was out in my drive way about 3;15 AM as I could not sleep. It was clear and the stars were brite. looking toward the southwest I saw
6/9/03 22:00,Hixson,TN,Triangle,2-3 minutes,wish i didn't hesitate on getting my camara.
6/8/03 19:00,La Vergne,TN,Disk,1 second,Picture of a UFO while taking pictures of the sky?
6/7/03 22:15,Culleoka,TN,Unknown,30 min,Objects with solid lights moving towards one another.
6/5/03 21:00,Ardmore,TN,Egg,30 to 45 minutes,HBCCUFO CANADIAN REPORT: Hovering egg shaped object.
6/5/03 00:15,Dandridge,TN,Oval,20- 30 sec.,the object was oval shaped and was silver.
6/1/03 15:00,Nashville,TN,Rectangle,10 - 15 secs.,Only saw object for a couple of seconds. White. square no reflection.
5/24/03 23:00,Jackson,TN,Light,unknown,Observation of four unexplained lights rotating in the sky.
5/14/03 02:00,Memphis,TN,Formation,4 minutes,One large craft with a red light released six others. The crafts hovered for several minutes then disappeared.
5/13/03 23:30,Columbia,TN,Unknown,,bright light seen across feild
4/29/03 03:30,Knoxville,TN,Sphere,1 minute,round object with rotating outer ring.evenly lighted moving slowly
4/27/03 20:30,Quebeck,TN,Oval,5MINS,oval with orange lights with balls shooting off of it
4/7/03 14:30,Franklin,TN,Disk,7 Seconds,My family and I were driving home from a grocery store when I saw an U.F.O. out the side window.
3/15/03 20:30,Smyrna,TN,Light,3hrs,Bright light in SW sky colors flashed in full spectrum rapidly like a police light but included every color in rainbow RGB colors
3/15/03 10:32,Nashville,TN,Circle,2 Hours,Circle formations in Clouds above Nashville TN.
3/7/03 21:40,Morristown,TN,Circle,about a 30 sec,1 was driving on hwy 160 on my way to work when all of sudden this green ball of light look like it was about the size of the moon app
12/30/02 17:00,Hendersonville,TN,Disk,2 minutes,the red lights
12/15/02 20:00,Monterey,TN,Circle,1 min,Circular object with red green and white lights about 100 feet above the trees
11/29/02 22:00,Cordova (a suburb of Memphis),TN,Unknown,a while until they retrie,A blue ball falls out of the sky in Cordova Tennessee on Friday 29 in November.
11/23/02 16:15,Gallatin,TN,Unknown,a few seconds,Disappearing object seen as light glints off of it
11/23/02 16:15,Gallatin,TN,Unknown,a few seconds,My daughter and I were traveling to Goodlettsville from Gallatin between 4:00 and 4:30 pm. We were just about to get on Vietnam Vets Pa
11/17/02 03:00,Knoxville,TN,Fireball,20 minutes,I saw balls of fire coming from the sky.
11/14/02 23:20,Chapel Hill,TN,Circle,northeast,The 2 objescts attracted 2 more. it was realy cloudy couldnt make out what they were but there was bright lights very strange.
11/11/02 15:30,Chattanooga,TN,Other,30 sec,canard wing craft
10/16/02 16:05,Germantown,TN,Disk,,Saucers in collision?
10/5/02 15:00,Gatlinburg,TN,Disk,???,Four of us were vacationing in Gatlinburg TN last week. We were at Ober Gatlinburg and after lunch we went outside to look around. I
10/3/02 15:35,Smithville,TN,Unknown,,IT WASA WHITE DOT WATCHING ME.
9/27/02 19:51,Memphis,TN,Light,20 SECS.,The international space station was being followed by another vehicle of sorts.
9/22/02 16:40,Germantown,TN,Sphere,8 seconds,Object containing connected spheres photographed in the western sky in daylight near faint clouds.
9/20/02 21:00,Gray/Johnson City,TN,Formation,10 minutes,Reported to me that 4 objects in the clouds hovering and making sharp erratic movements for a several minutes.
9/18/02 18:46,Germantown,TN,Cylinder,4 SECONDS,Silver cylinder with bulbous ends appeared for four seconds near clouds in daylight and was photographed.
9/12/02 20:35,Memphis,TN,Sphere,time is 9:00pm and still,This bright light (like a star) is being seen in the southwest portion of the sky. There is a little haze out tonight but as soon as t
9/8/02 19:10,Germantown,TN,Disk,4 SECONDS,OBSERVED UFO FALLING FROM CLOUD AND OBTAINED PHOTO
9/7/02 20:30,Mt. Juliet (near Nashville),TN,Light,5 seconds,large red lights hovered above dark field then in the sky looked like star w/red-twinkling lights saw space-ship thru binoculars
8/24/02 12:00,Sparta,TN,Circle,3 minutes,Message: beauty of the flesh creates power this is aliens addiction and our mystery why we are alone.
8/21/02 05:30,Lebanon,TN,Triangle,5 minutes,Two triangular shaped craft hovering over power lines.
8/20/02 23:59,Milan,TN,Light,1 hour,A large dull light the color of the sun when it sets with a brite red flashing light that rotated around it. The object hovered for one
8/15/02 23:38,Knoxville,TN,Light,5 minutes,unbelievable
8/14/02 15:01,Bristol,TN,Other,20 min,Boomerang shape in daylight
8/9/02 21:00,Kingsport,TN,Light,1 hour and 30 minutes,Flashing lights moving across sky in northern direction.
8/7/02 23:05,Murfreesboro,TN,Triangle,Unknown,Unidentified craft seen after power interuption at home.
8/1/02 19:00,Nashville,TN,Circle,2 sec.,Obsorbing black bubbular object off airliner bow at takeoff in Nashville Tn.
7/22/02 19:45,LaVergne,TN,Circle,10 MINUTES,ENORMOUS SIZE CRAFT OBSERVED DISSAPPEARING BEHIND THE MOON !!
7/19/02 19:50,Nashville,TN,Changing,10 minutes,Star-like ovoid with revolving object seen before dark separates approached by two triangular objects; disappears.
7/16/02 21:00,Shelbyville,TN,Triangle,about 45 minutes,My friend had been saying for the last week that he had seen the object in the sky but ofcourse knowone believed him. Until last night
7/13/02 02:24,Memphis,TN,Chevron,~1 minute,It was a glowing dull yellow/green silent three dimensional horizontal triangle. with verticle cylinders on the end.
7/9/02 22:09,Strawberry Plains,TN,Unknown,out of view,3 stationary objects 2 looked like stars 1 looked like planet all moved within 10 minutes of me watching.
7/4/02 02:00,Cumberland,TN,Circle,2 minutes,No lights no noise just floating through the sky. We wouldn't have seen it if it weren't for all the clouds that were out that night
6/9/02 20:30,Nashville,TN,Unknown,1-10 minutes,unusual overhead occurence while on family walk.
6/5/02 19:30,Oak Ridge,TN,Sphere,30 minutes,Dark sphere hanging in the sky just before sunset.
6/3/02 22:00,Old Hickory,TN,Sphere,a few minutes,round light
5/30/02 22:48,Clinton,TN,Flash,1 second,The green light moved across the sky very rapidly. Was very bright.
5/30/02 22:30,Sevierville,TN,Triangle,5 minutes,We saw eight triangle shaped ships and felt wind off the first four but heard nothing.
4/22/02 21:30,Primm Springs,TN,Light,2-3 seconds,Myself and two witnesses observed a light not a meteor moving at low altitude across the sky; its duration was no more than three sec
4/12/02 20:40,Lynnville,TN,Light,3 minutes,fast bright white burn of light unbeliveable 90 degree turns
3/23/02 02:32,Nashville (near),TN,Circle,5 minutes,I was driving home from Missouri to Florida..near Nashville TN at 2:32 in the morning I saw a large circular craft in the sky. At fir
3/19/02 14:06,Franklin,TN,Chevron,45 min.,Wavey object in the sky
3/19/02 14:00,Nashville,TN,Disk,seconds,Nashville TN near airport
3/15/02 20:45,Old Hickory,TN,Diamond,few seconds,It was a black diamond/kite shaped craft.
3/7/02 09:30,Roellen-Dyersburg area,TN,Unknown,about 10 minutes,red and green lights that were convex shaped couldn't make out the shape of it it was small enough to be beside a house and over trees
2/26/02 05:00,Knoxville,TN,Unknown,45 seconds,A strange noise scared the shit out of me and I would like to know why these beings picked me.
2/15/02 07:15,Elizabethton,TN,Unknown,still there,strangestthing I ever saw
2/13/02 01:00,Lewisburg,TN,Oval,15 minutes or longer,It was 1:00a.m. on 2/12/02 and 2/13/02 that my husband and I noticed a strange light in the sky. We got our binoculars and looked thr
2/6/02 05:00,Nashville,TN,Disk,,driving from the airport during the day. and saw what I thought was a jet that the sun was reflecting off of. It was really bright that
2/2/02 19:00,Pegram,TN,Light,one hour,Pulsating or rotating stationary lights high in the night sky
1/25/02 20:15,Dover,TN,Other,4 minutes tops,Dropping lights catch the eye.
1/3/02 20:37,Powell,TN,Sphere,,i saw 9 huge lightsangledand just sitting in the sky.
1/3/02 03:30,Eagleville,TN,Sphere,10 minutes,UFO hovers over tree line sending out smaller crafts.
12/26/01 01:45,Nashville,TN,Triangle,about 5 mins,Triangular Craft seen in Nashville Tennessee
12/20/01 19:30,Goodlettsville,TN,Fireball,approx. 10 seconds,slowly arching light brightens into flame then trails into oblivion
11/18/01 04:35,Franklin,TN,Chevron,2 sec,V shaped blurry craft with lights. Extremely fast velocity
11/17/01 21:00,Sewanee,TN,Cylinder,4 seconds,A glowing cylinder
11/17/01 04:30,Tellico Plains,TN,Unknown,30 minutes,On Sat. Nov 17th while viewing the Leonid Meteor shower from a scenic overlook on the Cherohala Skyway outside of Tellico Plains TN
11/14/01 05:35,Memphis,TN,Triangle,2 minutes,Second sighting from the same general ground location though not in the same location in the sky.
11/10/01 14:44,Bristol,TN,Oval,10 minutes,spherical metallic object witt tail on leading edge
11/8/01 18:15,Celina,TN,Light,15 secs,On 11-08-1001 at approx. 1615 hrs. I was looking up in the sky when traveling due North I saw a bright light traveling at an extremely
11/4/01 05:30,Nashville,TN,Light,15 minutes,very large greenish/white very bright diamond shaped object beside what appeared to be a starwhich was much smaller it was daybreak
11/2/01 06:25,Memphis,TN,Changing,seconds,Daylight sighting of a black object moving at high speed below low cloud cover.
10/31/01 08:25,Sevierville,TN,Circle,35seconds,Brillant round craft that hoovered in the morning sky in Tennessee...
10/29/01 19:30,Surgoinsville,TN,Unknown,11:00 pm,Mufon has confirmed sightings here before.
10/28/01 13:00,Memphis,TN,Light,1/2 hour,Star-like object moves slowly and hovers at high altitude over Memphis at mid-day.
10/26/01 09:40,Adams,TN,Disk,2 minutes,Silver disc the width of the jet stream of a jet appeared between two jets heading for each other.
10/21/01 06:30,Murfreesboro,TN,Oval,30 minutes,An oval shaped object with brillant multi colored lights in the north sky not moving.Was very hard to distinguish with my eyes but it w
10/16/01 22:00,Nashville,TN,Chevron,1 minute,"Very clear view of something that was NOT an airplane gliding in the night sky ; a ""v"" like shape with lights"
10/15/01 06:30,Martin,TN,Triangle,Minutes,"Letter ""A"" Shaped Glowing White sharp edged object seen near slivered-moon"
9/22/01 18:01,Murfreesboro,TN,Circle,14 Minutes,Light Orange Sphere
9/12/01 02:00,Dickson,TN,Rectangle,11 sec.,RECTANGLE MIMICED NIGHT SKY & STARS SEEN DURING YR. OF COMET PASSING NEAR EARTH
9/11/01 20:00,Nashville,TN,Triangle,10 minutes,Silent black triangle moving slowly in urban environment
8/18/01 10:13,Savannah,TN,Other,1 1/2 minutes,light flashing on and off in the sky it got fast then it faster and faster until it disappeared.
8/1/01 21:00,Sweetwater,TN,Cone,18,3 bright objects pased by and faded away one-by-one
7/12/01 04:30,Nashville,TN,Oval,30-40 seconds,what i saw was not of this world
6/30/01 21:00,Crestline,TN,Light,60 minutes,Extremely fast light object splits into two after firework show many witnesses.
6/30/01 01:00,Lafollette,TN,Circle,25 sec,Very fast green ball low altitude know trail at all
6/23/01 22:00,Cosby,TN,Fireball,25 seconnds,the objects made animpossible 90 degree turn.
6/20/01 22:00,Hampton,TN,Triangle,15 sec.,it was a triangle it had lights all around it about 15 or 20 lights tney weren't blinking they were like the light you see when you loo
6/17/01 22:20,Bristol,TN,Fireball,2 minutes,brilliant green object going down S.W. of Bristol
6/3/01 15:47,Murfreesboro,TN,Flash,less than a second,strange flash of something shiny over Rutherford County TN.
5/17/01 23:00,Banner,TN,Sphere,7 min,Three of us were standing outside in the dark. We observed how clear the night sky was and could see some constellations. Two moving
5/12/01 22:00,Franklin,TN,Formation,2 minutes,Triangular formation viewed in franklin tn. Arc shaped flight path than dissapeared.
5/7/01 22:00,Morristown,TN,Light,watching the night sky,Saw light in night sky that was glowing a yellowish bright color moving slowly and then disappearing in the atmosphere with orange wave
4/29/01 21:13,Memphis,TN,Other,3 min,the star at the top and at the bottom right were not stars but planets the other object was bluesh and jetted off quickly.
4/29/01 14:00,Nashville,TN,Light,5-10 minutes,Slow moving lights in the sky over Nashville.
4/28/01 20:12,Antioch,TN,Circle,Not that Long,An Orange/Yellow Ball of Light from No where.
4/24/01 23:55,Bristol,TN,,35 minutes,Man reports witnessing a very bright light below solid overcast in the southern sky
4/16/01 07:00,Murfreesboro,TN,Disk,3 to 5 minutes,Mysterious Disk seen lying on ditch of Tennessee Highway 840. Seen from an adjecent non-connected road. Then the Disk Vanished.
4/15/01 22:30,Mount Juliet,TN,Light,over 70 minutes,red light go fast white light means it stopped and pulse fast red before moving.
3/12/01 21:00,Reliance,TN,Light,over an hour,2 bright lights-not planets or stars
2/25/01 16:00,Hartsville,TN,Light,currently happening,bright light hoovers over tennessee ski....
2/17/01 16:00,Nashville,TN,Cross,30 mins,White cross shaped object with the sun reflecting off a little.
2/10/01 17:30,Clingman's Dome (Great Smoky Mountains National Park),TN,Rectangle,one minute,Very fast bright metallic silver rectangle spotted was pursued by military-style jets
2/9/01 13:00,Kingston Springs,TN,Light,2 minutes,A LOUD NOISE AND BLINDING LIGHT AND THEN A ACTUAL ENCOUNTER.
2/8/01 18:36,Manchester,TN,Fireball,approx 4 sec,My wife and I were traveling east on US 55 and were approximately one mile west of Manchester Tn.. The time was 6:36 PM CST And the we
2/7/01 18:05,Old Hickory,TN,Circle,3 seconds,Round flying object. Very fast and quite
2/2/01 19:20,Bristol,TN,Light,10 minutes,bright multi colored object moving north over east tenn and southwest Va
12/28/00 12:15,Murphreesboro,TN,Flash,.30 seconds,Shiny speck of metal or something.
12/16/00 00:45,Pioneer,TN,Light,30-45 seconds,sun-sized light after midnight
12/13/00 20:40,Cleveland,TN,Triangle,3 minutes,i was coming home from church on a country road iseen a v shaped ufo flying from the right it flue over me and landed in a feild.it w
11/26/00 21:00,Jellico,TN,Circle,10 Min.,We saw the object over a mountain facing south. The object seemed to fade from bright to dim several times. The bottom half seemed to
11/19/00 17:30,Jamestown,TN,Light,2-3 minutes,I've watched the skies for several years and have never seen any lights do what these 3 did.
11/12/00 09:00,Jackson,TN,Triangle,30se,Sitting on my back porch smoking I saw this thing floating across the sky going north to south with no sound.It had 5 large lights that
11/3/00 13:00,Ashland City,TN,Triangle,2 minutes,I saw two huge triangular airships leaving thick contrails.
10/23/00 14:00,Nolensville,TN,Unknown,1 min,Military helicopter gives chase at unknown aircraft
10/19/00 06:30,Old Fort,TN,Cigar,20-30 sec,A yellow color cigar shaped objet moving very fast from NW to SW.
10/13/00 18:45,Knoxville,TN,Cylinder,2 minutes,"Two metalllic cylinders and an unusual ""plane"" sighted flying from SW to ENE and ENE to SW in Knoxville."
10/12/00 15:00,Mountain City,TN,Disk,30 seconds,Broad Daylight Flying Saucer
10/2/00 17:00,Crossville,TN,Circle,two hours,more pulsing red lights in the night sky
10/1/00 22:00,Jackson,TN,Triangle,appox. 2 mins,Three glowing spheres under dark triangular shape no sound
9/30/00 20:00,Memphis,TN,Light,1-2 min.,UFO over Memphis
9/28/00 20:30,Morristown,TN,Triangle,8 minutes,Huge triangular craft with six white rectangular lights on the bottom witnessed in EastTennessee
9/21/00 13:30,Portland,TN,Circle,five to ten seconds,circular object turning orange as it sped away very quickly.
8/21/00 19:35,Mt. Juliet,TN,Cylinder,1 minute,Two cylinder shaped objects moving quickly across the sky making no noise.
8/11/00 21:00,Franklin,TN,Formation,4 minutes,This object was two(2) bright lights approx. -1 magnitude travelling northwest to southeast. Lights maintianed equal distant separati
8/9/00 21:50,Houston County,TN,Sphere,1 minute,Two large gold low flying sphere's move slowly silently across the horizon.
7/14/00 18:00,Memphis,TN,Triangle,less than a minute,another triangle seen in memphis tennessee
7/12/00,Nashville,TN,Sphere,25:00-25:40,while driving on a backroad two passengers saw a sphere hovering in the sky. It dissapeared in a white flash after 30 minutes.
7/7/00 22:00,Kingston Springs,TN,Fireball,"3 @ 5"" ea",first sighting - white light / red light disc shaped low flying / near interstate exit second and third sighting - both occurred off
6/20/00 21:50,Church Hill,TN,Flash,1 minute,Explosion in the air.
6/1/00 17:00,Chattanooga,TN,Disk,6 minutes,My brother and I were out playing basketball and then took a break. As I leaned against a pole i looked into the sky and saw a really
5/23/00 23:00,Cleveland,TN,Triangle,????,I went back to bed.
5/17/00 19:30,Jackson,TN,Sphere,30-45 sec.,Sphere of light traveling in opposite direction disappear before near certain collison
5/9/00 12:00,Knoxville,TN,Circle,do not know,2 white objects traveled a long distance faster than any plane could have done.
4/19/00 18:15,Jellico,TN,Disk,very short,taking pictures found object on a picture when we got home .
4/6/00 20:00,Chattanooga,TN,Other,2 hrs.,I am a TV Meteorologist in CHattanooga and I received a number of calls about the aurora borealis..This is rare in this part of the wo
3/24/00 00:30,Lake City (sighting/50 miles north of),TN,Triangle,10 to 15 seconds,Our car was stopped in traffic TN so-bound I-75 approx 00:30. We saw a tour-bus size triangle covered in blue lights pass low over
3/21/00 14:45,Dickson,TN,Cylinder,30sec.,Waiting at a stop light i saw a jet in the distance.I was looking at it's trail when i saw a large tube shaped object floating in the s
3/17/00 10:15,Memphis,TN,Diamond,,We saw crafts that shot some kind of beam at each other in the air.
3/9/00 20:45,Smyrna,TN,Fireball,3 or 4 seconds,A large spherical object slowly descended through the sky in a diagonal until it disappeared behind the tree line. It glowed in a bri
3/2/00 01:15,Memphis,TN,Formation,30 min +,A formation of 3 objects in a straight line unmoving occasionally changing color.
1/20/00 22:22,Memphis,TN,Other,approx 6 seconds,An arc-shaped object moving at possibly a high rate of speed was seen moving from overhead to south. The object was almost invisible
1/16/00 01:30,Christiana,TN,Rectangle,5 min.,I witnessed a elongated triangular shaped object glide/float across a nearly full moon.
1/10/00 20:30,Sevierville,TN,Oval,15 mins,i walked outside to get something from the car.an oval shape custer of lights flying really low was flying westnorth-west very slowly.
1/10/00 09:15,Brentwood,TN,Disk,4 minutes,Saucer shaped craftthat faded in out of view 3 times.
1/8/00 07:30,Knoxville,TN,Cigar,15 min,2 Cigar shaped ships flying over Knoxville TN
1/3/00 15:18,Union City,TN,Cigar,3-4 minutes,me and a friend were target shooting and saw saw this thing in the sky
12/30/99 00:09,McMinnville,TN,Unknown,30 to 45 sec,JUST PAST MIDNIGHT I LOOKED OUT MY LIVING ROOM WINDOW AND SAW A LOW FLYING FLASHING LIGHT GOING EAST ONLY ABOUT 150' TO 200' OFF THE GR
12/25/99 04:00,Nashville,TN,Light,1 hour+,Viewed a UFO through bedroom window on Christmas Eve as its bright lights woke me up; kept me awake for over an hour as it moved slowl
12/24/99 23:55,Milton,TN,Triangle,10-15 MIN,The object appeared to be a very large star. From underneath it appeared to be triangular with lights around the base with a vapor trai
12/19/99 03:00,Spring Hill,TN,Changing,2 MINS,ONE LEAD - FOUR MIDDLE - TWO BACK. DIAMOND SHAPE FOLLOWING A WATER LIKE WAVE. DARK BROWN TO A ORANGE GOLD COLOR
12/5/99 05:15,Knoxville,TN,Fireball,10 seconds,Green fireball falling from sky
12/5/99 04:00,Manchester,TN,Light,10 seconds,At around 04:00hrs while stopping a traffic violator the complete southern sky lit up bright blue. This event illuminated the entire ar
11/21/99 02:10,Rickman,TN,Other,4 minutes,THIER WHERE VERY BRIGHT AT FIRST WHEN ME AND MY WIFE SEEN THEM WE THOUGHT THAT THEY WHERE STARS. BUT TO OUR AMAZEMENT THEY SEEMED TO FL
11/17/99 16:30,Franklin,TN,Unknown,3-5min,I was on my balconay look at the sky when i saw a orang comtrail comming towards my direction i also noticed an other trail going sout
11/16/99 22:15,Smithville,TN,Teardrop,5 min,2 lights were seen just above the tree lines about a mile away from my home. i watched these lights for several minutes then they shot
11/16/99 18:20,Gallatin,TN,Fireball,30 sec (approx),Green fireball - west to east flight - low on northern horizon - appeared to be color of burning copper - unable to gauge speed (no dis
11/16/99 18:10,Sumner county,TN,Fireball,10 seconds,Summary will include the UFO i saw while sitting in a car. I believe this not to have anything to do with a meteir shower because if th
11/16/99 18:05,Jamestown,TN,Light,30 to 45 sec.,A very slow moving white with a greenish tint streak of light moving in a northern direction.
11/16/99 18:05,Cookeville,TN,Oval,20sec.,At a stop light caught my eye moving west to east north of cookeville. It was huge. It was moving in a downward slant. I watch it unti
11/16/99 18:05,Jamestown,TN,Light,2-3 minutes,Husband saw a greenish/white streak that seemed to be motionless
11/16/99 18:00,Nashville (on I-24 60 mi. southeast of),TN,Fireball,1.5MIN,FIREBALL GOING WEST TO EAST WITH A LONG FIREY TAIL. iI WATCHED THIS OBJECT FOR A MINUTE AND A HALF AS I WAS DRIVING WEST BOUND ON I-24
11/15/99 22:15,Smithville,TN,Circle,5min,6 miles north of smithville on hwy 56 - just beyond the tree line were 2 round beams of light just hovering for over 5 minutes then the
11/15/99 17:00,Murfreesboro,TN,Sphere,six seconds,Large spherical object seen in Murfreesboro TN.
11/14/99 02:06,Bolivar,TN,Light,34 minute,A number of objects moving in sky with red and white lights in specific formations
11/12/99 20:30,Gray,TN,Triangle,1 MIN,TRIANGLULAR SHAPED OBJECT OBSERVED APPROX 60 FEET ABOVE GROUND. SEVERAL LIGHTS AROUND PERIMITER MANY COLORS. APPEARED TO HOVER. SOU
11/4/99 23:11,Radcliffe,TN,Unknown,30 seconds,3 HUGE ultra bright lights over road. Broke into 5. Disappeared instantly at an angle down. No sound. Ft Knox boundary.
11/3/99 03:30,Jackson,TN,Light,30sec,heading eastbound I-40 about 2 miles west of Jackson and saw a red light that I thought was a meteorite red in color. It came half way
10/27/99 23:55,Knoxville,TN,Unknown,40 sec.,Unusual lights in sky moving and fading out.
10/22/99 01:30,Ripley,TN,Rectangle,30 min,Saw large rectangular object apparently cloaking itself in Tn. in 1990
10/21/99 21:00,Maryville/Sevierville,TN,Cylinder,1 min,I heard area coyotes and dogs howling very loudly and when I went out side I saw a cylindar shaped object with lights in a repeated cir
10/17/99 03:30,Signal Mountain,TN,Cigar,1 hour,saw bright orange light making qiuck movementsfollowed us for approximitly five miles intersepted car causing electrical failure in c
10/16/99 21:35,Chattanooga,TN,Triangle,2-3 minutes,I witnessed 3 low-flying triangular-shaped black crafts traveling to the north northwest on Saturday 16 1999.
10/15/99 19:20,Newbern,TN,Light,2 min.,amber colored lightmoves slowly occasionally disappears in plain view
10/14/99 22:10,Nashville,TN,Light,11 minutes,I saw a light flash like a plane out in my back yard but it didn't flash again so it caught my attention. Then it flashed again (white)
9/29/99 18:45,Nashville,TN,Fireball,5 minutes,"fiery object looking like craft in movie ""it came from outer space"" or comet-like with fiery tail observed traveling in nw direction fr"
9/25/99 20:00,Nashville,TN,Cigar,1 minute?,silver cigar shape
